14:53:06.158426 IP Broadcom.Home.36621 > 192.168.1.3.12345: Flags [P.], seq 887553194:887553234, ack 2461355094, win 913, options [nop,nop,TS val 444779988 ecr 45235140], length 40
14:53:06.259404 IP Broadcom.Home.36621 > 192.168.1.3.12345: Flags [.], ack 5, win 913, options [nop,nop,TS val 444780088 ecr 45235221], length 0
14:53:06.359657 IP Broadcom.Home.36621 > 192.168.1.3.12345: Flags [.], ack 9, win 913, options [nop,nop,TS val 444780189 ecr 45235246], length 0
14:53:06.753335 IP Broadcom.Home.36621 > 192.168.1.3.12345: Flags [P.], seq 40:107, ack 9, win 913, options [nop,nop,TS val 444780583 ecr 45235246], length 67
14:53:06.762748 IP Broadcom.Home.36621 > 192.168.1.3.12345: Flags [.], ack 25, win 913, options [nop,nop,TS val 444780592 ecr 45235347], length 0
14:53:06.981294 IP Broadcom.Home.36621 > 192.168.1.3.12345: Flags [P.], seq 107:117, ack 25, win 913, options [nop,nop,TS val 444780811 ecr 45235347], length 10
14:53:06.981694 IP Broadcom.Home.36621 > 192.168.1.3.12345: Flags [.], ack 59, win 913, options [nop,nop,TS val 444780811 ecr 45235401], length 0
14:53:07.202281 IP Broadcom.Home.36621 > 192.168.1.3.12345: Flags [P.], seq 117:158, ack 59, win 913, options [nop,nop,TS val 444781032 ecr 45235401], length 41
14:53:07.303074 IP Broadcom.Home.36621 > 192.168.1.3.12345: Flags [.], ack 63, win 913, options [nop,nop,TS val 444781132 ecr 45235482], length 0
14:53:07.403480 IP Broadcom.Home.36621 > 192.168.1.3.12345: Flags [.], ack 67, win 913, options [nop,nop,TS val 444781233 ecr 45235507], length 0
14:53:07.780173 IP Broadcom.Home.36621 > 192.168.1.3.12345: Flags [P.], seq 158:224, ack 67, win 913, options [nop,nop,TS val 444781610 ecr 45235507], length 66
14:53:07.781514 IP Broadcom.Home.36621 > 192.168.1.3.12345: Flags [.], ack 83, win 913, options [nop,nop,TS val 444781611 ecr 45235601], length 0
14:53:07.999107 IP Broadcom.Home.36621 > 192.168.1.3.12345: Flags [P.], seq 224:234, ack 83, win 913, options [nop,nop,TS val 444781829 ecr 45235601], length 10
14:53:07.999540 IP Broadcom.Home.36621 > 192.168.1.3.12345: Flags [.], ack 117, win 913, options [nop,nop,TS val 444781829 ecr 45235656], length 0
14:53:08.220107 IP Broadcom.Home.36621 > 192.168.1.3.12345: Flags [P.], seq 234:274, ack 117, win 913, options [nop,nop,TS val 444782050 ecr 45235656], length 40
14:53:08.320954 IP Broadcom.Home.36621 > 192.168.1.3.12345: Flags [.], ack 121, win 913, options [nop,nop,TS val 444782150 ecr 45235736], length 0
14:53:08.421121 IP Broadcom.Home.36621 > 192.168.1.3.12345: Flags [.], ack 125, win 913, options [nop,nop,TS val 444782251 ecr 45235761], length 0
14:53:08.821094 IP Broadcom.Home.36621 > 192.168.1.3.12345: Flags [P.], seq 274:340, ack 125, win 913, options [nop,nop,TS val 444782651 ecr 45235761], length 66
14:53:08.822444 IP Broadcom.Home.36621 > 192.168.1.3.12345: Flags [.], ack 141, win 913, options [nop,nop,TS val 444782652 ecr 45235861], length 0
14:53:09.039962 IP Broadcom.Home.36621 > 192.168.1.3.12345: Flags [P.], seq 340:350, ack 141, win 913, options [nop,nop,TS val 444782870 ecr 45235861], length 10
14:53:09.040351 IP Broadcom.Home.36621 > 192.168.1.3.12345: Flags [.], ack 175, win 913, options [nop,nop,TS val 444782870 ecr 45235916], length 0
14:53:09.260914 IP Broadcom.Home.36621 > 192.168.1.3.12345: Flags [P.], seq 350:391, ack 175, win 913, options [nop,nop,TS val 444783091 ecr 45235916], length 41
14:53:09.361565 IP Broadcom.Home.36621 > 192.168.1.3.12345: Flags [.], ack 179, win 913, options [nop,nop,TS val 444783191 ecr 45235996], length 0
14:53:09.461926 IP Broadcom.Home.36621 > 192.168.1.3.12345: Flags [.], ack 183, win 913, options [nop,nop,TS val 444783292 ecr 45236021], length 0
14:53:09.854827 IP Broadcom.Home.36621 > 192.168.1.3.12345: Flags [P.], seq 391:457, ack 183, win 913, options [nop,nop,TS val 444783685 ecr 45236021], length 66
14:53:09.858663 IP Broadcom.Home.36621 > 192.168.1.3.12345: Flags [.], ack 199, win 913, options [nop,nop,TS val 444783688 ecr 45236121], length 0
14:53:10.077774 IP Broadcom.Home.36621 > 192.168.1.3.12345: Flags [P.], seq 457:467, ack 199, win 913, options [nop,nop,TS val 444783908 ecr 45236121], length 10
14:53:10.078161 IP Broadcom.Home.36621 > 192.168.1.3.12345: Flags [.], ack 233, win 913, options [nop,nop,TS val 444783908 ecr 45236175], length 0
14:53:10.298753 IP Broadcom.Home.36621 > 192.168.1.3.12345: Flags [P.], seq 467:507, ack 233, win 913, options [nop,nop,TS val 444784129 ecr 45236175], length 40
14:53:10.400538 IP Broadcom.Home.36621 > 192.168.1.3.12345: Flags [.], ack 237, win 913, options [nop,nop,TS val 444784230 ecr 45236256], length 0
14:53:10.500972 IP Broadcom.Home.36621 > 192.168.1.3.12345: Flags [.], ack 241, win 913, options [nop,nop,TS val 444784331 ecr 45236281], length 0
14:53:10.885766 IP Broadcom.Home.36621 > 192.168.1.3.12345: Flags [P.], seq 507:574, ack 241, win 913, options [nop,nop,TS val 444784716 ecr 45236281], length 67
14:53:10.886967 IP Broadcom.Home.36621 > 192.168.1.3.12345: Flags [.], ack 257, win 913, options [nop,nop,TS val 444784717 ecr 45236378], length 0
14:53:11.105633 IP Broadcom.Home.36621 > 192.168.1.3.12345: Flags [P.], seq 574:584, ack 257, win 913, options [nop,nop,TS val 444784936 ecr 45236378], length 10
14:53:11.106048 IP Broadcom.Home.36621 > 192.168.1.3.12345: Flags [.], ack 291, win 913, options [nop,nop,TS val 444784936 ecr 45236432], length 0
14:53:11.326586 IP Broadcom.Home.36621 > 192.168.1.3.12345: Flags [P.], seq 584:624, ack 291, win 913, options [nop,nop,TS val 444785157 ecr 45236432], length 40
14:53:11.427296 IP Broadcom.Home.36621 > 192.168.1.3.12345: Flags [.], ack 295, win 913, options [nop,nop,TS val 444785257 ecr 45236513], length 0
14:53:11.527733 IP Broadcom.Home.36621 > 192.168.1.3.12345: Flags [.], ack 299, win 913, options [nop,nop,TS val 444785358 ecr 45236538], length 0
14:53:11.923567 IP Broadcom.Home.36621 > 192.168.1.3.12345: Flags [P.], seq 624:690, ack 299, win 913, options [nop,nop,TS val 444785754 ecr 45236538], length 66
14:53:11.930680 IP Broadcom.Home.36621 > 192.168.1.3.12345: Flags [.], ack 315, win 913, options [nop,nop,TS val 444785761 ecr 45236639], length 0
14:53:12.148468 IP Broadcom.Home.36621 > 192.168.1.3.12345: Flags [P.], seq 690:700, ack 315, win 913, options [nop,nop,TS val 444785979 ecr 45236639], length 10
14:53:12.148862 IP Broadcom.Home.36621 > 192.168.1.3.12345: Flags [.], ack 349, win 913, options [nop,nop,TS val 444785979 ecr 45236693], length 0
14:53:12.369430 IP Broadcom.Home.36621 > 192.168.1.3.12345: Flags [P.], seq 700:740, ack 349, win 913, options [nop,nop,TS val 444786200 ecr 45236693], length 40
14:53:12.470247 IP Broadcom.Home.36621 > 192.168.1.3.12345: Flags [.], ack 353, win 913, options [nop,nop,TS val 444786300 ecr 45236773], length 0
14:53:12.570739 IP Broadcom.Home.36621 > 192.168.1.3.12345: Flags [.], ack 357, win 913, options [nop,nop,TS val 444786401 ecr 45236798], length 0
14:53:12.958372 IP Broadcom.Home.36621 > 192.168.1.3.12345: Flags [P.], seq 740:806, ack 357, win 913, options [nop,nop,TS val 444786789 ecr 45236798], length 66
14:53:12.959680 IP Broadcom.Home.36621 > 192.168.1.3.12345: Flags [.], ack 373, win 913, options [nop,nop,TS val 444786790 ecr 45236896], length 0
14:53:13.177314 IP Broadcom.Home.36621 > 192.168.1.3.12345: Flags [P.], seq 806:816, ack 373, win 913, options [nop,nop,TS val 444787008 ecr 45236896], length 10
14:53:13.177733 IP Broadcom.Home.36621 > 192.168.1.3.12345: Flags [.], ack 407, win 913, options [nop,nop,TS val 444787008 ecr 45236950], length 0
14:53:13.398272 IP Broadcom.Home.36621 > 192.168.1.3.12345: Flags [P.], seq 816:858, ack 407, win 913, options [nop,nop,TS val 444787229 ecr 45236950], length 42
14:53:13.499294 IP Broadcom.Home.36621 > 192.168.1.3.12345: Flags [.], ack 411, win 913, options [nop,nop,TS val 444787330 ecr 45237031], length 0
14:53:13.599669 IP Broadcom.Home.36621 > 192.168.1.3.12345: Flags [.], ack 415, win 913, options [nop,nop,TS val 444787430 ecr 45237056], length 0
14:53:13.986294 IP Broadcom.Home.36621 > 192.168.1.3.12345: Flags [P.], seq 858:924, ack 415, win 913, options [nop,nop,TS val 444787817 ecr 45237056], length 66
14:53:13.995403 IP Broadcom.Home.36621 > 192.168.1.3.12345: Flags [.], ack 431, win 913, options [nop,nop,TS val 444787826 ecr 45237155], length 0
14:53:14.213143 IP Broadcom.Home.36621 > 192.168.1.3.12345: Flags [P.], seq 924:934, ack 431, win 913, options [nop,nop,TS val 444788044 ecr 45237155], length 10
14:53:14.213554 IP Broadcom.Home.36621 > 192.168.1.3.12345: Flags [.], ack 465, win 913, options [nop,nop,TS val 444788044 ecr 45237209], length 0
14:53:14.434114 IP Broadcom.Home.36621 > 192.168.1.3.12345: Flags [P.], seq 934:974, ack 465, win 913, options [nop,nop,TS val 444788265 ecr 45237209], length 40
14:53:14.535535 IP Broadcom.Home.36621 > 192.168.1.3.12345: Flags [.], ack 469, win 913, options [nop,nop,TS val 444788366 ecr 45237290], length 0
14:53:14.635710 IP Broadcom.Home.36621 > 192.168.1.3.12345: Flags [.], ack 473, win 913, options [nop,nop,TS val 444788466 ecr 45237315], length 0
14:53:15.076035 IP Broadcom.Home.36621 > 192.168.1.3.12345: Flags [P.], seq 974:1041, ack 473, win 913, options [nop,nop,TS val 444788907 ecr 45237315], length 67
14:53:15.080011 IP Broadcom.Home.36621 > 192.168.1.3.12345: Flags [.], ack 489, win 913, options [nop,nop,TS val 444788911 ecr 45237426], length 0
14:53:15.296988 IP Broadcom.Home.36621 > 192.168.1.3.12345: Flags [P.], seq 1041:1051, ack 489, win 913, options [nop,nop,TS val 444789128 ecr 45237426], length 10
14:53:15.297397 IP Broadcom.Home.36621 > 192.168.1.3.12345: Flags [.], ack 523, win 913, options [nop,nop,TS val 444789128 ecr 45237480], length 0
14:53:15.517971 IP Broadcom.Home.36621 > 192.168.1.3.12345: Flags [P.], seq 1051:1092, ack 523, win 913, options [nop,nop,TS val 444789349 ecr 45237480], length 41
14:53:15.618595 IP Broadcom.Home.36621 > 192.168.1.3.12345: Flags [.], ack 527, win 913, options [nop,nop,TS val 444789449 ecr 45237560], length 0
14:53:15.718985 IP Broadcom.Home.36621 > 192.168.1.3.12345: Flags [.], ack 531, win 913, options [nop,nop,TS val 444789550 ecr 45237586], length 0
14:53:16.121986 IP Broadcom.Home.36621 > 192.168.1.3.12345: Flags [P.], seq 1092:1158, ack 531, win 913, options [nop,nop,TS val 444789953 ecr 45237586], length 66
14:53:16.130728 IP Broadcom.Home.36621 > 192.168.1.3.12345: Flags [.], ack 547, win 913, options [nop,nop,TS val 444789961 ecr 45237689], length 0
14:53:16.347830 IP Broadcom.Home.36621 > 192.168.1.3.12345: Flags [P.], seq 1158:1168, ack 547, win 913, options [nop,nop,TS val 444790179 ecr 45237689], length 10
14:53:16.349164 IP Broadcom.Home.36621 > 192.168.1.3.12345: Flags [.], ack 581, win 913, options [nop,nop,TS val 444790180 ecr 45237743], length 0
14:53:16.569787 IP Broadcom.Home.36621 > 192.168.1.3.12345: Flags [P.], seq 1168:1209, ack 581, win 913, options [nop,nop,TS val 444790401 ecr 45237743], length 41
14:53:16.670701 IP Broadcom.Home.36621 > 192.168.1.3.12345: Flags [.], ack 585, win 913, options [nop,nop,TS val 444790501 ecr 45237823], length 0
14:53:16.770852 IP Broadcom.Home.36621 > 192.168.1.3.12345: Flags [.], ack 589, win 913, options [nop,nop,TS val 444790602 ecr 45237849], length 0
14:53:17.093793 IP Broadcom.Home.36621 > 192.168.1.3.12345: Flags [P.], seq 1209:1275, ack 589, win 913, options [nop,nop,TS val 444790925 ecr 45237849], length 66
14:53:17.095220 IP Broadcom.Home.36621 > 192.168.1.3.12345: Flags [.], ack 605, win 913, options [nop,nop,TS val 444790926 ecr 45237930], length 0
14:53:17.312691 IP Broadcom.Home.36621 > 192.168.1.3.12345: Flags [P.], seq 1275:1285, ack 605, win 913, options [nop,nop,TS val 444791144 ecr 45237930], length 10
14:53:17.313098 IP Broadcom.Home.36621 > 192.168.1.3.12345: Flags [.], ack 640, win 913, options [nop,nop,TS val 444791144 ecr 45237984], length 0
14:53:17.533670 IP Broadcom.Home.36621 > 192.168.1.3.12345: Flags [P.], seq 1285:1326, ack 640, win 913, options [nop,nop,TS val 444791365 ecr 45237984], length 41
14:53:17.634465 IP Broadcom.Home.36621 > 192.168.1.3.12345: Flags [.], ack 644, win 913, options [nop,nop,TS val 444791465 ecr 45238064], length 0
14:53:17.734810 IP Broadcom.Home.36621 > 192.168.1.3.12345: Flags [.], ack 648, win 913, options [nop,nop,TS val 444791566 ecr 45238090], length 0
14:53:18.127603 IP Broadcom.Home.36621 > 192.168.1.3.12345: Flags [P.], seq 1326:1394, ack 648, win 913, options [nop,nop,TS val 444791959 ecr 45238090], length 68
14:53:18.132945 IP Broadcom.Home.36621 > 192.168.1.3.12345: Flags [.], ack 664, win 913, options [nop,nop,TS val 444791964 ecr 45238189], length 0
14:53:18.350544 IP Broadcom.Home.36621 > 192.168.1.3.12345: Flags [P.], seq 1394:1404, ack 664, win 913, options [nop,nop,TS val 444792182 ecr 45238189], length 10
14:53:18.350991 IP Broadcom.Home.36621 > 192.168.1.3.12345: Flags [.], ack 699, win 913, options [nop,nop,TS val 444792182 ecr 45238244], length 0
14:53:18.571514 IP Broadcom.Home.36621 > 192.168.1.3.12345: Flags [P.], seq 1404:1446, ack 699, win 913, options [nop,nop,TS val 444792403 ecr 45238244], length 42
14:53:18.672293 IP Broadcom.Home.36621 > 192.168.1.3.12345: Flags [.], ack 703, win 913, options [nop,nop,TS val 444792503 ecr 45238324], length 0
14:53:18.772576 IP Broadcom.Home.36621 > 192.168.1.3.12345: Flags [.], ack 707, win 913, options [nop,nop,TS val 444792604 ecr 45238349], length 0
14:53:19.159530 IP Broadcom.Home.36621 > 192.168.1.3.12345: Flags [P.], seq 1446:1514, ack 707, win 913, options [nop,nop,TS val 444792991 ecr 45238349], length 68
14:53:19.161002 IP Broadcom.Home.36621 > 192.168.1.3.12345: Flags [.], ack 723, win 913, options [nop,nop,TS val 444792992 ecr 45238446], length 0
14:53:19.378384 IP Broadcom.Home.36621 > 192.168.1.3.12345: Flags [P.], seq 1514:1524, ack 723, win 913, options [nop,nop,TS val 444793210 ecr 45238446], length 10
14:53:19.378807 IP Broadcom.Home.36621 > 192.168.1.3.12345: Flags [.], ack 757, win 913, options [nop,nop,TS val 444793210 ecr 45238501], length 0
14:53:19.600342 IP Broadcom.Home.36621 > 192.168.1.3.12345: Flags [P.], seq 1524:1564, ack 757, win 913, options [nop,nop,TS val 444793432 ecr 45238501], length 40
14:53:19.701042 IP Broadcom.Home.36621 > 192.168.1.3.12345: Flags [.], ack 761, win 913, options [nop,nop,TS val 444793532 ecr 45238581], length 0
14:53:19.801265 IP Broadcom.Home.36621 > 192.168.1.3.12345: Flags [.], ack 765, win 913, options [nop,nop,TS val 444793632 ecr 45238606], length 0
14:53:20.201245 IP Broadcom.Home.36621 > 192.168.1.3.12345: Flags [P.], seq 1564:1630, ack 765, win 913, options [nop,nop,TS val 444794033 ecr 45238606], length 66
14:53:20.205403 IP Broadcom.Home.36621 > 192.168.1.3.12345: Flags [.], ack 781, win 913, options [nop,nop,TS val 444794037 ecr 45238707], length 0
14:53:20.423184 IP Broadcom.Home.36621 > 192.168.1.3.12345: Flags [P.], seq 1630:1640, ack 781, win 913, options [nop,nop,TS val 444794255 ecr 45238707], length 10
14:53:20.423616 IP Broadcom.Home.36621 > 192.168.1.3.12345: Flags [.], ack 815, win 913, options [nop,nop,TS val 444794255 ecr 45238762], length 0
14:53:20.644184 IP Broadcom.Home.36621 > 192.168.1.3.12345: Flags [P.], seq 1640:1681, ack 815, win 913, options [nop,nop,TS val 444794476 ecr 45238762], length 41
14:53:20.744857 IP Broadcom.Home.36621 > 192.168.1.3.12345: Flags [.], ack 819, win 913, options [nop,nop,TS val 444794576 ecr 45238842], length 0
14:53:20.852622 IP Broadcom.Home.36621 > 192.168.1.3.12345: Flags [.], ack 823, win 913, options [nop,nop,TS val 444794684 ecr 45238867], length 0
14:53:21.224184 IP Broadcom.Home.36621 > 192.168.1.3.12345: Flags [P.], seq 1681:1747, ack 823, win 913, options [nop,nop,TS val 444795056 ecr 45238867], length 66
14:53:21.230695 IP Broadcom.Home.36621 > 192.168.1.3.12345: Flags [.], ack 839, win 913, options [nop,nop,TS val 444795062 ecr 45238964], length 0
14:53:21.448045 IP Broadcom.Home.36621 > 192.168.1.3.12345: Flags [P.], seq 1747:1757, ack 839, win 913, options [nop,nop,TS val 444795280 ecr 45238964], length 10
14:53:21.448469 IP Broadcom.Home.36621 > 192.168.1.3.12345: Flags [.], ack 873, win 913, options [nop,nop,TS val 444795280 ecr 45239018], length 0
14:53:21.668988 IP Broadcom.Home.36621 > 192.168.1.3.12345: Flags [P.], seq 1757:1797, ack 873, win 913, options [nop,nop,TS val 444795501 ecr 45239018], length 40
14:53:21.769827 IP Broadcom.Home.36621 > 192.168.1.3.12345: Flags [.], ack 877, win 913, options [nop,nop,TS val 444795601 ecr 45239098], length 0
14:53:21.870189 IP Broadcom.Home.36621 > 192.168.1.3.12345: Flags [.], ack 881, win 913, options [nop,nop,TS val 444795702 ecr 45239123], length 0
14:53:22.262022 IP Broadcom.Home.36621 > 192.168.1.3.12345: Flags [P.], seq 1797:1863, ack 881, win 913, options [nop,nop,TS val 444796094 ecr 45239123], length 66
14:53:22.263562 IP Broadcom.Home.36621 > 192.168.1.3.12345: Flags [.], ack 897, win 913, options [nop,nop,TS val 444796095 ecr 45239222], length 0
14:53:22.480868 IP Broadcom.Home.36621 > 192.168.1.3.12345: Flags [P.], seq 1863:1873, ack 897, win 913, options [nop,nop,TS val 444796313 ecr 45239222], length 10
14:53:22.481279 IP Broadcom.Home.36621 > 192.168.1.3.12345: Flags [.], ack 931, win 913, options [nop,nop,TS val 444796313 ecr 45239276], length 0
14:53:22.701847 IP Broadcom.Home.36621 > 192.168.1.3.12345: Flags [P.], seq 1873:1914, ack 931, win 913, options [nop,nop,TS val 444796534 ecr 45239276], length 41
14:53:22.802845 IP Broadcom.Home.36621 > 192.168.1.3.12345: Flags [.], ack 935, win 913, options [nop,nop,TS val 444796634 ecr 45239356], length 0
14:53:22.904090 IP Broadcom.Home.36621 > 192.168.1.3.12345: Flags [.], ack 939, win 913, options [nop,nop,TS val 444796736 ecr 45239382], length 0
14:53:23.294870 IP Broadcom.Home.36621 > 192.168.1.3.12345: Flags [P.], seq 1914:1981, ack 939, win 913, options [nop,nop,TS val 444797127 ecr 45239382], length 67
14:53:23.296343 IP Broadcom.Home.36621 > 192.168.1.3.12345: Flags [.], ack 955, win 913, options [nop,nop,TS val 444797128 ecr 45239480], length 0
14:53:23.513707 IP Broadcom.Home.36621 > 192.168.1.3.12345: Flags [P.], seq 1981:1991, ack 955, win 913, options [nop,nop,TS val 444797346 ecr 45239480], length 10
14:53:23.514193 IP Broadcom.Home.36621 > 192.168.1.3.12345: Flags [.], ack 989, win 913, options [nop,nop,TS val 444797346 ecr 45239534], length 0
14:53:23.733693 IP Broadcom.Home.36621 > 192.168.1.3.12345: Flags [P.], seq 1991:2031, ack 989, win 913, options [nop,nop,TS val 444797566 ecr 45239534], length 40
14:53:23.834624 IP Broadcom.Home.36621 > 192.168.1.3.12345: Flags [.], ack 993, win 913, options [nop,nop,TS val 444797666 ecr 45239614], length 0
14:53:23.934822 IP Broadcom.Home.36621 > 192.168.1.3.12345: Flags [.], ack 997, win 913, options [nop,nop,TS val 444797767 ecr 45239640], length 0
14:53:25.366441 IP Broadcom.Home.36621 > 192.168.1.3.12345: Flags [P.], seq 2031:2097, ack 997, win 913, options [nop,nop,TS val 444799199 ecr 45239640], length 66
14:53:25.370712 IP Broadcom.Home.36621 > 192.168.1.3.12345: Flags [.], ack 1013, win 913, options [nop,nop,TS val 444799203 ecr 45239999], length 0
14:53:25.588412 IP Broadcom.Home.36621 > 192.168.1.3.12345: Flags [P.], seq 2097:2107, ack 1013, win 913, options [nop,nop,TS val 444799421 ecr 45239999], length 10
14:53:25.588854 IP Broadcom.Home.36621 > 192.168.1.3.12345: Flags [.], ack 1047, win 913, options [nop,nop,TS val 444799421 ecr 45240053], length 0
14:53:25.809368 IP Broadcom.Home.36621 > 192.168.1.3.12345: Flags [P.], seq 2107:2214, ack 1047, win 913, options [nop,nop,TS val 444799642 ecr 45240053], length 107
14:53:25.910345 IP Broadcom.Home.36621 > 192.168.1.3.12345: Flags [.], ack 1051, win 913, options [nop,nop,TS val 444799742 ecr 45240133], length 0
14:53:26.018751 IP Broadcom.Home.36621 > 192.168.1.3.12345: Flags [.], ack 1071, win 913, options [nop,nop,TS val 444799851 ecr 45240161], length 0
14:53:26.238298 IP Broadcom.Home.36621 > 192.168.1.3.12345: Flags [P.], seq 2214:2290, ack 1071, win 913, options [nop,nop,TS val 444800071 ecr 45240161], length 76
14:53:26.238674 IP Broadcom.Home.36621 > 192.168.1.3.12345: Flags [.], ack 1106, win 913, options [nop,nop,TS val 444800071 ecr 45240216], length 0
14:53:26.238974 IP Broadcom.Home.36621 > 192.168.1.3.12345: Flags [.], ack 1110, win 913, options [nop,nop,TS val 444800071 ecr 45240216], length 0
14:53:26.460273 IP Broadcom.Home.36621 > 192.168.1.3.12345: Flags [P.], seq 2290:2330, ack 1110, win 913, options [nop,nop,TS val 444800293 ecr 45240216], length 40
14:53:26.561107 IP Broadcom.Home.36621 > 192.168.1.3.12345: Flags [.], ack 1114, win 913, options [nop,nop,TS val 444800393 ecr 45240296], length 0
14:53:26.561934 IP Broadcom.Home.36621 > 192.168.1.3.12345: Flags [.], ack 1130, win 913, options [nop,nop,TS val 444800394 ecr 45240296], length 0
14:53:26.782207 IP Broadcom.Home.36621 > 192.168.1.3.12345: Flags [P.], seq 2330:2340, ack 1130, win 913, options [nop,nop,TS val 444800615 ecr 45240296], length 10
14:53:26.782564 IP Broadcom.Home.36621 > 192.168.1.3.12345: Flags [.], ack 1164, win 913, options [nop,nop,TS val 444800615 ecr 45240351], length 0
14:53:27.005189 IP Broadcom.Home.36621 > 192.168.1.3.12345: Flags [P.], seq 2340:2380, ack 1164, win 913, options [nop,nop,TS val 444800838 ecr 45240351], length 40
14:53:27.006438 IP Broadcom.Home.36621 > 192.168.1.3.12345: Flags [.], ack 1168, win 913, options [nop,nop,TS val 444800839 ecr 45240407], length 0
14:53:27.106257 IP Broadcom.Home.36621 > 192.168.1.3.12345: Flags [.], ack 1172, win 913, options [nop,nop,TS val 444800938 ecr 45240432], length 0
14:53:27.433110 IP Broadcom.Home.36621 > 192.168.1.3.12345: Flags [P.], seq 2380:2447, ack 1172, win 913, options [nop,nop,TS val 444801266 ecr 45240432], length 67
14:53:27.433877 IP Broadcom.Home.36621 > 192.168.1.3.12345: Flags [.], ack 1188, win 913, options [nop,nop,TS val 444801266 ecr 45240514], length 0
14:53:27.650064 IP Broadcom.Home.36621 > 192.168.1.3.12345: Flags [P.], seq 2447:2457, ack 1188, win 913, options [nop,nop,TS val 444801483 ecr 45240514], length 10
14:53:27.650488 IP Broadcom.Home.36621 > 192.168.1.3.12345: Flags [.], ack 1222, win 913, options [nop,nop,TS val 444801483 ecr 45240568], length 0
14:53:27.869054 IP Broadcom.Home.36621 > 192.168.1.3.12345: Flags [P.], seq 2457:2497, ack 1222, win 913, options [nop,nop,TS val 444801702 ecr 45240568], length 40
14:53:27.969951 IP Broadcom.Home.36621 > 192.168.1.3.12345: Flags [.], ack 1226, win 913, options [nop,nop,TS val 444801802 ecr 45240648], length 0
14:53:28.070232 IP Broadcom.Home.36621 > 192.168.1.3.12345: Flags [.], ack 1230, win 913, options [nop,nop,TS val 444801903 ecr 45240673], length 0
14:53:28.462013 IP Broadcom.Home.36621 > 192.168.1.3.12345: Flags [P.], seq 2497:2564, ack 1230, win 913, options [nop,nop,TS val 444802295 ecr 45240673], length 67
14:53:28.463610 IP Broadcom.Home.36621 > 192.168.1.3.12345: Flags [.], ack 1246, win 913, options [nop,nop,TS val 444802296 ecr 45240772], length 0
14:53:28.680940 IP Broadcom.Home.36621 > 192.168.1.3.12345: Flags [P.], seq 2564:2574, ack 1246, win 913, options [nop,nop,TS val 444802514 ecr 45240772], length 10
14:53:28.681360 IP Broadcom.Home.36621 > 192.168.1.3.12345: Flags [.], ack 1281, win 913, options [nop,nop,TS val 444802514 ecr 45240826], length 0
14:53:28.899908 IP Broadcom.Home.36621 > 192.168.1.3.12345: Flags [P.], seq 2574:2614, ack 1281, win 913, options [nop,nop,TS val 444802733 ecr 45240826], length 40
14:53:29.000698 IP Broadcom.Home.36621 > 192.168.1.3.12345: Flags [.], ack 1285, win 913, options [nop,nop,TS val 444802833 ecr 45240906], length 0
14:53:29.100970 IP Broadcom.Home.36621 > 192.168.1.3.12345: Flags [.], ack 1289, win 913, options [nop,nop,TS val 444802934 ecr 45240931], length 0
14:53:29.503823 IP Broadcom.Home.36621 > 192.168.1.3.12345: Flags [P.], seq 2614:2680, ack 1289, win 913, options [nop,nop,TS val 444803337 ecr 45240931], length 66
14:53:29.506772 IP Broadcom.Home.36621 > 192.168.1.3.12345: Flags [.], ack 1305, win 913, options [nop,nop,TS val 444803340 ecr 45241033], length 0
14:53:29.722821 IP Broadcom.Home.36621 > 192.168.1.3.12345: Flags [P.], seq 2680:2690, ack 1305, win 913, options [nop,nop,TS val 444803556 ecr 45241033], length 10
14:53:29.723205 IP Broadcom.Home.36621 > 192.168.1.3.12345: Flags [.], ack 1339, win 913, options [nop,nop,TS val 444803556 ecr 45241087], length 0
14:53:29.942788 IP Broadcom.Home.36621 > 192.168.1.3.12345: Flags [P.], seq 2690:2730, ack 1339, win 913, options [nop,nop,TS val 444803776 ecr 45241087], length 40
14:53:30.043541 IP Broadcom.Home.36621 > 192.168.1.3.12345: Flags [.], ack 1343, win 913, options [nop,nop,TS val 444803876 ecr 45241167], length 0
14:53:30.143767 IP Broadcom.Home.36621 > 192.168.1.3.12345: Flags [.], ack 1347, win 913, options [nop,nop,TS val 444803977 ecr 45241192], length 0
14:53:30.544645 IP Broadcom.Home.36621 > 192.168.1.3.12345: Flags [P.], seq 2730:2796, ack 1347, win 913, options [nop,nop,TS val 444804378 ecr 45241192], length 66
14:53:30.554690 IP Broadcom.Home.36621 > 192.168.1.3.12345: Flags [.], ack 1363, win 913, options [nop,nop,TS val 444804388 ecr 45241295], length 0
14:53:30.771592 IP Broadcom.Home.36621 > 192.168.1.3.12345: Flags [P.], seq 2796:2806, ack 1363, win 913, options [nop,nop,TS val 444804605 ecr 45241295], length 10
14:53:30.772007 IP Broadcom.Home.36621 > 192.168.1.3.12345: Flags [.], ack 1397, win 913, options [nop,nop,TS val 444804605 ecr 45241349], length 0
14:53:30.991559 IP Broadcom.Home.36621 > 192.168.1.3.12345: Flags [P.], seq 2806:2846, ack 1397, win 913, options [nop,nop,TS val 444804825 ecr 45241349], length 40
14:53:31.092487 IP Broadcom.Home.36621 > 192.168.1.3.12345: Flags [.], ack 1401, win 913, options [nop,nop,TS val 444804925 ecr 45241429], length 0
14:53:31.192592 IP Broadcom.Home.36621 > 192.168.1.3.12345: Flags [.], ack 1405, win 913, options [nop,nop,TS val 444805026 ecr 45241454], length 0
14:53:31.626469 IP Broadcom.Home.36621 > 192.168.1.3.12345: Flags [P.], seq 2846:2913, ack 1405, win 913, options [nop,nop,TS val 444805460 ecr 45241454], length 67
14:53:31.628487 IP Broadcom.Home.36621 > 192.168.1.3.12345: Flags [.], ack 1421, win 913, options [nop,nop,TS val 444805462 ecr 45241563], length 0
14:53:31.845518 IP Broadcom.Home.36621 > 192.168.1.3.12345: Flags [P.], seq 2913:2923, ack 1421, win 913, options [nop,nop,TS val 444805679 ecr 45241563], length 10
14:53:31.845904 IP Broadcom.Home.36621 > 192.168.1.3.12345: Flags [.], ack 1455, win 913, options [nop,nop,TS val 444805679 ecr 45241617], length 0
14:53:32.066389 IP Broadcom.Home.36621 > 192.168.1.3.12345: Flags [P.], seq 2923:2963, ack 1455, win 913, options [nop,nop,TS val 444805900 ecr 45241617], length 40
14:53:32.167411 IP Broadcom.Home.36621 > 192.168.1.3.12345: Flags [.], ack 1459, win 913, options [nop,nop,TS val 444806000 ecr 45241698], length 0
14:53:32.267712 IP Broadcom.Home.36621 > 192.168.1.3.12345: Flags [.], ack 1463, win 913, options [nop,nop,TS val 444806101 ecr 45241723], length 0
14:53:32.613425 IP Broadcom.Home.36621 > 192.168.1.3.12345: Flags [P.], seq 2963:3029, ack 1463, win 913, options [nop,nop,TS val 444806447 ecr 45241723], length 66
14:53:32.623956 IP Broadcom.Home.36621 > 192.168.1.3.12345: Flags [.], ack 1479, win 913, options [nop,nop,TS val 444806457 ecr 45241812], length 0
14:53:32.841260 IP Broadcom.Home.36621 > 192.168.1.3.12345: Flags [P.], seq 3029:3039, ack 1479, win 913, options [nop,nop,TS val 444806675 ecr 45241812], length 10
14:53:32.841680 IP Broadcom.Home.36621 > 192.168.1.3.12345: Flags [.], ack 1513, win 913, options [nop,nop,TS val 444806675 ecr 45241866], length 0
14:53:33.062258 IP Broadcom.Home.36621 > 192.168.1.3.12345: Flags [P.], seq 3039:3080, ack 1513, win 913, options [nop,nop,TS val 444806896 ecr 45241866], length 41
14:53:33.163083 IP Broadcom.Home.36621 > 192.168.1.3.12345: Flags [.], ack 1517, win 913, options [nop,nop,TS val 444806996 ecr 45241947], length 0
14:53:33.264452 IP Broadcom.Home.36621 > 192.168.1.3.12345: Flags [.], ack 1521, win 913, options [nop,nop,TS val 444807098 ecr 45241972], length 0
14:53:33.638262 IP Broadcom.Home.36621 > 192.168.1.3.12345: Flags [P.], seq 3080:3146, ack 1521, win 913, options [nop,nop,TS val 444807472 ecr 45241972], length 66
14:53:33.646692 IP Broadcom.Home.36621 > 192.168.1.3.12345: Flags [.], ack 1537, win 913, options [nop,nop,TS val 444807480 ecr 45242068], length 0
14:53:33.864130 IP Broadcom.Home.36621 > 192.168.1.3.12345: Flags [P.], seq 3146:3156, ack 1537, win 913, options [nop,nop,TS val 444807698 ecr 45242068], length 10
14:53:33.864565 IP Broadcom.Home.36621 > 192.168.1.3.12345: Flags [.], ack 1571, win 913, options [nop,nop,TS val 444807698 ecr 45242122], length 0
14:53:34.085084 IP Broadcom.Home.36621 > 192.168.1.3.12345: Flags [P.], seq 3156:3196, ack 1571, win 913, options [nop,nop,TS val 444807919 ecr 45242122], length 40
14:53:34.186066 IP Broadcom.Home.36621 > 192.168.1.3.12345: Flags [.], ack 1575, win 913, options [nop,nop,TS val 444808019 ecr 45242202], length 0
14:53:34.287332 IP Broadcom.Home.36621 > 192.168.1.3.12345: Flags [.], ack 1579, win 913, options [nop,nop,TS val 444808121 ecr 45242227], length 0
14:53:34.683021 IP Broadcom.Home.36621 > 192.168.1.3.12345: Flags [P.], seq 3196:3262, ack 1579, win 913, options [nop,nop,TS val 444808517 ecr 45242227], length 66
14:53:34.686688 IP Broadcom.Home.36621 > 192.168.1.3.12345: Flags [.], ack 1595, win 913, options [nop,nop,TS val 444808520 ecr 45242328], length 0
14:53:34.904956 IP Broadcom.Home.36621 > 192.168.1.3.12345: Flags [P.], seq 3262:3272, ack 1595, win 913, options [nop,nop,TS val 444808739 ecr 45242328], length 10
14:53:34.905393 IP Broadcom.Home.36621 > 192.168.1.3.12345: Flags [.], ack 1629, win 913, options [nop,nop,TS val 444808739 ecr 45242382], length 0
14:53:35.125926 IP Broadcom.Home.36621 > 192.168.1.3.12345: Flags [P.], seq 3272:3312, ack 1629, win 913, options [nop,nop,TS val 444808960 ecr 45242382], length 40
14:53:35.227009 IP Broadcom.Home.36621 > 192.168.1.3.12345: Flags [.], ack 1633, win 913, options [nop,nop,TS val 444809061 ecr 45242463], length 0
14:53:35.327390 IP Broadcom.Home.36621 > 192.168.1.3.12345: Flags [.], ack 1637, win 913, options [nop,nop,TS val 444809161 ecr 45242488], length 0
14:53:35.714839 IP Broadcom.Home.36621 > 192.168.1.3.12345: Flags [P.], seq 3312:3379, ack 1637, win 913, options [nop,nop,TS val 444809549 ecr 45242488], length 67
14:53:35.718104 IP Broadcom.Home.36621 > 192.168.1.3.12345: Flags [.], ack 1653, win 913, options [nop,nop,TS val 444809552 ecr 45242585], length 0
14:53:35.936807 IP Broadcom.Home.36621 > 192.168.1.3.12345: Flags [P.], seq 3379:3389, ack 1653, win 913, options [nop,nop,TS val 444809771 ecr 45242585], length 10
14:53:35.937214 IP Broadcom.Home.36621 > 192.168.1.3.12345: Flags [.], ack 1687, win 913, options [nop,nop,TS val 444809771 ecr 45242640], length 0
14:53:36.157751 IP Broadcom.Home.36621 > 192.168.1.3.12345: Flags [P.], seq 3389:3430, ack 1687, win 913, options [nop,nop,TS val 444809992 ecr 45242640], length 41
14:53:36.258603 IP Broadcom.Home.36621 > 192.168.1.3.12345: Flags [.], ack 1691, win 913, options [nop,nop,TS val 444810092 ecr 45242720], length 0
14:53:36.359056 IP Broadcom.Home.36621 > 192.168.1.3.12345: Flags [.], ack 1695, win 913, options [nop,nop,TS val 444810193 ecr 45242746], length 0
14:53:36.757701 IP Broadcom.Home.36621 > 192.168.1.3.12345: Flags [P.], seq 3430:3496, ack 1695, win 913, options [nop,nop,TS val 444810592 ecr 45242746], length 66
14:53:36.766734 IP Broadcom.Home.36621 > 192.168.1.3.12345: Flags [.], ack 1711, win 913, options [nop,nop,TS val 444810601 ecr 45242848], length 0
14:53:36.984627 IP Broadcom.Home.36621 > 192.168.1.3.12345: Flags [P.], seq 3496:3506, ack 1711, win 913, options [nop,nop,TS val 444810819 ecr 45242848], length 10
14:53:36.985043 IP Broadcom.Home.36621 > 192.168.1.3.12345: Flags [.], ack 1745, win 913, options [nop,nop,TS val 444810819 ecr 45242902], length 0
14:53:37.204594 IP Broadcom.Home.36621 > 192.168.1.3.12345: Flags [P.], seq 3506:3546, ack 1745, win 913, options [nop,nop,TS val 444811039 ecr 45242902], length 40
14:53:37.305524 IP Broadcom.Home.36621 > 192.168.1.3.12345: Flags [.], ack 1749, win 913, options [nop,nop,TS val 444811139 ecr 45242982], length 0
14:53:37.405702 IP Broadcom.Home.36621 > 192.168.1.3.12345: Flags [.], ack 1753, win 913, options [nop,nop,TS val 444811240 ecr 45243007], length 0
14:53:37.771548 IP Broadcom.Home.36621 > 192.168.1.3.12345: Flags [P.], seq 3546:3612, ack 1753, win 913, options [nop,nop,TS val 444811606 ecr 45243007], length 66
14:53:37.773712 IP Broadcom.Home.36621 > 192.168.1.3.12345: Flags [.], ack 1769, win 913, options [nop,nop,TS val 444811608 ecr 45243099], length 0
14:53:37.991493 IP Broadcom.Home.36621 > 192.168.1.3.12345: Flags [P.], seq 3612:3622, ack 1769, win 913, options [nop,nop,TS val 444811826 ecr 45243099], length 10
14:53:37.991932 IP Broadcom.Home.36621 > 192.168.1.3.12345: Flags [.], ack 1803, win 913, options [nop,nop,TS val 444811826 ecr 45243154], length 0
14:53:38.212458 IP Broadcom.Home.36621 > 192.168.1.3.12345: Flags [P.], seq 3622:3662, ack 1803, win 913, options [nop,nop,TS val 444812047 ecr 45243154], length 40
14:53:38.313322 IP Broadcom.Home.36621 > 192.168.1.3.12345: Flags [.], ack 1807, win 913, options [nop,nop,TS val 444812147 ecr 45243234], length 0
14:53:38.413688 IP Broadcom.Home.36621 > 192.168.1.3.12345: Flags [.], ack 1811, win 913, options [nop,nop,TS val 444812248 ecr 45243259], length 0
14:53:38.803450 IP Broadcom.Home.36621 > 192.168.1.3.12345: Flags [P.], seq 3662:3728, ack 1811, win 913, options [nop,nop,TS val 444812638 ecr 45243259], length 66
14:53:38.804531 IP Broadcom.Home.36621 > 192.168.1.3.12345: Flags [.], ack 1827, win 913, options [nop,nop,TS val 444812639 ecr 45243357], length 0
14:53:39.023315 IP Broadcom.Home.36621 > 192.168.1.3.12345: Flags [P.], seq 3728:3738, ack 1827, win 913, options [nop,nop,TS val 444812858 ecr 45243357], length 10
14:53:39.023749 IP Broadcom.Home.36621 > 192.168.1.3.12345: Flags [.], ack 1861, win 913, options [nop,nop,TS val 444812858 ecr 45243412], length 0
14:53:39.244261 IP Broadcom.Home.36621 > 192.168.1.3.12345: Flags [P.], seq 3738:3778, ack 1861, win 913, options [nop,nop,TS val 444813079 ecr 45243412], length 40
14:53:39.345120 IP Broadcom.Home.36621 > 192.168.1.3.12345: Flags [.], ack 1865, win 913, options [nop,nop,TS val 444813179 ecr 45243492], length 0
14:53:39.445587 IP Broadcom.Home.36621 > 192.168.1.3.12345: Flags [.], ack 1869, win 913, options [nop,nop,TS val 444813280 ecr 45243517], length 0
14:53:39.844182 IP Broadcom.Home.36621 > 192.168.1.3.12345: Flags [P.], seq 3778:3845, ack 1869, win 913, options [nop,nop,TS val 444813679 ecr 45243517], length 67
14:53:39.850673 IP Broadcom.Home.36621 > 192.168.1.3.12345: Flags [.], ack 1885, win 913, options [nop,nop,TS val 444813685 ecr 45243619], length 0
14:53:40.069126 IP Broadcom.Home.36621 > 192.168.1.3.12345: Flags [P.], seq 3845:3855, ack 1885, win 913, options [nop,nop,TS val 444813904 ecr 45243619], length 10
14:53:40.069542 IP Broadcom.Home.36621 > 192.168.1.3.12345: Flags [.], ack 1919, win 913, options [nop,nop,TS val 444813904 ecr 45243673], length 0
14:53:40.290103 IP Broadcom.Home.36621 > 192.168.1.3.12345: Flags [P.], seq 3855:3895, ack 1919, win 913, options [nop,nop,TS val 444814125 ecr 45243673], length 40
14:53:40.391258 IP Broadcom.Home.36621 > 192.168.1.3.12345: Flags [.], ack 1923, win 913, options [nop,nop,TS val 444814226 ecr 45243754], length 0
14:53:40.491036 IP Broadcom.Home.36621 > 192.168.1.3.12345: Flags [.], ack 1927, win 913, options [nop,nop,TS val 444814325 ecr 45243779], length 0
14:53:40.873111 IP Broadcom.Home.36621 > 192.168.1.3.12345: Flags [P.], seq 3895:3961, ack 1927, win 913, options [nop,nop,TS val 444814708 ecr 45243779], length 66
14:53:40.875213 IP Broadcom.Home.36621 > 192.168.1.3.12345: Flags [.], ack 1943, win 913, options [nop,nop,TS val 444814710 ecr 45243874], length 0
14:53:41.092983 IP Broadcom.Home.36621 > 192.168.1.3.12345: Flags [P.], seq 3961:3971, ack 1943, win 913, options [nop,nop,TS val 444814928 ecr 45243874], length 10
14:53:41.093377 IP Broadcom.Home.36621 > 192.168.1.3.12345: Flags [.], ack 1977, win 913, options [nop,nop,TS val 444814928 ecr 45243929], length 0
14:53:41.312918 IP Broadcom.Home.36621 > 192.168.1.3.12345: Flags [P.], seq 3971:4011, ack 1977, win 913, options [nop,nop,TS val 444815148 ecr 45243929], length 40
14:53:41.414198 IP Broadcom.Home.36621 > 192.168.1.3.12345: Flags [.], ack 1981, win 913, options [nop,nop,TS val 444815249 ecr 45244009], length 0
14:53:41.514102 IP Broadcom.Home.36621 > 192.168.1.3.12345: Flags [.], ack 1985, win 913, options [nop,nop,TS val 444815349 ecr 45244034], length 0
14:53:41.941977 IP Broadcom.Home.36621 > 192.168.1.3.12345: Flags [P.], seq 4011:4077, ack 1985, win 913, options [nop,nop,TS val 444815777 ecr 45244034], length 66
14:53:41.950654 IP Broadcom.Home.36621 > 192.168.1.3.12345: Flags [.], ack 2001, win 913, options [nop,nop,TS val 444815785 ecr 45244144], length 0
14:53:42.167810 IP Broadcom.Home.36621 > 192.168.1.3.12345: Flags [P.], seq 4077:4087, ack 2001, win 913, options [nop,nop,TS val 444816003 ecr 45244144], length 10
14:53:42.168244 IP Broadcom.Home.36621 > 192.168.1.3.12345: Flags [.], ack 2035, win 913, options [nop,nop,TS val 444816003 ecr 45244198], length 0
14:53:42.387768 IP Broadcom.Home.36621 > 192.168.1.3.12345: Flags [P.], seq 4087:4127, ack 2035, win 913, options [nop,nop,TS val 444816223 ecr 45244198], length 40
14:53:42.488605 IP Broadcom.Home.36621 > 192.168.1.3.12345: Flags [.], ack 2039, win 913, options [nop,nop,TS val 444816323 ecr 45244278], length 0
14:53:42.588858 IP Broadcom.Home.36621 > 192.168.1.3.12345: Flags [.], ack 2043, win 913, options [nop,nop,TS val 444816424 ecr 45244303], length 0
14:53:42.941820 IP Broadcom.Home.36621 > 192.168.1.3.12345: Flags [P.], seq 4127:4194, ack 2043, win 913, options [nop,nop,TS val 444816777 ecr 45244303], length 67
14:53:42.950738 IP Broadcom.Home.36621 > 192.168.1.3.12345: Flags [.], ack 2059, win 913, options [nop,nop,TS val 444816786 ecr 45244394], length 0
14:53:43.167665 IP Broadcom.Home.36621 > 192.168.1.3.12345: Flags [P.], seq 4194:4204, ack 2059, win 913, options [nop,nop,TS val 444817003 ecr 45244394], length 10
14:53:43.168092 IP Broadcom.Home.36621 > 192.168.1.3.12345: Flags [.], ack 2093, win 913, options [nop,nop,TS val 444817003 ecr 45244448], length 0
14:53:43.388632 IP Broadcom.Home.36621 > 192.168.1.3.12345: Flags [P.], seq 4204:4244, ack 2093, win 913, options [nop,nop,TS val 444817224 ecr 45244448], length 40
14:53:43.489460 IP Broadcom.Home.36621 > 192.168.1.3.12345: Flags [.], ack 2097, win 913, options [nop,nop,TS val 444817324 ecr 45244528], length 0
14:53:43.589834 IP Broadcom.Home.36621 > 192.168.1.3.12345: Flags [.], ack 2101, win 913, options [nop,nop,TS val 444817425 ecr 45244553], length 0
14:53:43.979659 IP Broadcom.Home.36621 > 192.168.1.3.12345: Flags [P.], seq 4244:4311, ack 2101, win 913, options [nop,nop,TS val 444817815 ecr 45244553], length 67
14:53:43.981147 IP Broadcom.Home.36621 > 192.168.1.3.12345: Flags [.], ack 2117, win 913, options [nop,nop,TS val 444817816 ecr 45244651], length 0
14:53:44.198501 IP Broadcom.Home.36621 > 192.168.1.3.12345: Flags [P.], seq 4311:4321, ack 2117, win 913, options [nop,nop,TS val 444818034 ecr 45244651], length 10
14:53:44.198910 IP Broadcom.Home.36621 > 192.168.1.3.12345: Flags [.], ack 2151, win 913, options [nop,nop,TS val 444818034 ecr 45244706], length 0
14:53:44.419477 IP Broadcom.Home.36621 > 192.168.1.3.12345: Flags [P.], seq 4321:4361, ack 2151, win 913, options [nop,nop,TS val 444818255 ecr 45244706], length 40
14:53:44.520136 IP Broadcom.Home.36621 > 192.168.1.3.12345: Flags [.], ack 2155, win 913, options [nop,nop,TS val 444818355 ecr 45244786], length 0
