10:13:48.927652 IP Broadcom.Home.36616 > 192.168.1.3.12345: Flags [.], ack 360603348, win 913, options [nop,nop,TS val 428019816 ecr 41045888], length 0
10:13:49.446800 IP Broadcom.Home.36616 > 192.168.1.3.12345: Flags [.], ack 11, win 913, options [nop,nop,TS val 428020335 ecr 41046018], length 0
10:13:49.450719 IP Broadcom.Home.36616 > 192.168.1.3.12345: Flags [P.], seq 0:1, ack 11, win 913, options [nop,nop,TS val 428020339 ecr 41046018], length 1
10:13:49.451102 IP Broadcom.Home.36616 > 192.168.1.3.12345: Flags [P.], seq 1:3, ack 11, win 913, options [nop,nop,TS val 428020339 ecr 41046019], length 2
10:13:49.451564 IP Broadcom.Home.36616 > 192.168.1.3.12345: Flags [P.], seq 3:5, ack 11, win 913, options [nop,nop,TS val 428020340 ecr 41046019], length 2
10:13:49.451879 IP Broadcom.Home.36616 > 192.168.1.3.12345: Flags [P.], seq 5:8, ack 11, win 913, options [nop,nop,TS val 428020340 ecr 41046019], length 3
10:13:49.491424 IP Broadcom.Home.36616 > 192.168.1.3.12345: Flags [.], ack 15, win 913, options [nop,nop,TS val 428020380 ecr 41046019], length 0
10:13:49.653097 IP Broadcom.Home.36616 > 192.168.1.3.12345: Flags [P.], seq 8:9, ack 15, win 913, options [nop,nop,TS val 428020541 ecr 41046019], length 1
10:13:49.690776 IP Broadcom.Home.36616 > 192.168.1.3.12345: Flags [P.], seq 9:74, ack 15, win 913, options [nop,nop,TS val 428020579 ecr 41046079], length 65
10:13:49.694664 IP Broadcom.Home.36616 > 192.168.1.3.12345: Flags [.], ack 31, win 913, options [nop,nop,TS val 428020583 ecr 41046080], length 0
10:13:49.699403 IP Broadcom.Home.36616 > 192.168.1.3.12345: Flags [P.], seq 74:75, ack 31, win 913, options [nop,nop,TS val 428020587 ecr 41046080], length 1
10:13:49.738662 IP Broadcom.Home.36616 > 192.168.1.3.12345: Flags [P.], seq 75:84, ack 31, win 913, options [nop,nop,TS val 428020627 ecr 41046091], length 9
10:13:49.747729 IP Broadcom.Home.36616 > 192.168.1.3.12345: Flags [P.], seq 84:85, ack 65, win 913, options [nop,nop,TS val 428020636 ecr 41046091], length 1
10:13:49.787547 IP Broadcom.Home.36616 > 192.168.1.3.12345: Flags [P.], seq 85:124, ack 65, win 913, options [nop,nop,TS val 428020676 ecr 41046103], length 39
10:13:49.928355 IP Broadcom.Home.36616 > 192.168.1.3.12345: Flags [.], ack 69, win 913, options [nop,nop,TS val 428020817 ecr 41046128], length 0
10:13:49.989347 IP Broadcom.Home.36616 > 192.168.1.3.12345: Flags [.], ack 73, win 913, options [nop,nop,TS val 428020877 ecr 41046153], length 0
10:13:50.689086 IP Broadcom.Home.36616 > 192.168.1.3.12345: Flags [P.], seq 124:125, ack 73, win 913, options [nop,nop,TS val 428021577 ecr 41046153], length 1
10:13:50.689619 IP Broadcom.Home.36616 > 192.168.1.3.12345: Flags [P.], seq 125:127, ack 73, win 913, options [nop,nop,TS val 428021578 ecr 41046328], length 2
10:13:50.689948 IP Broadcom.Home.36616 > 192.168.1.3.12345: Flags [P.], seq 127:130, ack 73, win 913, options [nop,nop,TS val 428021578 ecr 41046328], length 3
10:13:50.690384 IP Broadcom.Home.36616 > 192.168.1.3.12345: Flags [P.], seq 130:132, ack 73, win 913, options [nop,nop,TS val 428021579 ecr 41046328], length 2
10:13:50.690740 IP Broadcom.Home.36616 > 192.168.1.3.12345: Flags [P.], seq 132:135, ack 73, win 913, options [nop,nop,TS val 428021579 ecr 41046329], length 3
10:13:50.691091 IP Broadcom.Home.36616 > 192.168.1.3.12345: Flags [P.], seq 135:137, ack 73, win 913, options [nop,nop,TS val 428021579 ecr 41046329], length 2
10:13:50.691497 IP Broadcom.Home.36616 > 192.168.1.3.12345: Flags [P.], seq 137:140, ack 73, win 913, options [nop,nop,TS val 428021580 ecr 41046329], length 3
10:13:50.691819 IP Broadcom.Home.36616 > 192.168.1.3.12345: Flags [P.], seq 140:141, ack 73, win 913, options [nop,nop,TS val 428021580 ecr 41046329], length 1
10:13:50.692227 IP Broadcom.Home.36616 > 192.168.1.3.12345: Flags [P.], seq 141:143, ack 73, win 913, options [nop,nop,TS val 428021580 ecr 41046329], length 2
10:13:50.692535 IP Broadcom.Home.36616 > 192.168.1.3.12345: Flags [P.], seq 143:145, ack 73, win 913, options [nop,nop,TS val 428021581 ecr 41046329], length 2
10:13:50.692840 IP Broadcom.Home.36616 > 192.168.1.3.12345: Flags [P.], seq 145:147, ack 73, win 913, options [nop,nop,TS val 428021581 ecr 41046329], length 2
10:13:50.693249 IP Broadcom.Home.36616 > 192.168.1.3.12345: Flags [P.], seq 147:149, ack 73, win 913, options [nop,nop,TS val 428021581 ecr 41046329], length 2
10:13:50.693592 IP Broadcom.Home.36616 > 192.168.1.3.12345: Flags [P.], seq 149:151, ack 73, win 913, options [nop,nop,TS val 428021582 ecr 41046329], length 2
10:13:50.693922 IP Broadcom.Home.36616 > 192.168.1.3.12345: Flags [P.], seq 151:153, ack 73, win 913, options [nop,nop,TS val 428021582 ecr 41046329], length 2
10:13:50.694329 IP Broadcom.Home.36616 > 192.168.1.3.12345: Flags [P.], seq 153:155, ack 73, win 913, options [nop,nop,TS val 428021583 ecr 41046329], length 2
10:13:50.694651 IP Broadcom.Home.36616 > 192.168.1.3.12345: Flags [P.], seq 155:157, ack 73, win 913, options [nop,nop,TS val 428021583 ecr 41046329], length 2
10:13:50.694934 IP Broadcom.Home.36616 > 192.168.1.3.12345: Flags [P.], seq 157:159, ack 73, win 913, options [nop,nop,TS val 428021583 ecr 41046330], length 2
10:13:50.695324 IP Broadcom.Home.36616 > 192.168.1.3.12345: Flags [P.], seq 159:161, ack 73, win 913, options [nop,nop,TS val 428021584 ecr 41046330], length 2
10:13:50.695656 IP Broadcom.Home.36616 > 192.168.1.3.12345: Flags [P.], seq 161:163, ack 73, win 913, options [nop,nop,TS val 428021584 ecr 41046330], length 2
10:13:50.695965 IP Broadcom.Home.36616 > 192.168.1.3.12345: Flags [P.], seq 163:165, ack 73, win 913, options [nop,nop,TS val 428021584 ecr 41046330], length 2
10:13:50.696365 IP Broadcom.Home.36616 > 192.168.1.3.12345: Flags [P.], seq 165:167, ack 73, win 913, options [nop,nop,TS val 428021585 ecr 41046330], length 2
10:13:50.696675 IP Broadcom.Home.36616 > 192.168.1.3.12345: Flags [P.], seq 167:169, ack 73, win 913, options [nop,nop,TS val 428021585 ecr 41046330], length 2
10:13:50.696986 IP Broadcom.Home.36616 > 192.168.1.3.12345: Flags [P.], seq 169:171, ack 73, win 913, options [nop,nop,TS val 428021585 ecr 41046330], length 2
10:13:50.697410 IP Broadcom.Home.36616 > 192.168.1.3.12345: Flags [P.], seq 171:173, ack 73, win 913, options [nop,nop,TS val 428021586 ecr 41046330], length 2
10:13:50.697731 IP Broadcom.Home.36616 > 192.168.1.3.12345: Flags [P.], seq 173:175, ack 73, win 913, options [nop,nop,TS val 428021586 ecr 41046330], length 2
10:13:50.698053 IP Broadcom.Home.36616 > 192.168.1.3.12345: Flags [P.], seq 175:177, ack 73, win 913, options [nop,nop,TS val 428021586 ecr 41046330], length 2
10:13:50.698435 IP Broadcom.Home.36616 > 192.168.1.3.12345: Flags [P.], seq 177:179, ack 73, win 913, options [nop,nop,TS val 428021587 ecr 41046330], length 2
10:13:50.698757 IP Broadcom.Home.36616 > 192.168.1.3.12345: Flags [P.], seq 179:181, ack 73, win 913, options [nop,nop,TS val 428021587 ecr 41046331], length 2
10:13:50.699082 IP Broadcom.Home.36616 > 192.168.1.3.12345: Flags [P.], seq 181:183, ack 73, win 913, options [nop,nop,TS val 428021587 ecr 41046331], length 2
10:13:50.700482 IP Broadcom.Home.36616 > 192.168.1.3.12345: Flags [P.], seq 183:190, ack 73, win 913, options [nop,nop,TS val 428021589 ecr 41046331], length 7
10:13:50.706739 IP Broadcom.Home.36616 > 192.168.1.3.12345: Flags [.], ack 90, win 913, options [nop,nop,TS val 428021595 ecr 41046333], length 0
10:13:50.711729 IP Broadcom.Home.36616 > 192.168.1.3.12345: Flags [P.], seq 190:191, ack 90, win 913, options [nop,nop,TS val 428021600 ecr 41046333], length 1
10:13:50.750698 IP Broadcom.Home.36616 > 192.168.1.3.12345: Flags [P.], seq 191:200, ack 90, win 913, options [nop,nop,TS val 428021639 ecr 41046344], length 9
10:13:50.759732 IP Broadcom.Home.36616 > 192.168.1.3.12345: Flags [P.], seq 200:201, ack 124, win 913, options [nop,nop,TS val 428021648 ecr 41046344], length 1
10:13:50.799384 IP Broadcom.Home.36616 > 192.168.1.3.12345: Flags [P.], seq 201:240, ack 124, win 913, options [nop,nop,TS val 428021688 ecr 41046356], length 39
10:13:50.939232 IP Broadcom.Home.36616 > 192.168.1.3.12345: Flags [.], ack 128, win 913, options [nop,nop,TS val 428021828 ecr 41046381], length 0
10:13:51.000600 IP Broadcom.Home.36616 > 192.168.1.3.12345: Flags [.], ack 132, win 913, options [nop,nop,TS val 428021889 ecr 41046406], length 0
10:13:51.728662 IP Broadcom.Home.36616 > 192.168.1.3.12345: Flags [P.], seq 240:241, ack 132, win 913, options [nop,nop,TS val 428022617 ecr 41046406], length 1
10:13:51.729256 IP Broadcom.Home.36616 > 192.168.1.3.12345: Flags [P.], seq 241:244, ack 132, win 913, options [nop,nop,TS val 428022618 ecr 41046588], length 3
10:13:51.729739 IP Broadcom.Home.36616 > 192.168.1.3.12345: Flags [P.], seq 244:247, ack 132, win 913, options [nop,nop,TS val 428022618 ecr 41046588], length 3
10:13:51.730277 IP Broadcom.Home.36616 > 192.168.1.3.12345: Flags [P.], seq 247:250, ack 132, win 913, options [nop,nop,TS val 428022619 ecr 41046588], length 3
10:13:51.730633 IP Broadcom.Home.36616 > 192.168.1.3.12345: Flags [P.], seq 250:253, ack 132, win 913, options [nop,nop,TS val 428022619 ecr 41046588], length 3
10:13:51.731118 IP Broadcom.Home.36616 > 192.168.1.3.12345: Flags [P.], seq 253:255, ack 132, win 913, options [nop,nop,TS val 428022619 ecr 41046589], length 2
10:13:51.731525 IP Broadcom.Home.36616 > 192.168.1.3.12345: Flags [P.], seq 255:258, ack 132, win 913, options [nop,nop,TS val 428022620 ecr 41046589], length 3
10:13:51.731956 IP Broadcom.Home.36616 > 192.168.1.3.12345: Flags [P.], seq 258:260, ack 132, win 913, options [nop,nop,TS val 428022620 ecr 41046589], length 2
10:13:51.732336 IP Broadcom.Home.36616 > 192.168.1.3.12345: Flags [P.], seq 260:263, ack 132, win 913, options [nop,nop,TS val 428022621 ecr 41046589], length 3
10:13:51.732683 IP Broadcom.Home.36616 > 192.168.1.3.12345: Flags [P.], seq 263:265, ack 132, win 913, options [nop,nop,TS val 428022621 ecr 41046589], length 2
10:13:51.733045 IP Broadcom.Home.36616 > 192.168.1.3.12345: Flags [P.], seq 265:267, ack 132, win 913, options [nop,nop,TS val 428022621 ecr 41046589], length 2
10:13:51.734482 IP Broadcom.Home.36616 > 192.168.1.3.12345: Flags [P.], seq 267:275, ack 132, win 913, options [nop,nop,TS val 428022623 ecr 41046589], length 8
10:13:51.734793 IP Broadcom.Home.36616 > 192.168.1.3.12345: Flags [P.], seq 275:277, ack 132, win 913, options [nop,nop,TS val 428022623 ecr 41046590], length 2
10:13:51.735272 IP Broadcom.Home.36616 > 192.168.1.3.12345: Flags [P.], seq 277:279, ack 132, win 913, options [nop,nop,TS val 428022624 ecr 41046590], length 2
10:13:51.735586 IP Broadcom.Home.36616 > 192.168.1.3.12345: Flags [P.], seq 279:281, ack 132, win 913, options [nop,nop,TS val 428022624 ecr 41046590], length 2
10:13:51.736006 IP Broadcom.Home.36616 > 192.168.1.3.12345: Flags [P.], seq 281:284, ack 132, win 913, options [nop,nop,TS val 428022624 ecr 41046590], length 3
10:13:51.736424 IP Broadcom.Home.36616 > 192.168.1.3.12345: Flags [P.], seq 284:286, ack 132, win 913, options [nop,nop,TS val 428022625 ecr 41046590], length 2
10:13:51.736798 IP Broadcom.Home.36616 > 192.168.1.3.12345: Flags [P.], seq 286:289, ack 132, win 913, options [nop,nop,TS val 428022625 ecr 41046590], length 3
10:13:51.737208 IP Broadcom.Home.36616 > 192.168.1.3.12345: Flags [P.], seq 289:290, ack 132, win 913, options [nop,nop,TS val 428022626 ecr 41046590], length 1
10:13:51.737571 IP Broadcom.Home.36616 > 192.168.1.3.12345: Flags [P.], seq 290:293, ack 132, win 913, options [nop,nop,TS val 428022626 ecr 41046590], length 3
10:13:51.737916 IP Broadcom.Home.36616 > 192.168.1.3.12345: Flags [P.], seq 293:295, ack 132, win 913, options [nop,nop,TS val 428022626 ecr 41046590], length 2
10:13:51.738268 IP Broadcom.Home.36616 > 192.168.1.3.12345: Flags [P.], seq 295:296, ack 132, win 913, options [nop,nop,TS val 428022627 ecr 41046590], length 1
10:13:51.738616 IP Broadcom.Home.36616 > 192.168.1.3.12345: Flags [P.], seq 296:299, ack 132, win 913, options [nop,nop,TS val 428022627 ecr 41046590], length 3
10:13:51.739049 IP Broadcom.Home.36616 > 192.168.1.3.12345: Flags [P.], seq 299:301, ack 132, win 913, options [nop,nop,TS val 428022627 ecr 41046591], length 2
10:13:51.739400 IP Broadcom.Home.36616 > 192.168.1.3.12345: Flags [P.], seq 301:304, ack 132, win 913, options [nop,nop,TS val 428022628 ecr 41046591], length 3
10:13:51.739736 IP Broadcom.Home.36616 > 192.168.1.3.12345: Flags [P.], seq 304:306, ack 132, win 913, options [nop,nop,TS val 428022628 ecr 41046591], length 2
10:13:51.740905 IP Broadcom.Home.36616 > 192.168.1.3.12345: Flags [.], ack 148, win 913, options [nop,nop,TS val 428022629 ecr 41046591], length 0
10:13:51.745679 IP Broadcom.Home.36616 > 192.168.1.3.12345: Flags [P.], seq 306:307, ack 148, win 913, options [nop,nop,TS val 428022634 ecr 41046591], length 1
10:13:51.786682 IP Broadcom.Home.36616 > 192.168.1.3.12345: Flags [P.], seq 307:316, ack 148, win 913, options [nop,nop,TS val 428022675 ecr 41046602], length 9
10:13:51.795722 IP Broadcom.Home.36616 > 192.168.1.3.12345: Flags [P.], seq 316:317, ack 182, win 913, options [nop,nop,TS val 428022684 ecr 41046603], length 1
10:13:51.838705 IP Broadcom.Home.36616 > 192.168.1.3.12345: Flags [P.], seq 317:356, ack 182, win 913, options [nop,nop,TS val 428022727 ecr 41046615], length 39
10:13:51.978993 IP Broadcom.Home.36616 > 192.168.1.3.12345: Flags [.], ack 186, win 913, options [nop,nop,TS val 428022868 ecr 41046641], length 0
10:13:52.039634 IP Broadcom.Home.36616 > 192.168.1.3.12345: Flags [.], ack 190, win 913, options [nop,nop,TS val 428022928 ecr 41046666], length 0
10:13:52.767642 IP Broadcom.Home.36616 > 192.168.1.3.12345: Flags [P.], seq 356:357, ack 190, win 913, options [nop,nop,TS val 428023656 ecr 41046666], length 1
10:13:52.768246 IP Broadcom.Home.36616 > 192.168.1.3.12345: Flags [P.], seq 357:360, ack 190, win 913, options [nop,nop,TS val 428023657 ecr 41046848], length 3
10:13:52.768575 IP Broadcom.Home.36616 > 192.168.1.3.12345: Flags [P.], seq 360:362, ack 190, win 913, options [nop,nop,TS val 428023657 ecr 41046848], length 2
10:13:52.768969 IP Broadcom.Home.36616 > 192.168.1.3.12345: Flags [P.], seq 362:364, ack 190, win 913, options [nop,nop,TS val 428023658 ecr 41046848], length 2
10:13:52.769257 IP Broadcom.Home.36616 > 192.168.1.3.12345: Flags [P.], seq 364:366, ack 190, win 913, options [nop,nop,TS val 428023658 ecr 41046848], length 2
10:13:52.769546 IP Broadcom.Home.36616 > 192.168.1.3.12345: Flags [P.], seq 366:368, ack 190, win 913, options [nop,nop,TS val 428023658 ecr 41046848], length 2
10:13:52.769898 IP Broadcom.Home.36616 > 192.168.1.3.12345: Flags [P.], seq 368:370, ack 190, win 913, options [nop,nop,TS val 428023659 ecr 41046848], length 2
10:13:52.770264 IP Broadcom.Home.36616 > 192.168.1.3.12345: Flags [P.], seq 370:372, ack 190, win 913, options [nop,nop,TS val 428023659 ecr 41046848], length 2
10:13:52.770568 IP Broadcom.Home.36616 > 192.168.1.3.12345: Flags [P.], seq 372:374, ack 190, win 913, options [nop,nop,TS val 428023659 ecr 41046848], length 2
10:13:52.770938 IP Broadcom.Home.36616 > 192.168.1.3.12345: Flags [P.], seq 374:376, ack 190, win 913, options [nop,nop,TS val 428023660 ecr 41046849], length 2
10:13:52.771245 IP Broadcom.Home.36616 > 192.168.1.3.12345: Flags [P.], seq 376:378, ack 190, win 913, options [nop,nop,TS val 428023660 ecr 41046849], length 2
10:13:52.771534 IP Broadcom.Home.36616 > 192.168.1.3.12345: Flags [P.], seq 378:379, ack 190, win 913, options [nop,nop,TS val 428023660 ecr 41046849], length 1
10:13:52.771893 IP Broadcom.Home.36616 > 192.168.1.3.12345: Flags [P.], seq 379:381, ack 190, win 913, options [nop,nop,TS val 428023660 ecr 41046849], length 2
10:13:52.772239 IP Broadcom.Home.36616 > 192.168.1.3.12345: Flags [P.], seq 381:384, ack 190, win 913, options [nop,nop,TS val 428023661 ecr 41046849], length 3
10:13:52.772592 IP Broadcom.Home.36616 > 192.168.1.3.12345: Flags [P.], seq 384:386, ack 190, win 913, options [nop,nop,TS val 428023661 ecr 41046849], length 2
10:13:52.772964 IP Broadcom.Home.36616 > 192.168.1.3.12345: Flags [P.], seq 386:387, ack 190, win 913, options [nop,nop,TS val 428023662 ecr 41046849], length 1
10:13:52.773242 IP Broadcom.Home.36616 > 192.168.1.3.12345: Flags [P.], seq 387:389, ack 190, win 913, options [nop,nop,TS val 428023662 ecr 41046849], length 2
10:13:52.773550 IP Broadcom.Home.36616 > 192.168.1.3.12345: Flags [P.], seq 389:391, ack 190, win 913, options [nop,nop,TS val 428023662 ecr 41046849], length 2
10:13:52.773931 IP Broadcom.Home.36616 > 192.168.1.3.12345: Flags [P.], seq 391:393, ack 190, win 913, options [nop,nop,TS val 428023663 ecr 41046849], length 2
10:13:52.774261 IP Broadcom.Home.36616 > 192.168.1.3.12345: Flags [P.], seq 393:395, ack 190, win 913, options [nop,nop,TS val 428023663 ecr 41046849], length 2
10:13:52.774543 IP Broadcom.Home.36616 > 192.168.1.3.12345: Flags [P.], seq 395:397, ack 190, win 913, options [nop,nop,TS val 428023663 ecr 41046849], length 2
10:13:52.774910 IP Broadcom.Home.36616 > 192.168.1.3.12345: Flags [P.], seq 397:399, ack 190, win 913, options [nop,nop,TS val 428023664 ecr 41046850], length 2
10:13:52.775223 IP Broadcom.Home.36616 > 192.168.1.3.12345: Flags [P.], seq 399:401, ack 190, win 913, options [nop,nop,TS val 428023664 ecr 41046850], length 2
10:13:52.775556 IP Broadcom.Home.36616 > 192.168.1.3.12345: Flags [P.], seq 401:403, ack 190, win 913, options [nop,nop,TS val 428023664 ecr 41046850], length 2
10:13:52.775920 IP Broadcom.Home.36616 > 192.168.1.3.12345: Flags [P.], seq 403:404, ack 190, win 913, options [nop,nop,TS val 428023665 ecr 41046850], length 1
10:13:52.776238 IP Broadcom.Home.36616 > 192.168.1.3.12345: Flags [P.], seq 404:406, ack 190, win 913, options [nop,nop,TS val 428023665 ecr 41046850], length 2
10:13:52.776517 IP Broadcom.Home.36616 > 192.168.1.3.12345: Flags [P.], seq 406:408, ack 190, win 913, options [nop,nop,TS val 428023665 ecr 41046850], length 2
10:13:52.776869 IP Broadcom.Home.36616 > 192.168.1.3.12345: Flags [P.], seq 408:410, ack 190, win 913, options [nop,nop,TS val 428023665 ecr 41046850], length 2
10:13:52.777191 IP Broadcom.Home.36616 > 192.168.1.3.12345: Flags [P.], seq 410:412, ack 190, win 913, options [nop,nop,TS val 428023666 ecr 41046850], length 2
10:13:52.777501 IP Broadcom.Home.36616 > 192.168.1.3.12345: Flags [P.], seq 412:414, ack 190, win 913, options [nop,nop,TS val 428023666 ecr 41046850], length 2
10:13:52.777865 IP Broadcom.Home.36616 > 192.168.1.3.12345: Flags [P.], seq 414:416, ack 190, win 913, options [nop,nop,TS val 428023666 ecr 41046850], length 2
10:13:52.779164 IP Broadcom.Home.36616 > 192.168.1.3.12345: Flags [P.], seq 416:422, ack 190, win 913, options [nop,nop,TS val 428023668 ecr 41046850], length 6
10:13:52.782683 IP Broadcom.Home.36616 > 192.168.1.3.12345: Flags [.], ack 206, win 913, options [nop,nop,TS val 428023671 ecr 41046852], length 0
10:13:52.787455 IP Broadcom.Home.36616 > 192.168.1.3.12345: Flags [P.], seq 422:423, ack 206, win 913, options [nop,nop,TS val 428023676 ecr 41046852], length 1
10:13:52.826709 IP Broadcom.Home.36616 > 192.168.1.3.12345: Flags [P.], seq 423:432, ack 206, win 913, options [nop,nop,TS val 428023715 ecr 41046863], length 9
10:13:52.835784 IP Broadcom.Home.36616 > 192.168.1.3.12345: Flags [P.], seq 432:433, ack 240, win 913, options [nop,nop,TS val 428023724 ecr 41046863], length 1
10:13:52.874690 IP Broadcom.Home.36616 > 192.168.1.3.12345: Flags [P.], seq 433:474, ack 240, win 913, options [nop,nop,TS val 428023763 ecr 41046875], length 41
10:13:53.014854 IP Broadcom.Home.36616 > 192.168.1.3.12345: Flags [.], ack 244, win 913, options [nop,nop,TS val 428023904 ecr 41046900], length 0
10:13:53.076111 IP Broadcom.Home.36616 > 192.168.1.3.12345: Flags [.], ack 248, win 913, options [nop,nop,TS val 428023965 ecr 41046925], length 0
10:13:53.790591 IP Broadcom.Home.36616 > 192.168.1.3.12345: Flags [P.], seq 474:475, ack 248, win 913, options [nop,nop,TS val 428024679 ecr 41046925], length 1
10:13:53.791162 IP Broadcom.Home.36616 > 192.168.1.3.12345: Flags [P.], seq 475:478, ack 248, win 913, options [nop,nop,TS val 428024680 ecr 41047104], length 3
10:13:53.791555 IP Broadcom.Home.36616 > 192.168.1.3.12345: Flags [P.], seq 478:481, ack 248, win 913, options [nop,nop,TS val 428024680 ecr 41047104], length 3
10:13:53.791978 IP Broadcom.Home.36616 > 192.168.1.3.12345: Flags [P.], seq 481:482, ack 248, win 913, options [nop,nop,TS val 428024681 ecr 41047104], length 1
10:13:53.792286 IP Broadcom.Home.36616 > 192.168.1.3.12345: Flags [P.], seq 482:486, ack 248, win 913, options [nop,nop,TS val 428024681 ecr 41047104], length 4
10:13:53.792678 IP Broadcom.Home.36616 > 192.168.1.3.12345: Flags [P.], seq 486:487, ack 248, win 913, options [nop,nop,TS val 428024681 ecr 41047104], length 1
10:13:53.793064 IP Broadcom.Home.36616 > 192.168.1.3.12345: Flags [P.], seq 487:490, ack 248, win 913, options [nop,nop,TS val 428024682 ecr 41047104], length 3
10:13:53.793400 IP Broadcom.Home.36616 > 192.168.1.3.12345: Flags [P.], seq 490:492, ack 248, win 913, options [nop,nop,TS val 428024682 ecr 41047104], length 2
10:13:53.793810 IP Broadcom.Home.36616 > 192.168.1.3.12345: Flags [P.], seq 492:494, ack 248, win 913, options [nop,nop,TS val 428024683 ecr 41047104], length 2
10:13:53.794144 IP Broadcom.Home.36616 > 192.168.1.3.12345: Flags [P.], seq 494:496, ack 248, win 913, options [nop,nop,TS val 428024683 ecr 41047104], length 2
10:13:53.794476 IP Broadcom.Home.36616 > 192.168.1.3.12345: Flags [P.], seq 496:498, ack 248, win 913, options [nop,nop,TS val 428024683 ecr 41047104], length 2
10:13:53.794942 IP Broadcom.Home.36616 > 192.168.1.3.12345: Flags [P.], seq 498:500, ack 248, win 913, options [nop,nop,TS val 428024684 ecr 41047105], length 2
10:13:53.795309 IP Broadcom.Home.36616 > 192.168.1.3.12345: Flags [P.], seq 500:503, ack 248, win 913, options [nop,nop,TS val 428024684 ecr 41047105], length 3
10:13:53.795713 IP Broadcom.Home.36616 > 192.168.1.3.12345: Flags [P.], seq 503:505, ack 248, win 913, options [nop,nop,TS val 428024684 ecr 41047105], length 2
10:13:53.796086 IP Broadcom.Home.36616 > 192.168.1.3.12345: Flags [P.], seq 505:507, ack 248, win 913, options [nop,nop,TS val 428024685 ecr 41047105], length 2
10:13:53.796414 IP Broadcom.Home.36616 > 192.168.1.3.12345: Flags [P.], seq 507:509, ack 248, win 913, options [nop,nop,TS val 428024685 ecr 41047105], length 2
10:13:53.796828 IP Broadcom.Home.36616 > 192.168.1.3.12345: Flags [P.], seq 509:511, ack 248, win 913, options [nop,nop,TS val 428024686 ecr 41047105], length 2
10:13:53.797263 IP Broadcom.Home.36616 > 192.168.1.3.12345: Flags [P.], seq 511:514, ack 248, win 913, options [nop,nop,TS val 428024686 ecr 41047105], length 3
10:13:53.797678 IP Broadcom.Home.36616 > 192.168.1.3.12345: Flags [P.], seq 514:516, ack 248, win 913, options [nop,nop,TS val 428024686 ecr 41047105], length 2
10:13:53.798091 IP Broadcom.Home.36616 > 192.168.1.3.12345: Flags [P.], seq 516:519, ack 248, win 913, options [nop,nop,TS val 428024687 ecr 41047105], length 3
10:13:53.798434 IP Broadcom.Home.36616 > 192.168.1.3.12345: Flags [P.], seq 519:521, ack 248, win 913, options [nop,nop,TS val 428024687 ecr 41047105], length 2
10:13:53.798844 IP Broadcom.Home.36616 > 192.168.1.3.12345: Flags [P.], seq 521:523, ack 248, win 913, options [nop,nop,TS val 428024688 ecr 41047106], length 2
10:13:53.799175 IP Broadcom.Home.36616 > 192.168.1.3.12345: Flags [P.], seq 523:525, ack 248, win 913, options [nop,nop,TS val 428024688 ecr 41047106], length 2
10:13:53.799503 IP Broadcom.Home.36616 > 192.168.1.3.12345: Flags [P.], seq 525:527, ack 248, win 913, options [nop,nop,TS val 428024688 ecr 41047106], length 2
10:13:53.799895 IP Broadcom.Home.36616 > 192.168.1.3.12345: Flags [P.], seq 527:529, ack 248, win 913, options [nop,nop,TS val 428024689 ecr 41047106], length 2
10:13:53.800215 IP Broadcom.Home.36616 > 192.168.1.3.12345: Flags [P.], seq 529:531, ack 248, win 913, options [nop,nop,TS val 428024689 ecr 41047106], length 2
10:13:53.800553 IP Broadcom.Home.36616 > 192.168.1.3.12345: Flags [P.], seq 531:533, ack 248, win 913, options [nop,nop,TS val 428024689 ecr 41047106], length 2
10:13:53.802005 IP Broadcom.Home.36616 > 192.168.1.3.12345: Flags [P.], seq 533:540, ack 248, win 913, options [nop,nop,TS val 428024691 ecr 41047106], length 7
10:13:53.803237 IP Broadcom.Home.36616 > 192.168.1.3.12345: Flags [.], ack 264, win 913, options [nop,nop,TS val 428024692 ecr 41047107], length 0
10:13:53.807942 IP Broadcom.Home.36616 > 192.168.1.3.12345: Flags [P.], seq 540:541, ack 264, win 913, options [nop,nop,TS val 428024697 ecr 41047107], length 1
10:13:53.850728 IP Broadcom.Home.36616 > 192.168.1.3.12345: Flags [P.], seq 541:550, ack 264, win 913, options [nop,nop,TS val 428024740 ecr 41047118], length 9
10:13:53.859803 IP Broadcom.Home.36616 > 192.168.1.3.12345: Flags [P.], seq 550:551, ack 298, win 913, options [nop,nop,TS val 428024749 ecr 41047119], length 1
10:13:53.899014 IP Broadcom.Home.36616 > 192.168.1.3.12345: Flags [P.], seq 551:590, ack 298, win 913, options [nop,nop,TS val 428024788 ecr 41047131], length 39
10:13:54.039677 IP Broadcom.Home.36616 > 192.168.1.3.12345: Flags [.], ack 302, win 913, options [nop,nop,TS val 428024929 ecr 41047156], length 0
10:13:54.100378 IP Broadcom.Home.36616 > 192.168.1.3.12345: Flags [.], ack 306, win 913, options [nop,nop,TS val 428024989 ecr 41047181], length 0
10:13:54.825099 IP Broadcom.Home.36616 > 192.168.1.3.12345: Flags [P.], seq 590:591, ack 306, win 913, options [nop,nop,TS val 428025714 ecr 41047181], length 1
10:13:54.825622 IP Broadcom.Home.36616 > 192.168.1.3.12345: Flags [P.], seq 591:593, ack 306, win 913, options [nop,nop,TS val 428025715 ecr 41047362], length 2
10:13:54.825959 IP Broadcom.Home.36616 > 192.168.1.3.12345: Flags [P.], seq 593:596, ack 306, win 913, options [nop,nop,TS val 428025715 ecr 41047362], length 3
10:13:54.826277 IP Broadcom.Home.36616 > 192.168.1.3.12345: Flags [P.], seq 596:598, ack 306, win 913, options [nop,nop,TS val 428025715 ecr 41047362], length 2
10:13:54.826660 IP Broadcom.Home.36616 > 192.168.1.3.12345: Flags [P.], seq 598:599, ack 306, win 913, options [nop,nop,TS val 428025716 ecr 41047362], length 1
10:13:54.826956 IP Broadcom.Home.36616 > 192.168.1.3.12345: Flags [P.], seq 599:602, ack 306, win 913, options [nop,nop,TS val 428025716 ecr 41047363], length 3
10:13:54.827307 IP Broadcom.Home.36616 > 192.168.1.3.12345: Flags [P.], seq 602:604, ack 306, win 913, options [nop,nop,TS val 428025716 ecr 41047363], length 2
10:13:54.827728 IP Broadcom.Home.36616 > 192.168.1.3.12345: Flags [P.], seq 604:607, ack 306, win 913, options [nop,nop,TS val 428025717 ecr 41047363], length 3
10:13:54.828055 IP Broadcom.Home.36616 > 192.168.1.3.12345: Flags [P.], seq 607:608, ack 306, win 913, options [nop,nop,TS val 428025717 ecr 41047363], length 1
10:13:54.828347 IP Broadcom.Home.36616 > 192.168.1.3.12345: Flags [P.], seq 608:610, ack 306, win 913, options [nop,nop,TS val 428025717 ecr 41047363], length 2
10:13:54.828732 IP Broadcom.Home.36616 > 192.168.1.3.12345: Flags [P.], seq 610:613, ack 306, win 913, options [nop,nop,TS val 428025718 ecr 41047363], length 3
10:13:54.829040 IP Broadcom.Home.36616 > 192.168.1.3.12345: Flags [P.], seq 613:614, ack 306, win 913, options [nop,nop,TS val 428025718 ecr 41047363], length 1
10:13:54.829360 IP Broadcom.Home.36616 > 192.168.1.3.12345: Flags [P.], seq 614:615, ack 306, win 913, options [nop,nop,TS val 428025718 ecr 41047363], length 1
10:13:54.829759 IP Broadcom.Home.36616 > 192.168.1.3.12345: Flags [P.], seq 615:618, ack 306, win 913, options [nop,nop,TS val 428025719 ecr 41047363], length 3
10:13:54.830068 IP Broadcom.Home.36616 > 192.168.1.3.12345: Flags [P.], seq 618:619, ack 306, win 913, options [nop,nop,TS val 428025719 ecr 41047363], length 1
10:13:54.830340 IP Broadcom.Home.36616 > 192.168.1.3.12345: Flags [P.], seq 619:622, ack 306, win 913, options [nop,nop,TS val 428025719 ecr 41047363], length 3
10:13:54.830739 IP Broadcom.Home.36616 > 192.168.1.3.12345: Flags [P.], seq 622:624, ack 306, win 913, options [nop,nop,TS val 428025720 ecr 41047363], length 2
10:13:54.831050 IP Broadcom.Home.36616 > 192.168.1.3.12345: Flags [P.], seq 624:625, ack 306, win 913, options [nop,nop,TS val 428025720 ecr 41047364], length 1
10:13:54.831363 IP Broadcom.Home.36616 > 192.168.1.3.12345: Flags [P.], seq 625:627, ack 306, win 913, options [nop,nop,TS val 428025720 ecr 41047364], length 2
10:13:54.831712 IP Broadcom.Home.36616 > 192.168.1.3.12345: Flags [P.], seq 627:628, ack 306, win 913, options [nop,nop,TS val 428025721 ecr 41047364], length 1
10:13:54.832040 IP Broadcom.Home.36616 > 192.168.1.3.12345: Flags [P.], seq 628:631, ack 306, win 913, options [nop,nop,TS val 428025721 ecr 41047364], length 3
10:13:54.832337 IP Broadcom.Home.36616 > 192.168.1.3.12345: Flags [P.], seq 631:633, ack 306, win 913, options [nop,nop,TS val 428025721 ecr 41047364], length 2
10:13:54.832708 IP Broadcom.Home.36616 > 192.168.1.3.12345: Flags [P.], seq 633:634, ack 306, win 913, options [nop,nop,TS val 428025722 ecr 41047364], length 1
10:13:54.833245 IP Broadcom.Home.36616 > 192.168.1.3.12345: Flags [P.], seq 634:638, ack 306, win 913, options [nop,nop,TS val 428025722 ecr 41047364], length 4
10:13:54.833634 IP Broadcom.Home.36616 > 192.168.1.3.12345: Flags [P.], seq 638:640, ack 306, win 913, options [nop,nop,TS val 428025723 ecr 41047364], length 2
10:13:54.833938 IP Broadcom.Home.36616 > 192.168.1.3.12345: Flags [P.], seq 640:642, ack 306, win 913, options [nop,nop,TS val 428025723 ecr 41047364], length 2
10:13:54.834251 IP Broadcom.Home.36616 > 192.168.1.3.12345: Flags [P.], seq 642:644, ack 306, win 913, options [nop,nop,TS val 428025723 ecr 41047364], length 2
10:13:54.834660 IP Broadcom.Home.36616 > 192.168.1.3.12345: Flags [P.], seq 644:646, ack 306, win 913, options [nop,nop,TS val 428025724 ecr 41047364], length 2
10:13:54.836053 IP Broadcom.Home.36616 > 192.168.1.3.12345: Flags [P.], seq 646:654, ack 306, win 913, options [nop,nop,TS val 428025725 ecr 41047365], length 8
10:13:54.836356 IP Broadcom.Home.36616 > 192.168.1.3.12345: Flags [P.], seq 654:656, ack 306, win 913, options [nop,nop,TS val 428025725 ecr 41047365], length 2
10:13:54.842708 IP Broadcom.Home.36616 > 192.168.1.3.12345: Flags [.], ack 322, win 913, options [nop,nop,TS val 428025732 ecr 41047367], length 0
10:13:54.847589 IP Broadcom.Home.36616 > 192.168.1.3.12345: Flags [P.], seq 656:657, ack 322, win 913, options [nop,nop,TS val 428025737 ecr 41047367], length 1
10:13:54.886667 IP Broadcom.Home.36616 > 192.168.1.3.12345: Flags [P.], seq 657:666, ack 322, win 913, options [nop,nop,TS val 428025776 ecr 41047378], length 9
10:13:54.895738 IP Broadcom.Home.36616 > 192.168.1.3.12345: Flags [P.], seq 666:667, ack 356, win 913, options [nop,nop,TS val 428025785 ecr 41047378], length 1
10:13:54.934673 IP Broadcom.Home.36616 > 192.168.1.3.12345: Flags [P.], seq 667:707, ack 356, win 913, options [nop,nop,TS val 428025824 ecr 41047390], length 40
10:13:55.075476 IP Broadcom.Home.36616 > 192.168.1.3.12345: Flags [.], ack 360, win 913, options [nop,nop,TS val 428025965 ecr 41047415], length 0
10:13:55.135814 IP Broadcom.Home.36616 > 192.168.1.3.12345: Flags [.], ack 364, win 913, options [nop,nop,TS val 428026025 ecr 41047440], length 0
10:13:55.898701 IP Broadcom.Home.36616 > 192.168.1.3.12345: Flags [P.], seq 707:708, ack 364, win 913, options [nop,nop,TS val 428026788 ecr 41047440], length 1
10:13:55.899210 IP Broadcom.Home.36616 > 192.168.1.3.12345: Flags [P.], seq 708:711, ack 364, win 913, options [nop,nop,TS val 428026788 ecr 41047631], length 3
10:13:55.899683 IP Broadcom.Home.36616 > 192.168.1.3.12345: Flags [P.], seq 711:714, ack 364, win 913, options [nop,nop,TS val 428026789 ecr 41047631], length 3
10:13:55.900039 IP Broadcom.Home.36616 > 192.168.1.3.12345: Flags [P.], seq 714:716, ack 364, win 913, options [nop,nop,TS val 428026789 ecr 41047631], length 2
10:13:55.900526 IP Broadcom.Home.36616 > 192.168.1.3.12345: Flags [P.], seq 716:718, ack 364, win 913, options [nop,nop,TS val 428026790 ecr 41047631], length 2
10:13:55.900892 IP Broadcom.Home.36616 > 192.168.1.3.12345: Flags [P.], seq 718:721, ack 364, win 913, options [nop,nop,TS val 428026790 ecr 41047631], length 3
10:13:55.901222 IP Broadcom.Home.36616 > 192.168.1.3.12345: Flags [P.], seq 721:723, ack 364, win 913, options [nop,nop,TS val 428026790 ecr 41047631], length 2
10:13:55.902747 IP Broadcom.Home.36616 > 192.168.1.3.12345: Flags [P.], seq 723:731, ack 364, win 913, options [nop,nop,TS val 428026792 ecr 41047631], length 8
10:13:55.903102 IP Broadcom.Home.36616 > 192.168.1.3.12345: Flags [P.], seq 731:733, ack 364, win 913, options [nop,nop,TS val 428026792 ecr 41047632], length 2
10:13:55.903609 IP Broadcom.Home.36616 > 192.168.1.3.12345: Flags [P.], seq 733:736, ack 364, win 913, options [nop,nop,TS val 428026793 ecr 41047632], length 3
10:13:55.903976 IP Broadcom.Home.36616 > 192.168.1.3.12345: Flags [P.], seq 736:739, ack 364, win 913, options [nop,nop,TS val 428026793 ecr 41047632], length 3
10:13:55.904396 IP Broadcom.Home.36616 > 192.168.1.3.12345: Flags [P.], seq 739:740, ack 364, win 913, options [nop,nop,TS val 428026793 ecr 41047632], length 1
10:13:55.904714 IP Broadcom.Home.36616 > 192.168.1.3.12345: Flags [P.], seq 740:743, ack 364, win 913, options [nop,nop,TS val 428026794 ecr 41047632], length 3
10:13:55.905020 IP Broadcom.Home.36616 > 192.168.1.3.12345: Flags [P.], seq 743:745, ack 364, win 913, options [nop,nop,TS val 428026794 ecr 41047632], length 2
10:13:55.905381 IP Broadcom.Home.36616 > 192.168.1.3.12345: Flags [P.], seq 745:746, ack 364, win 913, options [nop,nop,TS val 428026795 ecr 41047632], length 1
10:13:55.905713 IP Broadcom.Home.36616 > 192.168.1.3.12345: Flags [P.], seq 746:749, ack 364, win 913, options [nop,nop,TS val 428026795 ecr 41047632], length 3
10:13:55.905999 IP Broadcom.Home.36616 > 192.168.1.3.12345: Flags [P.], seq 749:750, ack 364, win 913, options [nop,nop,TS val 428026795 ecr 41047632], length 1
10:13:55.906405 IP Broadcom.Home.36616 > 192.168.1.3.12345: Flags [P.], seq 750:752, ack 364, win 913, options [nop,nop,TS val 428026796 ecr 41047632], length 2
10:13:55.906753 IP Broadcom.Home.36616 > 192.168.1.3.12345: Flags [P.], seq 752:755, ack 364, win 913, options [nop,nop,TS val 428026796 ecr 41047633], length 3
10:13:55.907093 IP Broadcom.Home.36616 > 192.168.1.3.12345: Flags [P.], seq 755:757, ack 364, win 913, options [nop,nop,TS val 428026796 ecr 41047633], length 2
10:13:55.907519 IP Broadcom.Home.36616 > 192.168.1.3.12345: Flags [P.], seq 757:759, ack 364, win 913, options [nop,nop,TS val 428026797 ecr 41047633], length 2
10:13:55.907868 IP Broadcom.Home.36616 > 192.168.1.3.12345: Flags [P.], seq 759:761, ack 364, win 913, options [nop,nop,TS val 428026797 ecr 41047633], length 2
10:13:55.908196 IP Broadcom.Home.36616 > 192.168.1.3.12345: Flags [P.], seq 761:763, ack 364, win 913, options [nop,nop,TS val 428026797 ecr 41047633], length 2
10:13:55.908554 IP Broadcom.Home.36616 > 192.168.1.3.12345: Flags [P.], seq 763:765, ack 364, win 913, options [nop,nop,TS val 428026798 ecr 41047633], length 2
10:13:55.908906 IP Broadcom.Home.36616 > 192.168.1.3.12345: Flags [P.], seq 765:766, ack 364, win 913, options [nop,nop,TS val 428026798 ecr 41047633], length 1
10:13:55.909259 IP Broadcom.Home.36616 > 192.168.1.3.12345: Flags [P.], seq 766:769, ack 364, win 913, options [nop,nop,TS val 428026798 ecr 41047633], length 3
10:13:55.909596 IP Broadcom.Home.36616 > 192.168.1.3.12345: Flags [P.], seq 769:770, ack 364, win 913, options [nop,nop,TS val 428026799 ecr 41047633], length 1
10:13:55.909902 IP Broadcom.Home.36616 > 192.168.1.3.12345: Flags [P.], seq 770:773, ack 364, win 913, options [nop,nop,TS val 428026799 ecr 41047633], length 3
10:13:55.918694 IP Broadcom.Home.36616 > 192.168.1.3.12345: Flags [.], ack 380, win 913, options [nop,nop,TS val 428026808 ecr 41047636], length 0
10:13:55.923710 IP Broadcom.Home.36616 > 192.168.1.3.12345: Flags [P.], seq 773:775, ack 380, win 913, options [nop,nop,TS val 428026813 ecr 41047636], length 2
10:13:55.962706 IP Broadcom.Home.36616 > 192.168.1.3.12345: Flags [P.], seq 775:783, ack 380, win 913, options [nop,nop,TS val 428026852 ecr 41047647], length 8
10:13:55.971688 IP Broadcom.Home.36616 > 192.168.1.3.12345: Flags [P.], seq 783:784, ack 414, win 913, options [nop,nop,TS val 428026861 ecr 41047647], length 1
10:13:56.014652 IP Broadcom.Home.36616 > 192.168.1.3.12345: Flags [P.], seq 784:824, ack 414, win 913, options [nop,nop,TS val 428026904 ecr 41047659], length 40
10:13:56.155422 IP Broadcom.Home.36616 > 192.168.1.3.12345: Flags [.], ack 418, win 913, options [nop,nop,TS val 428027045 ecr 41047685], length 0
10:13:56.215781 IP Broadcom.Home.36616 > 192.168.1.3.12345: Flags [.], ack 422, win 913, options [nop,nop,TS val 428027105 ecr 41047710], length 0
10:13:56.895497 IP Broadcom.Home.36616 > 192.168.1.3.12345: Flags [P.], seq 824:826, ack 422, win 913, options [nop,nop,TS val 428027785 ecr 41047710], length 2
10:13:56.896055 IP Broadcom.Home.36616 > 192.168.1.3.12345: Flags [P.], seq 826:828, ack 422, win 913, options [nop,nop,TS val 428027785 ecr 41047880], length 2
10:13:56.896437 IP Broadcom.Home.36616 > 192.168.1.3.12345: Flags [P.], seq 828:831, ack 422, win 913, options [nop,nop,TS val 428027786 ecr 41047880], length 3
10:13:56.896781 IP Broadcom.Home.36616 > 192.168.1.3.12345: Flags [P.], seq 831:834, ack 422, win 913, options [nop,nop,TS val 428027786 ecr 41047880], length 3
10:13:56.897127 IP Broadcom.Home.36616 > 192.168.1.3.12345: Flags [P.], seq 834:835, ack 422, win 913, options [nop,nop,TS val 428027786 ecr 41047880], length 1
10:13:56.897557 IP Broadcom.Home.36616 > 192.168.1.3.12345: Flags [P.], seq 835:836, ack 422, win 913, options [nop,nop,TS val 428027787 ecr 41047880], length 1
10:13:56.897935 IP Broadcom.Home.36616 > 192.168.1.3.12345: Flags [P.], seq 836:840, ack 422, win 913, options [nop,nop,TS val 428027787 ecr 41047880], length 4
10:13:56.898415 IP Broadcom.Home.36616 > 192.168.1.3.12345: Flags [P.], seq 840:843, ack 422, win 913, options [nop,nop,TS val 428027788 ecr 41047880], length 3
10:13:56.898842 IP Broadcom.Home.36616 > 192.168.1.3.12345: Flags [P.], seq 843:845, ack 422, win 913, options [nop,nop,TS val 428027788 ecr 41047881], length 2
10:13:56.899394 IP Broadcom.Home.36616 > 192.168.1.3.12345: Flags [P.], seq 845:848, ack 422, win 913, options [nop,nop,TS val 428027789 ecr 41047881], length 3
10:13:56.899723 IP Broadcom.Home.36616 > 192.168.1.3.12345: Flags [P.], seq 848:850, ack 422, win 913, options [nop,nop,TS val 428027789 ecr 41047881], length 2
10:13:56.900092 IP Broadcom.Home.36616 > 192.168.1.3.12345: Flags [P.], seq 850:853, ack 422, win 913, options [nop,nop,TS val 428027789 ecr 41047881], length 3
10:13:56.900555 IP Broadcom.Home.36616 > 192.168.1.3.12345: Flags [P.], seq 853:855, ack 422, win 913, options [nop,nop,TS val 428027790 ecr 41047881], length 2
10:13:56.900877 IP Broadcom.Home.36616 > 192.168.1.3.12345: Flags [P.], seq 855:857, ack 422, win 913, options [nop,nop,TS val 428027790 ecr 41047881], length 2
10:13:56.901281 IP Broadcom.Home.36616 > 192.168.1.3.12345: Flags [P.], seq 857:859, ack 422, win 913, options [nop,nop,TS val 428027791 ecr 41047881], length 2
10:13:56.901594 IP Broadcom.Home.36616 > 192.168.1.3.12345: Flags [P.], seq 859:861, ack 422, win 913, options [nop,nop,TS val 428027791 ecr 41047881], length 2
10:13:56.901908 IP Broadcom.Home.36616 > 192.168.1.3.12345: Flags [P.], seq 861:863, ack 422, win 913, options [nop,nop,TS val 428027791 ecr 41047881], length 2
10:13:56.903501 IP Broadcom.Home.36616 > 192.168.1.3.12345: Flags [P.], seq 863:872, ack 422, win 913, options [nop,nop,TS val 428027793 ecr 41047881], length 9
