10:51:15.398505 IP Broadcom.Home.37875 > 192.168.1.3.9888: Flags [P.], seq 816573543:816573631, ack 2224227689, win 913, options [nop,nop,TS val 430266650 ecr 41607255], length 88
10:51:16.400355 IP Broadcom.Home.37875 > 192.168.1.3.9888: Flags [P.], seq 88:176, ack 1, win 913, options [nop,nop,TS val 430267652 ecr 41607506], length 88
10:51:17.403158 IP Broadcom.Home.37875 > 192.168.1.3.9888: Flags [P.], seq 176:264, ack 1, win 913, options [nop,nop,TS val 430268655 ecr 41607756], length 88
10:51:18.405968 IP Broadcom.Home.37875 > 192.168.1.3.9888: Flags [P.], seq 264:352, ack 1, win 913, options [nop,nop,TS val 430269658 ecr 41608007], length 88
10:51:19.408828 IP Broadcom.Home.37875 > 192.168.1.3.9888: Flags [P.], seq 352:440, ack 1, win 913, options [nop,nop,TS val 430270661 ecr 41608257], length 88
10:51:20.410729 IP Broadcom.Home.37875 > 192.168.1.3.9888: Flags [P.], seq 440:528, ack 1, win 913, options [nop,nop,TS val 430271663 ecr 41608508], length 88
10:51:21.413467 IP Broadcom.Home.37875 > 192.168.1.3.9888: Flags [P.], seq 528:616, ack 1, win 913, options [nop,nop,TS val 430272666 ecr 41608759], length 88
10:51:22.415307 IP Broadcom.Home.37875 > 192.168.1.3.9888: Flags [P.], seq 616:704, ack 1, win 913, options [nop,nop,TS val 430273668 ecr 41609009], length 88
10:51:23.418052 IP Broadcom.Home.37875 > 192.168.1.3.9888: Flags [P.], seq 704:792, ack 1, win 913, options [nop,nop,TS val 430274671 ecr 41609260], length 88
10:51:24.419907 IP Broadcom.Home.37875 > 192.168.1.3.9888: Flags [P.], seq 792:880, ack 1, win 913, options [nop,nop,TS val 430275673 ecr 41609510], length 88
10:51:25.422068 IP Broadcom.Home.37875 > 192.168.1.3.9888: Flags [P.], seq 880:968, ack 1, win 913, options [nop,nop,TS val 430276675 ecr 41609761], length 88
10:51:26.424539 IP Broadcom.Home.37875 > 192.168.1.3.9888: Flags [P.], seq 968:1056, ack 1, win 913, options [nop,nop,TS val 430277678 ecr 41610011], length 88
10:51:27.426376 IP Broadcom.Home.37875 > 192.168.1.3.9888: Flags [P.], seq 1056:1144, ack 1, win 913, options [nop,nop,TS val 430278680 ecr 41610262], length 88
10:51:28.429159 IP Broadcom.Home.37875 > 192.168.1.3.9888: Flags [P.], seq 1144:1232, ack 1, win 913, options [nop,nop,TS val 430279683 ecr 41610513], length 88
10:51:29.431970 IP Broadcom.Home.37875 > 192.168.1.3.9888: Flags [P.], seq 1232:1320, ack 1, win 913, options [nop,nop,TS val 430280686 ecr 41610763], length 88
10:51:30.433896 IP Broadcom.Home.37875 > 192.168.1.3.9888: Flags [P.], seq 1320:1408, ack 1, win 913, options [nop,nop,TS val 430281688 ecr 41611014], length 88
10:51:31.436554 IP Broadcom.Home.37875 > 192.168.1.3.9888: Flags [P.], seq 1408:1496, ack 1, win 913, options [nop,nop,TS val 430282691 ecr 41611264], length 88
10:51:32.438394 IP Broadcom.Home.37875 > 192.168.1.3.9888: Flags [P.], seq 1496:1584, ack 1, win 913, options [nop,nop,TS val 430283693 ecr 41611515], length 88
10:51:33.440202 IP Broadcom.Home.37875 > 192.168.1.3.9888: Flags [P.], seq 1584:1672, ack 1, win 913, options [nop,nop,TS val 430284695 ecr 41611766], length 88
10:51:34.443045 IP Broadcom.Home.37875 > 192.168.1.3.9888: Flags [P.], seq 1672:1760, ack 1, win 913, options [nop,nop,TS val 430285698 ecr 41612016], length 88
10:51:35.444964 IP Broadcom.Home.37875 > 192.168.1.3.9888: Flags [P.], seq 1760:1848, ack 1, win 913, options [nop,nop,TS val 430286700 ecr 41612267], length 88
10:51:36.447724 IP Broadcom.Home.37875 > 192.168.1.3.9888: Flags [P.], seq 1848:1936, ack 1, win 913, options [nop,nop,TS val 430287703 ecr 41612517], length 88
10:51:37.449536 IP Broadcom.Home.37875 > 192.168.1.3.9888: Flags [P.], seq 1936:2024, ack 1, win 913, options [nop,nop,TS val 430288705 ecr 41612768], length 88
10:51:38.452319 IP Broadcom.Home.37875 > 192.168.1.3.9888: Flags [P.], seq 2024:2112, ack 1, win 913, options [nop,nop,TS val 430289708 ecr 41613018], length 88
10:51:39.454643 IP Broadcom.Home.37875 > 192.168.1.3.9888: Flags [P.], seq 2112:2200, ack 1, win 913, options [nop,nop,TS val 430290710 ecr 41613269], length 88
10:51:40.458186 IP Broadcom.Home.37875 > 192.168.1.3.9888: Flags [P.], seq 2200:2288, ack 1, win 913, options [nop,nop,TS val 430291714 ecr 41613520], length 88
10:51:41.460807 IP Broadcom.Home.37875 > 192.168.1.3.9888: Flags [P.], seq 2288:2376, ack 1, win 913, options [nop,nop,TS val 430292717 ecr 41613770], length 88
10:51:42.462647 IP Broadcom.Home.37875 > 192.168.1.3.9888: Flags [P.], seq 2376:2464, ack 1, win 913, options [nop,nop,TS val 430293719 ecr 41614021], length 88
10:51:43.465457 IP Broadcom.Home.37875 > 192.168.1.3.9888: Flags [P.], seq 2464:2552, ack 1, win 913, options [nop,nop,TS val 430294722 ecr 41614272], length 88
10:51:44.467255 IP Broadcom.Home.37875 > 192.168.1.3.9888: Flags [P.], seq 2552:2640, ack 1, win 913, options [nop,nop,TS val 430295724 ecr 41614522], length 88
10:51:45.470094 IP Broadcom.Home.37875 > 192.168.1.3.9888: Flags [P.], seq 2640:2728, ack 1, win 913, options [nop,nop,TS val 430296727 ecr 41614773], length 88
10:51:46.472854 IP Broadcom.Home.37875 > 192.168.1.3.9888: Flags [P.], seq 2728:2816, ack 1, win 913, options [nop,nop,TS val 430297730 ecr 41615023], length 88
10:51:47.475871 IP Broadcom.Home.37875 > 192.168.1.3.9888: Flags [P.], seq 2816:2904, ack 1, win 913, options [nop,nop,TS val 430298733 ecr 41615274], length 88
10:51:48.478481 IP Broadcom.Home.37875 > 192.168.1.3.9888: Flags [P.], seq 2904:2992, ack 1, win 913, options [nop,nop,TS val 430299736 ecr 41615525], length 88
10:51:49.481288 IP Broadcom.Home.37875 > 192.168.1.3.9888: Flags [P.], seq 2992:3080, ack 1, win 913, options [nop,nop,TS val 430300739 ecr 41615776], length 88
10:51:50.484107 IP Broadcom.Home.37875 > 192.168.1.3.9888: Flags [P.], seq 3080:3168, ack 1, win 913, options [nop,nop,TS val 430301742 ecr 41616026], length 88
10:51:51.485955 IP Broadcom.Home.37875 > 192.168.1.3.9888: Flags [P.], seq 3168:3256, ack 1, win 913, options [nop,nop,TS val 430302744 ecr 41616277], length 88
10:51:52.488710 IP Broadcom.Home.37875 > 192.168.1.3.9888: Flags [P.], seq 3256:3344, ack 1, win 913, options [nop,nop,TS val 430303747 ecr 41616527], length 88
10:51:53.491517 IP Broadcom.Home.37875 > 192.168.1.3.9888: Flags [P.], seq 3344:3432, ack 1, win 913, options [nop,nop,TS val 430304750 ecr 41616778], length 88
10:51:54.493343 IP Broadcom.Home.37875 > 192.168.1.3.9888: Flags [P.], seq 3432:3520, ack 1, win 913, options [nop,nop,TS val 430305752 ecr 41617029], length 88
10:51:55.495187 IP Broadcom.Home.37875 > 192.168.1.3.9888: Flags [P.], seq 3520:3608, ack 1, win 913, options [nop,nop,TS val 430306754 ecr 41617279], length 88
10:51:56.497989 IP Broadcom.Home.37875 > 192.168.1.3.9888: Flags [P.], seq 3608:3696, ack 1, win 913, options [nop,nop,TS val 430307757 ecr 41617530], length 88
10:51:57.500822 IP Broadcom.Home.37875 > 192.168.1.3.9888: Flags [P.], seq 3696:3784, ack 1, win 913, options [nop,nop,TS val 430308760 ecr 41617780], length 88
10:51:58.506158 IP Broadcom.Home.37875 > 192.168.1.3.9888: Flags [P.], seq 3784:3872, ack 1, win 913, options [nop,nop,TS val 430309765 ecr 41618031], length 88
10:51:59.509675 IP Broadcom.Home.37875 > 192.168.1.3.9888: Flags [P.], seq 3872:3960, ack 1, win 913, options [nop,nop,TS val 430310769 ecr 41618282], length 88
10:52:00.511421 IP Broadcom.Home.37875 > 192.168.1.3.9888: Flags [P.], seq 3960:4048, ack 1, win 913, options [nop,nop,TS val 430311771 ecr 41618533], length 88
10:52:01.513197 IP Broadcom.Home.37875 > 192.168.1.3.9888: Flags [P.], seq 4048:4136, ack 1, win 913, options [nop,nop,TS val 430312773 ecr 41618784], length 88
10:52:02.515026 IP Broadcom.Home.37875 > 192.168.1.3.9888: Flags [P.], seq 4136:4224, ack 1, win 913, options [nop,nop,TS val 430313775 ecr 41619034], length 88
10:52:03.516897 IP Broadcom.Home.37875 > 192.168.1.3.9888: Flags [P.], seq 4224:4312, ack 1, win 913, options [nop,nop,TS val 430314777 ecr 41619285], length 88
10:52:04.519835 IP Broadcom.Home.37875 > 192.168.1.3.9888: Flags [P.], seq 4312:4400, ack 1, win 913, options [nop,nop,TS val 430315780 ecr 41619535], length 88
10:52:05.522412 IP Broadcom.Home.37875 > 192.168.1.3.9888: Flags [P.], seq 4400:4488, ack 1, win 913, options [nop,nop,TS val 430316783 ecr 41619786], length 88
10:52:06.525335 IP Broadcom.Home.37875 > 192.168.1.3.9888: Flags [P.], seq 4488:4576, ack 1, win 913, options [nop,nop,TS val 430317786 ecr 41620037], length 88
10:52:07.528188 IP Broadcom.Home.37875 > 192.168.1.3.9888: Flags [P.], seq 4576:4664, ack 1, win 913, options [nop,nop,TS val 430318789 ecr 41620287], length 88
10:52:08.530016 IP Broadcom.Home.37875 > 192.168.1.3.9888: Flags [P.], seq 4664:4752, ack 1, win 913, options [nop,nop,TS val 430319791 ecr 41620538], length 88
10:52:09.532690 IP Broadcom.Home.37875 > 192.168.1.3.9888: Flags [P.], seq 4752:4840, ack 1, win 913, options [nop,nop,TS val 430320794 ecr 41620788], length 88
10:52:10.534574 IP Broadcom.Home.37875 > 192.168.1.3.9888: Flags [P.], seq 4840:4928, ack 1, win 913, options [nop,nop,TS val 430321796 ecr 41621039], length 88
10:52:11.536394 IP Broadcom.Home.37875 > 192.168.1.3.9888: Flags [P.], seq 4928:5016, ack 1, win 913, options [nop,nop,TS val 430322798 ecr 41621290], length 88
10:52:12.539199 IP Broadcom.Home.37875 > 192.168.1.3.9888: Flags [P.], seq 5016:5104, ack 1, win 913, options [nop,nop,TS val 430323801 ecr 41621540], length 88
10:52:13.541007 IP Broadcom.Home.37875 > 192.168.1.3.9888: Flags [P.], seq 5104:5192, ack 1, win 913, options [nop,nop,TS val 430324803 ecr 41621791], length 88
10:52:14.543803 IP Broadcom.Home.37875 > 192.168.1.3.9888: Flags [P.], seq 5192:5280, ack 1, win 913, options [nop,nop,TS val 430325806 ecr 41622041], length 88
10:52:15.546663 IP Broadcom.Home.37875 > 192.168.1.3.9888: Flags [P.], seq 5280:5368, ack 1, win 913, options [nop,nop,TS val 430326809 ecr 41622292], length 88
10:52:16.548476 IP Broadcom.Home.37875 > 192.168.1.3.9888: Flags [P.], seq 5368:5456, ack 1, win 913, options [nop,nop,TS val 430327811 ecr 41622543], length 88
10:52:17.550384 IP Broadcom.Home.37875 > 192.168.1.3.9888: Flags [P.], seq 5456:5544, ack 1, win 913, options [nop,nop,TS val 430328813 ecr 41622793], length 88
10:52:18.552309 IP Broadcom.Home.37875 > 192.168.1.3.9888: Flags [P.], seq 5544:5632, ack 1, win 913, options [nop,nop,TS val 430329815 ecr 41623044], length 88
10:52:19.555031 IP Broadcom.Home.37875 > 192.168.1.3.9888: Flags [P.], seq 5632:5720, ack 1, win 913, options [nop,nop,TS val 430330818 ecr 41623294], length 88
10:52:20.556703 IP Broadcom.Home.37875 > 192.168.1.3.9888: Flags [P.], seq 5720:5808, ack 1, win 913, options [nop,nop,TS val 430331820 ecr 41623545], length 88
10:52:21.558546 IP Broadcom.Home.37875 > 192.168.1.3.9888: Flags [P.], seq 5808:5896, ack 1, win 913, options [nop,nop,TS val 430332822 ecr 41623795], length 88
10:52:22.561383 IP Broadcom.Home.37875 > 192.168.1.3.9888: Flags [P.], seq 5896:5984, ack 1, win 913, options [nop,nop,TS val 430333825 ecr 41624046], length 88
10:52:23.563226 IP Broadcom.Home.37875 > 192.168.1.3.9888: Flags [P.], seq 5984:6072, ack 1, win 913, options [nop,nop,TS val 430334827 ecr 41624296], length 88
10:52:24.565019 IP Broadcom.Home.37875 > 192.168.1.3.9888: Flags [P.], seq 6072:6160, ack 1, win 913, options [nop,nop,TS val 430335829 ecr 41624547], length 88
10:52:25.567849 IP Broadcom.Home.37875 > 192.168.1.3.9888: Flags [P.], seq 6160:6248, ack 1, win 913, options [nop,nop,TS val 430336832 ecr 41624797], length 88
10:52:26.569640 IP Broadcom.Home.37875 > 192.168.1.3.9888: Flags [P.], seq 6248:6336, ack 1, win 913, options [nop,nop,TS val 430337834 ecr 41625048], length 88
10:52:27.571451 IP Broadcom.Home.37875 > 192.168.1.3.9888: Flags [P.], seq 6336:6424, ack 1, win 913, options [nop,nop,TS val 430338836 ecr 41625298], length 88
10:52:28.574221 IP Broadcom.Home.37875 > 192.168.1.3.9888: Flags [P.], seq 6424:6512, ack 1, win 913, options [nop,nop,TS val 430339839 ecr 41625549], length 88
10:52:29.576020 IP Broadcom.Home.37875 > 192.168.1.3.9888: Flags [P.], seq 6512:6600, ack 1, win 913, options [nop,nop,TS val 430340841 ecr 41625799], length 88
10:52:30.579066 IP Broadcom.Home.37875 > 192.168.1.3.9888: Flags [P.], seq 6600:6688, ack 1, win 913, options [nop,nop,TS val 430341844 ecr 41626050], length 88
10:52:31.580837 IP Broadcom.Home.37875 > 192.168.1.3.9888: Flags [P.], seq 6688:6776, ack 1, win 913, options [nop,nop,TS val 430342846 ecr 41626301], length 88
10:52:32.582761 IP Broadcom.Home.37875 > 192.168.1.3.9888: Flags [P.], seq 6776:6864, ack 1, win 913, options [nop,nop,TS val 430343848 ecr 41626551], length 88
10:52:33.586424 IP Broadcom.Home.37875 > 192.168.1.3.9888: Flags [P.], seq 6864:6952, ack 1, win 913, options [nop,nop,TS val 430344852 ecr 41626802], length 88
10:52:34.589137 IP Broadcom.Home.37875 > 192.168.1.3.9888: Flags [P.], seq 6952:7040, ack 1, win 913, options [nop,nop,TS val 430345855 ecr 41627053], length 88
10:52:35.591930 IP Broadcom.Home.37875 > 192.168.1.3.9888: Flags [P.], seq 7040:7128, ack 1, win 913, options [nop,nop,TS val 430346858 ecr 41627303], length 88
10:52:36.594817 IP Broadcom.Home.37875 > 192.168.1.3.9888: Flags [P.], seq 7128:7216, ack 1, win 913, options [nop,nop,TS val 430347861 ecr 41627554], length 88
10:52:37.596814 IP Broadcom.Home.37875 > 192.168.1.3.9888: Flags [P.], seq 7216:7304, ack 1, win 913, options [nop,nop,TS val 430348863 ecr 41627805], length 88
10:52:38.600636 IP Broadcom.Home.37875 > 192.168.1.3.9888: Flags [P.], seq 7304:7392, ack 1, win 913, options [nop,nop,TS val 430349867 ecr 41628055], length 88
10:52:39.603168 IP Broadcom.Home.37875 > 192.168.1.3.9888: Flags [P.], seq 7392:7480, ack 1, win 913, options [nop,nop,TS val 430350870 ecr 41628306], length 88
10:52:40.606037 IP Broadcom.Home.37875 > 192.168.1.3.9888: Flags [P.], seq 7480:7568, ack 1, win 913, options [nop,nop,TS val 430351873 ecr 41628557], length 88
10:52:41.607939 IP Broadcom.Home.37875 > 192.168.1.3.9888: Flags [P.], seq 7568:7656, ack 1, win 913, options [nop,nop,TS val 430352875 ecr 41628807], length 88
10:52:42.610705 IP Broadcom.Home.37875 > 192.168.1.3.9888: Flags [P.], seq 7656:7744, ack 1, win 913, options [nop,nop,TS val 430353878 ecr 41629058], length 88
10:52:43.612515 IP Broadcom.Home.37875 > 192.168.1.3.9888: Flags [P.], seq 7744:7832, ack 1, win 913, options [nop,nop,TS val 430354880 ecr 41629309], length 88
10:52:44.614327 IP Broadcom.Home.37875 > 192.168.1.3.9888: Flags [P.], seq 7832:7920, ack 1, win 913, options [nop,nop,TS val 430355882 ecr 41629559], length 88
10:52:45.617132 IP Broadcom.Home.37875 > 192.168.1.3.9888: Flags [P.], seq 7920:8008, ack 1, win 913, options [nop,nop,TS val 430356885 ecr 41629809], length 88
10:52:46.618982 IP Broadcom.Home.37875 > 192.168.1.3.9888: Flags [P.], seq 8008:8096, ack 1, win 913, options [nop,nop,TS val 430357887 ecr 41630060], length 88
10:52:47.620998 IP Broadcom.Home.37875 > 192.168.1.3.9888: Flags [P.], seq 8096:8184, ack 1, win 913, options [nop,nop,TS val 430358889 ecr 41630311], length 88
10:52:48.622622 IP Broadcom.Home.37875 > 192.168.1.3.9888: Flags [P.], seq 8184:8272, ack 1, win 913, options [nop,nop,TS val 430359891 ecr 41630561], length 88
10:52:49.624381 IP Broadcom.Home.37875 > 192.168.1.3.9888: Flags [P.], seq 8272:8360, ack 1, win 913, options [nop,nop,TS val 430360893 ecr 41630812], length 88
10:52:50.626258 IP Broadcom.Home.37875 > 192.168.1.3.9888: Flags [P.], seq 8360:8448, ack 1, win 913, options [nop,nop,TS val 430361895 ecr 41631062], length 88
10:52:51.629077 IP Broadcom.Home.37875 > 192.168.1.3.9888: Flags [P.], seq 8448:8536, ack 1, win 913, options [nop,nop,TS val 430362898 ecr 41631312], length 88
10:52:52.631226 IP Broadcom.Home.37875 > 192.168.1.3.9888: Flags [P.], seq 8536:8624, ack 1, win 913, options [nop,nop,TS val 430363900 ecr 41631563], length 88
10:52:53.634698 IP Broadcom.Home.37875 > 192.168.1.3.9888: Flags [P.], seq 8624:8712, ack 1, win 913, options [nop,nop,TS val 430364904 ecr 41631814], length 88
10:52:54.636515 IP Broadcom.Home.37875 > 192.168.1.3.9888: Flags [P.], seq 8712:8800, ack 1, win 913, options [nop,nop,TS val 430365906 ecr 41632065], length 88
10:52:55.639307 IP Broadcom.Home.37875 > 192.168.1.3.9888: Flags [P.], seq 8800:8888, ack 1, win 913, options [nop,nop,TS val 430366909 ecr 41632315], length 88
10:52:56.642123 IP Broadcom.Home.37875 > 192.168.1.3.9888: Flags [P.], seq 8888:8976, ack 1, win 913, options [nop,nop,TS val 430367912 ecr 41632566], length 88
10:52:57.643968 IP Broadcom.Home.37875 > 192.168.1.3.9888: Flags [P.], seq 8976:9064, ack 1, win 913, options [nop,nop,TS val 430368914 ecr 41632816], length 88
10:52:58.645761 IP Broadcom.Home.37875 > 192.168.1.3.9888: Flags [P.], seq 9064:9152, ack 1, win 913, options [nop,nop,TS val 430369916 ecr 41633067], length 88
10:52:59.647648 IP Broadcom.Home.37875 > 192.168.1.3.9888: Flags [P.], seq 9152:9240, ack 1, win 913, options [nop,nop,TS val 430370918 ecr 41633317], length 88
10:53:00.650359 IP Broadcom.Home.37875 > 192.168.1.3.9888: Flags [P.], seq 9240:9328, ack 1, win 913, options [nop,nop,TS val 430371921 ecr 41633568], length 88
10:53:01.653168 IP Broadcom.Home.37875 > 192.168.1.3.9888: Flags [P.], seq 9328:9416, ack 1, win 913, options [nop,nop,TS val 430372924 ecr 41633819], length 88
10:53:02.654970 IP Broadcom.Home.37875 > 192.168.1.3.9888: Flags [P.], seq 9416:9504, ack 1, win 913, options [nop,nop,TS val 430373926 ecr 41634069], length 88
10:53:03.657077 IP Broadcom.Home.37875 > 192.168.1.3.9888: Flags [P.], seq 9504:9592, ack 1, win 913, options [nop,nop,TS val 430374928 ecr 41634320], length 88
10:53:04.658625 IP Broadcom.Home.37875 > 192.168.1.3.9888: Flags [P.], seq 9592:9680, ack 1, win 913, options [nop,nop,TS val 430375930 ecr 41634570], length 88
10:53:05.661467 IP Broadcom.Home.37875 > 192.168.1.3.9888: Flags [P.], seq 9680:9768, ack 1, win 913, options [nop,nop,TS val 430376933 ecr 41634821], length 88
10:53:06.663304 IP Broadcom.Home.37875 > 192.168.1.3.9888: Flags [P.], seq 9768:9856, ack 1, win 913, options [nop,nop,TS val 430377935 ecr 41635071], length 88
10:53:07.666187 IP Broadcom.Home.37875 > 192.168.1.3.9888: Flags [P.], seq 9856:9944, ack 1, win 913, options [nop,nop,TS val 430378938 ecr 41635322], length 88
10:53:08.668919 IP Broadcom.Home.37875 > 192.168.1.3.9888: Flags [P.], seq 9944:10032, ack 1, win 913, options [nop,nop,TS val 430379941 ecr 41635572], length 88
10:53:09.670728 IP Broadcom.Home.37875 > 192.168.1.3.9888: Flags [P.], seq 10032:10120, ack 1, win 913, options [nop,nop,TS val 430380943 ecr 41635823], length 88
10:53:10.672508 IP Broadcom.Home.37875 > 192.168.1.3.9888: Flags [P.], seq 10120:10208, ack 1, win 913, options [nop,nop,TS val 430381945 ecr 41636074], length 88
10:53:11.675412 IP Broadcom.Home.37875 > 192.168.1.3.9888: Flags [P.], seq 10208:10296, ack 1, win 913, options [nop,nop,TS val 430382948 ecr 41636324], length 88
10:53:12.679169 IP Broadcom.Home.37875 > 192.168.1.3.9888: Flags [P.], seq 10296:10384, ack 1, win 913, options [nop,nop,TS val 430383952 ecr 41636575], length 88
10:53:13.680973 IP Broadcom.Home.37875 > 192.168.1.3.9888: Flags [P.], seq 10384:10472, ack 1, win 913, options [nop,nop,TS val 430384954 ecr 41636826], length 88
10:53:14.683745 IP Broadcom.Home.37875 > 192.168.1.3.9888: Flags [P.], seq 10472:10560, ack 1, win 913, options [nop,nop,TS val 430385957 ecr 41637076], length 88
10:53:15.686576 IP Broadcom.Home.37875 > 192.168.1.3.9888: Flags [P.], seq 10560:10648, ack 1, win 913, options [nop,nop,TS val 430386960 ecr 41637327], length 88
10:53:16.689374 IP Broadcom.Home.37875 > 192.168.1.3.9888: Flags [P.], seq 10648:10736, ack 1, win 913, options [nop,nop,TS val 430387963 ecr 41637578], length 88
10:53:17.691222 IP Broadcom.Home.37875 > 192.168.1.3.9888: Flags [P.], seq 10736:10824, ack 1, win 913, options [nop,nop,TS val 430388965 ecr 41637828], length 88
10:53:18.694136 IP Broadcom.Home.37875 > 192.168.1.3.9888: Flags [P.], seq 10824:10912, ack 1, win 913, options [nop,nop,TS val 430389968 ecr 41638079], length 88
10:53:19.696946 IP Broadcom.Home.37875 > 192.168.1.3.9888: Flags [P.], seq 10912:11000, ack 1, win 913, options [nop,nop,TS val 430390971 ecr 41638329], length 88
10:53:20.699692 IP Broadcom.Home.37875 > 192.168.1.3.9888: Flags [P.], seq 11000:11088, ack 1, win 913, options [nop,nop,TS val 430391974 ecr 41638580], length 88
10:53:21.701667 IP Broadcom.Home.37875 > 192.168.1.3.9888: Flags [P.], seq 11088:11176, ack 1, win 913, options [nop,nop,TS val 430392976 ecr 41638831], length 88
10:53:22.704291 IP Broadcom.Home.37875 > 192.168.1.3.9888: Flags [P.], seq 11176:11264, ack 1, win 913, options [nop,nop,TS val 430393979 ecr 41639081], length 88
10:53:23.706097 IP Broadcom.Home.37875 > 192.168.1.3.9888: Flags [P.], seq 11264:11352, ack 1, win 913, options [nop,nop,TS val 430394981 ecr 41639332], length 88
10:53:24.707939 IP Broadcom.Home.37875 > 192.168.1.3.9888: Flags [P.], seq 11352:11440, ack 1, win 913, options [nop,nop,TS val 430395983 ecr 41639582], length 88
10:53:25.709726 IP Broadcom.Home.37875 > 192.168.1.3.9888: Flags [P.], seq 11440:11528, ack 1, win 913, options [nop,nop,TS val 430396985 ecr 41639833], length 88
10:53:26.711550 IP Broadcom.Home.37875 > 192.168.1.3.9888: Flags [P.], seq 11528:11616, ack 1, win 913, options [nop,nop,TS val 430397987 ecr 41640083], length 88
10:53:27.713364 IP Broadcom.Home.37875 > 192.168.1.3.9888: Flags [P.], seq 11616:11704, ack 1, win 913, options [nop,nop,TS val 430398989 ecr 41640334], length 88
10:53:28.715248 IP Broadcom.Home.37875 > 192.168.1.3.9888: Flags [P.], seq 11704:11792, ack 1, win 913, options [nop,nop,TS val 430399991 ecr 41640584], length 88
10:53:29.717039 IP Broadcom.Home.37875 > 192.168.1.3.9888: Flags [P.], seq 11792:11880, ack 1, win 913, options [nop,nop,TS val 430400993 ecr 41640835], length 88
10:53:30.720007 IP Broadcom.Home.37875 > 192.168.1.3.9888: Flags [P.], seq 11880:11968, ack 1, win 913, options [nop,nop,TS val 430401996 ecr 41641085], length 88
10:53:31.722599 IP Broadcom.Home.37875 > 192.168.1.3.9888: Flags [P.], seq 11968:12056, ack 1, win 913, options [nop,nop,TS val 430402999 ecr 41641336], length 88
10:53:32.725513 IP Broadcom.Home.37875 > 192.168.1.3.9888: Flags [P.], seq 12056:12144, ack 1, win 913, options [nop,nop,TS val 430404002 ecr 41641587], length 88
10:53:33.728254 IP Broadcom.Home.37875 > 192.168.1.3.9888: Flags [P.], seq 12144:12232, ack 1, win 913, options [nop,nop,TS val 430405005 ecr 41641837], length 88
10:53:34.730236 IP Broadcom.Home.37875 > 192.168.1.3.9888: Flags [P.], seq 12232:12320, ack 1, win 913, options [nop,nop,TS val 430406007 ecr 41642088], length 88
10:53:35.731982 IP Broadcom.Home.37875 > 192.168.1.3.9888: Flags [P.], seq 12320:12408, ack 1, win 913, options [nop,nop,TS val 430407009 ecr 41642338], length 88
10:53:36.733800 IP Broadcom.Home.37875 > 192.168.1.3.9888: Flags [P.], seq 12408:12496, ack 1, win 913, options [nop,nop,TS val 430408011 ecr 41642589], length 88
10:53:37.736547 IP Broadcom.Home.37875 > 192.168.1.3.9888: Flags [P.], seq 12496:12584, ack 1, win 913, options [nop,nop,TS val 430409014 ecr 41642839], length 88
10:53:38.739435 IP Broadcom.Home.37875 > 192.168.1.3.9888: Flags [P.], seq 12584:12672, ack 1, win 913, options [nop,nop,TS val 430410017 ecr 41643090], length 88
10:53:39.741202 IP Broadcom.Home.37875 > 192.168.1.3.9888: Flags [P.], seq 12672:12760, ack 1, win 913, options [nop,nop,TS val 430411019 ecr 41643341], length 88
10:53:40.742956 IP Broadcom.Home.37875 > 192.168.1.3.9888: Flags [P.], seq 12760:12848, ack 1, win 913, options [nop,nop,TS val 430412021 ecr 41643591], length 88
10:53:41.745999 IP Broadcom.Home.37875 > 192.168.1.3.9888: Flags [P.], seq 12848:12936, ack 1, win 913, options [nop,nop,TS val 430413024 ecr 41643842], length 88
10:53:42.747626 IP Broadcom.Home.37875 > 192.168.1.3.9888: Flags [P.], seq 12936:13024, ack 1, win 913, options [nop,nop,TS val 430414026 ecr 41644092], length 88
10:53:43.749474 IP Broadcom.Home.37875 > 192.168.1.3.9888: Flags [P.], seq 13024:13112, ack 1, win 913, options [nop,nop,TS val 430415028 ecr 41644343], length 88
10:53:44.751495 IP Broadcom.Home.37875 > 192.168.1.3.9888: Flags [P.], seq 13112:13200, ack 1, win 913, options [nop,nop,TS val 430416030 ecr 41644593], length 88
10:53:45.755111 IP Broadcom.Home.37875 > 192.168.1.3.9888: Flags [P.], seq 13200:13288, ack 1, win 913, options [nop,nop,TS val 430417034 ecr 41644844], length 88
10:53:46.757888 IP Broadcom.Home.37875 > 192.168.1.3.9888: Flags [P.], seq 13288:13376, ack 1, win 913, options [nop,nop,TS val 430418037 ecr 41645095], length 88
10:53:47.760702 IP Broadcom.Home.37875 > 192.168.1.3.9888: Flags [P.], seq 13376:13464, ack 1, win 913, options [nop,nop,TS val 430419040 ecr 41645345], length 88
10:53:48.763494 IP Broadcom.Home.37875 > 192.168.1.3.9888: Flags [P.], seq 13464:13552, ack 1, win 913, options [nop,nop,TS val 430420043 ecr 41645596], length 88
10:53:49.765391 IP Broadcom.Home.37875 > 192.168.1.3.9888: Flags [P.], seq 13552:13640, ack 1, win 913, options [nop,nop,TS val 430421045 ecr 41645847], length 88
10:53:50.767370 IP Broadcom.Home.37875 > 192.168.1.3.9888: Flags [P.], seq 13640:13728, ack 1, win 913, options [nop,nop,TS val 430422047 ecr 41646097], length 88
10:53:51.770955 IP Broadcom.Home.37875 > 192.168.1.3.9888: Flags [P.], seq 13728:13816, ack 1, win 913, options [nop,nop,TS val 430423051 ecr 41646348], length 88
10:53:52.772777 IP Broadcom.Home.37875 > 192.168.1.3.9888: Flags [P.], seq 13816:13904, ack 1, win 913, options [nop,nop,TS val 430424053 ecr 41646599], length 88
10:53:53.774575 IP Broadcom.Home.37875 > 192.168.1.3.9888: Flags [P.], seq 13904:13992, ack 1, win 913, options [nop,nop,TS val 430425055 ecr 41646849], length 88
10:53:54.777442 IP Broadcom.Home.37875 > 192.168.1.3.9888: Flags [P.], seq 13992:14080, ack 1, win 913, options [nop,nop,TS val 430426058 ecr 41647100], length 88
10:53:55.779250 IP Broadcom.Home.37875 > 192.168.1.3.9888: Flags [P.], seq 14080:14168, ack 1, win 913, options [nop,nop,TS val 430427060 ecr 41647350], length 88
10:53:56.781274 IP Broadcom.Home.37875 > 192.168.1.3.9888: Flags [P.], seq 14168:14256, ack 1, win 913, options [nop,nop,TS val 430428062 ecr 41647601], length 88
10:53:57.782924 IP Broadcom.Home.37875 > 192.168.1.3.9888: Flags [P.], seq 14256:14344, ack 1, win 913, options [nop,nop,TS val 430429064 ecr 41647851], length 88
10:53:58.784759 IP Broadcom.Home.37875 > 192.168.1.3.9888: Flags [P.], seq 14344:14432, ack 1, win 913, options [nop,nop,TS val 430430066 ecr 41648102], length 88
10:53:59.786553 IP Broadcom.Home.37875 > 192.168.1.3.9888: Flags [P.], seq 14432:14520, ack 1, win 913, options [nop,nop,TS val 430431068 ecr 41648352], length 88
10:54:00.788397 IP Broadcom.Home.37875 > 192.168.1.3.9888: Flags [P.], seq 14520:14608, ack 1, win 913, options [nop,nop,TS val 430432070 ecr 41648603], length 88
10:54:01.790213 IP Broadcom.Home.37875 > 192.168.1.3.9888: Flags [P.], seq 14608:14696, ack 1, win 913, options [nop,nop,TS val 430433072 ecr 41648853], length 88
10:54:02.793522 IP Broadcom.Home.37875 > 192.168.1.3.9888: Flags [P.], seq 14696:14784, ack 1, win 913, options [nop,nop,TS val 430434075 ecr 41649103], length 88
10:54:03.795807 IP Broadcom.Home.37875 > 192.168.1.3.9888: Flags [P.], seq 14784:14872, ack 1, win 913, options [nop,nop,TS val 430435078 ecr 41649354], length 88
10:54:04.797596 IP Broadcom.Home.37875 > 192.168.1.3.9888: Flags [P.], seq 14872:14960, ack 1, win 913, options [nop,nop,TS val 430436080 ecr 41649605], length 88
10:54:05.799412 IP Broadcom.Home.37875 > 192.168.1.3.9888: Flags [P.], seq 14960:15048, ack 1, win 913, options [nop,nop,TS val 430437082 ecr 41649855], length 88
10:54:06.802204 IP Broadcom.Home.37875 > 192.168.1.3.9888: Flags [P.], seq 15048:15136, ack 1, win 913, options [nop,nop,TS val 430438085 ecr 41650106], length 88
10:54:07.805268 IP Broadcom.Home.37875 > 192.168.1.3.9888: Flags [P.], seq 15136:15224, ack 1, win 913, options [nop,nop,TS val 430439088 ecr 41650356], length 88
10:54:08.806897 IP Broadcom.Home.37875 > 192.168.1.3.9888: Flags [P.], seq 15224:15312, ack 1, win 913, options [nop,nop,TS val 430440090 ecr 41650607], length 88
10:54:09.808758 IP Broadcom.Home.37875 > 192.168.1.3.9888: Flags [P.], seq 15312:15400, ack 1, win 913, options [nop,nop,TS val 430441092 ecr 41650858], length 88
10:54:10.810672 IP Broadcom.Home.37875 > 192.168.1.3.9888: Flags [P.], seq 15400:15488, ack 1, win 913, options [nop,nop,TS val 430442094 ecr 41651108], length 88
10:54:11.813533 IP Broadcom.Home.37875 > 192.168.1.3.9888: Flags [P.], seq 15488:15576, ack 1, win 913, options [nop,nop,TS val 430443097 ecr 41651359], length 88
10:54:12.816233 IP Broadcom.Home.37875 > 192.168.1.3.9888: Flags [P.], seq 15576:15664, ack 1, win 913, options [nop,nop,TS val 430444100 ecr 41651609], length 88
10:54:13.818114 IP Broadcom.Home.37875 > 192.168.1.3.9888: Flags [P.], seq 15664:15752, ack 1, win 913, options [nop,nop,TS val 430445102 ecr 41651860], length 88
10:54:14.819857 IP Broadcom.Home.37875 > 192.168.1.3.9888: Flags [P.], seq 15752:15840, ack 1, win 913, options [nop,nop,TS val 430446104 ecr 41652110], length 88
10:54:15.821733 IP Broadcom.Home.37875 > 192.168.1.3.9888: Flags [P.], seq 15840:15928, ack 1, win 913, options [nop,nop,TS val 430447106 ecr 41652361], length 88
10:54:16.823735 IP Broadcom.Home.37875 > 192.168.1.3.9888: Flags [P.], seq 15928:16016, ack 1, win 913, options [nop,nop,TS val 430448108 ecr 41652611], length 88
10:54:17.827390 IP Broadcom.Home.37875 > 192.168.1.3.9888: Flags [P.], seq 16016:16104, ack 1, win 913, options [nop,nop,TS val 430449112 ecr 41652862], length 88
10:54:18.829205 IP Broadcom.Home.37875 > 192.168.1.3.9888: Flags [P.], seq 16104:16192, ack 1, win 913, options [nop,nop,TS val 430450114 ecr 41653113], length 88
10:54:19.831043 IP Broadcom.Home.37875 > 192.168.1.3.9888: Flags [P.], seq 16192:16280, ack 1, win 913, options [nop,nop,TS val 430451116 ecr 41653363], length 88
10:54:20.832874 IP Broadcom.Home.37875 > 192.168.1.3.9888: Flags [P.], seq 16280:16368, ack 1, win 913, options [nop,nop,TS val 430452118 ecr 41653614], length 88
10:54:21.836541 IP Broadcom.Home.37875 > 192.168.1.3.9888: Flags [P.], seq 16368:16456, ack 1, win 913, options [nop,nop,TS val 430453122 ecr 41653864], length 88
10:54:22.838437 IP Broadcom.Home.37875 > 192.168.1.3.9888: Flags [P.], seq 16456:16544, ack 1, win 913, options [nop,nop,TS val 430454124 ecr 41654115], length 88
10:54:23.840194 IP Broadcom.Home.37875 > 192.168.1.3.9888: Flags [P.], seq 16544:16632, ack 1, win 913, options [nop,nop,TS val 430455126 ecr 41654366], length 88
10:54:24.842025 IP Broadcom.Home.37875 > 192.168.1.3.9888: Flags [P.], seq 16632:16720, ack 1, win 913, options [nop,nop,TS val 430456128 ecr 41654616], length 88
10:54:25.844863 IP Broadcom.Home.37875 > 192.168.1.3.9888: Flags [P.], seq 16720:16808, ack 1, win 913, options [nop,nop,TS val 430457131 ecr 41654866], length 88
10:54:26.847670 IP Broadcom.Home.37875 > 192.168.1.3.9888: Flags [P.], seq 16808:16896, ack 1, win 913, options [nop,nop,TS val 430458134 ecr 41655117], length 88
10:54:27.849434 IP Broadcom.Home.37875 > 192.168.1.3.9888: Flags [P.], seq 16896:16984, ack 1, win 913, options [nop,nop,TS val 430459136 ecr 41655368], length 88
10:54:28.852412 IP Broadcom.Home.37875 > 192.168.1.3.9888: Flags [P.], seq 16984:17072, ack 1, win 913, options [nop,nop,TS val 430460139 ecr 41655618], length 88
10:54:29.854166 IP Broadcom.Home.37875 > 192.168.1.3.9888: Flags [P.], seq 17072:17160, ack 1, win 913, options [nop,nop,TS val 430461141 ecr 41655869], length 88
10:54:30.856951 IP Broadcom.Home.37875 > 192.168.1.3.9888: Flags [P.], seq 17160:17248, ack 1, win 913, options [nop,nop,TS val 430462144 ecr 41656119], length 88
10:54:31.858752 IP Broadcom.Home.37875 > 192.168.1.3.9888: Flags [P.], seq 17248:17336, ack 1, win 913, options [nop,nop,TS val 430463146 ecr 41656370], length 88
10:54:32.860595 IP Broadcom.Home.37875 > 192.168.1.3.9888: Flags [P.], seq 17336:17424, ack 1, win 913, options [nop,nop,TS val 430464148 ecr 41656621], length 88
10:54:33.862401 IP Broadcom.Home.37875 > 192.168.1.3.9888: Flags [P.], seq 17424:17512, ack 1, win 913, options [nop,nop,TS val 430465150 ecr 41656871], length 88
10:54:34.865178 IP Broadcom.Home.37875 > 192.168.1.3.9888: Flags [P.], seq 17512:17600, ack 1, win 913, options [nop,nop,TS val 430466153 ecr 41657122], length 88
10:54:35.867054 IP Broadcom.Home.37875 > 192.168.1.3.9888: Flags [P.], seq 17600:17688, ack 1, win 913, options [nop,nop,TS val 430467155 ecr 41657372], length 88
10:54:36.868995 IP Broadcom.Home.37875 > 192.168.1.3.9888: Flags [P.], seq 17688:17776, ack 1, win 913, options [nop,nop,TS val 430468157 ecr 41657623], length 88
10:54:37.871627 IP Broadcom.Home.37875 > 192.168.1.3.9888: Flags [P.], seq 17776:17864, ack 1, win 913, options [nop,nop,TS val 430469160 ecr 41657873], length 88
10:54:38.874683 IP Broadcom.Home.37875 > 192.168.1.3.9888: Flags [P.], seq 17864:17952, ack 1, win 913, options [nop,nop,TS val 430470163 ecr 41658124], length 88
10:54:39.877922 IP Broadcom.Home.37875 > 192.168.1.3.9888: Flags [P.], seq 17952:18040, ack 1, win 913, options [nop,nop,TS val 430471166 ecr 41658375], length 88
10:54:40.880232 IP Broadcom.Home.37875 > 192.168.1.3.9888: Flags [P.], seq 18040:18128, ack 1, win 913, options [nop,nop,TS val 430472169 ecr 41658625], length 88
10:54:41.881941 IP Broadcom.Home.37875 > 192.168.1.3.9888: Flags [P.], seq 18128:18216, ack 1, win 913, options [nop,nop,TS val 430473171 ecr 41658876], length 88
10:54:42.884783 IP Broadcom.Home.37875 > 192.168.1.3.9888: Flags [P.], seq 18216:18304, ack 1, win 913, options [nop,nop,TS val 430474174 ecr 41659126], length 88
10:54:43.886583 IP Broadcom.Home.37875 > 192.168.1.3.9888: Flags [P.], seq 18304:18392, ack 1, win 913, options [nop,nop,TS val 430475176 ecr 41659377], length 88
10:54:44.888380 IP Broadcom.Home.37875 > 192.168.1.3.9888: Flags [P.], seq 18392:18480, ack 1, win 913, options [nop,nop,TS val 430476178 ecr 41659628], length 88
10:54:45.890337 IP Broadcom.Home.37875 > 192.168.1.3.9888: Flags [P.], seq 18480:18568, ack 1, win 913, options [nop,nop,TS val 430477180 ecr 41659878], length 88
10:54:46.893039 IP Broadcom.Home.37875 > 192.168.1.3.9888: Flags [P.], seq 18568:18656, ack 1, win 913, options [nop,nop,TS val 430478183 ecr 41660129], length 88
10:54:47.895099 IP Broadcom.Home.37875 > 192.168.1.3.9888: Flags [P.], seq 18656:18714, ack 1, win 913, options [nop,nop,TS val 430479185 ecr 41660379], length 58
10:54:47.896728 IP Broadcom.Home.37875 > 192.168.1.3.9888: Flags [P.], seq 18714:18802, ack 1, win 913, options [nop,nop,TS val 430479187 ecr 41660630], length 88
10:54:48.898653 IP Broadcom.Home.37875 > 192.168.1.3.9888: Flags [P.], seq 18802:18890, ack 1, win 913, options [nop,nop,TS val 430480189 ecr 41660630], length 88
10:54:49.900454 IP Broadcom.Home.37875 > 192.168.1.3.9888: Flags [P.], seq 18890:18978, ack 1, win 913, options [nop,nop,TS val 430481191 ecr 41660881], length 88
10:54:50.903534 IP Broadcom.Home.37875 > 192.168.1.3.9888: Flags [P.], seq 18978:19066, ack 1, win 913, options [nop,nop,TS val 430482194 ecr 41661131], length 88
10:54:51.907103 IP Broadcom.Home.37875 > 192.168.1.3.9888: Flags [P.], seq 19066:19154, ack 1, win 913, options [nop,nop,TS val 430483198 ecr 41661382], length 88
10:54:52.908945 IP Broadcom.Home.37875 > 192.168.1.3.9888: Flags [P.], seq 19154:19242, ack 1, win 913, options [nop,nop,TS val 430484200 ecr 41661633], length 88
10:54:53.911745 IP Broadcom.Home.37875 > 192.168.1.3.9888: Flags [P.], seq 19242:19330, ack 1, win 913, options [nop,nop,TS val 430485203 ecr 41661883], length 88
10:54:54.914598 IP Broadcom.Home.37875 > 192.168.1.3.9888: Flags [P.], seq 19330:19418, ack 1, win 913, options [nop,nop,TS val 430486206 ecr 41662134], length 88
10:54:55.916416 IP Broadcom.Home.37875 > 192.168.1.3.9888: Flags [P.], seq 19418:19506, ack 1, win 913, options [nop,nop,TS val 430487208 ecr 41662385], length 88
10:54:56.918201 IP Broadcom.Home.37875 > 192.168.1.3.9888: Flags [P.], seq 19506:19594, ack 1, win 913, options [nop,nop,TS val 430488210 ecr 41662635], length 88
10:54:57.920999 IP Broadcom.Home.37875 > 192.168.1.3.9888: Flags [P.], seq 19594:19682, ack 1, win 913, options [nop,nop,TS val 430489213 ecr 41662885], length 88
10:54:58.923772 IP Broadcom.Home.37875 > 192.168.1.3.9888: Flags [P.], seq 19682:19770, ack 1, win 913, options [nop,nop,TS val 430490216 ecr 41663136], length 88
10:54:59.925592 IP Broadcom.Home.37875 > 192.168.1.3.9888: Flags [P.], seq 19770:19858, ack 1, win 913, options [nop,nop,TS val 430491218 ecr 41663387], length 88
10:55:00.927389 IP Broadcom.Home.37875 > 192.168.1.3.9888: Flags [P.], seq 19858:19946, ack 1, win 913, options [nop,nop,TS val 430492220 ecr 41663637], length 88
10:55:01.930188 IP Broadcom.Home.37875 > 192.168.1.3.9888: Flags [P.], seq 19946:20034, ack 1, win 913, options [nop,nop,TS val 430493223 ecr 41663888], length 88
10:55:02.933025 IP Broadcom.Home.37875 > 192.168.1.3.9888: Flags [P.], seq 20034:20122, ack 1, win 913, options [nop,nop,TS val 430494226 ecr 41664138], length 88
10:55:03.934865 IP Broadcom.Home.37875 > 192.168.1.3.9888: Flags [P.], seq 20122:20210, ack 1, win 913, options [nop,nop,TS val 430495228 ecr 41664389], length 88
10:55:04.937760 IP Broadcom.Home.37875 > 192.168.1.3.9888: Flags [P.], seq 20210:20298, ack 1, win 913, options [nop,nop,TS val 430496231 ecr 41664640], length 88
10:55:05.939509 IP Broadcom.Home.37875 > 192.168.1.3.9888: Flags [P.], seq 20298:20386, ack 1, win 913, options [nop,nop,TS val 430497233 ecr 41664890], length 88
10:55:06.941276 IP Broadcom.Home.37875 > 192.168.1.3.9888: Flags [P.], seq 20386:20474, ack 1, win 913, options [nop,nop,TS val 430498235 ecr 41665141], length 88
10:55:07.944251 IP Broadcom.Home.37875 > 192.168.1.3.9888: Flags [P.], seq 20474:20562, ack 1, win 913, options [nop,nop,TS val 430499238 ecr 41665391], length 88
10:55:08.946159 IP Broadcom.Home.37875 > 192.168.1.3.9888: Flags [P.], seq 20562:20650, ack 1, win 913, options [nop,nop,TS val 430500240 ecr 41665642], length 88
10:55:09.947715 IP Broadcom.Home.37875 > 192.168.1.3.9888: Flags [P.], seq 20650:20738, ack 1, win 913, options [nop,nop,TS val 430501242 ecr 41665892], length 88
10:55:10.950477 IP Broadcom.Home.37875 > 192.168.1.3.9888: Flags [P.], seq 20738:20826, ack 1, win 913, options [nop,nop,TS val 430502245 ecr 41666143], length 88
10:55:11.953336 IP Broadcom.Home.37875 > 192.168.1.3.9888: Flags [P.], seq 20826:20914, ack 1, win 913, options [nop,nop,TS val 430503248 ecr 41666394], length 88
10:55:12.956376 IP Broadcom.Home.37875 > 192.168.1.3.9888: Flags [P.], seq 20914:21002, ack 1, win 913, options [nop,nop,TS val 430504251 ecr 41666644], length 88
10:55:13.959076 IP Broadcom.Home.37875 > 192.168.1.3.9888: Flags [P.], seq 21002:21090, ack 1, win 913, options [nop,nop,TS val 430505254 ecr 41666895], length 88
10:55:14.961156 IP Broadcom.Home.37875 > 192.168.1.3.9888: Flags [P.], seq 21090:21178, ack 1, win 913, options [nop,nop,TS val 430506256 ecr 41667146], length 88
10:55:15.963669 IP Broadcom.Home.37875 > 192.168.1.3.9888: Flags [P.], seq 21178:21266, ack 1, win 913, options [nop,nop,TS val 430507259 ecr 41667396], length 88
10:55:16.965480 IP Broadcom.Home.37875 > 192.168.1.3.9888: Flags [P.], seq 21266:21354, ack 1, win 913, options [nop,nop,TS val 430508261 ecr 41667647], length 88
10:55:17.967258 IP Broadcom.Home.37875 > 192.168.1.3.9888: Flags [P.], seq 21354:21442, ack 1, win 913, options [nop,nop,TS val 430509263 ecr 41667897], length 88
10:55:18.970208 IP Broadcom.Home.37875 > 192.168.1.3.9888: Flags [P.], seq 21442:21530, ack 1, win 913, options [nop,nop,TS val 430510266 ecr 41668148], length 88
10:55:19.972040 IP Broadcom.Home.37875 > 192.168.1.3.9888: Flags [P.], seq 21530:21618, ack 1, win 913, options [nop,nop,TS val 430511268 ecr 41668398], length 88
