09:21:54.944626 IP Broadcom.Home.37869 > 192.168.1.3.9888: Flags [P.], seq 3137509263:3137509351, ack 1695189999, win 913, options [nop,nop,TS val 424905307 ecr 40267142], length 88
09:21:55.946455 IP Broadcom.Home.37869 > 192.168.1.3.9888: Flags [P.], seq 88:176, ack 1, win 913, options [nop,nop,TS val 424906309 ecr 40267392], length 88
09:21:56.949315 IP Broadcom.Home.37869 > 192.168.1.3.9888: Flags [P.], seq 176:264, ack 1, win 913, options [nop,nop,TS val 424907312 ecr 40267643], length 88
09:21:57.951222 IP Broadcom.Home.37869 > 192.168.1.3.9888: Flags [P.], seq 264:352, ack 1, win 913, options [nop,nop,TS val 424908314 ecr 40267893], length 88
09:21:58.954250 IP Broadcom.Home.37869 > 192.168.1.3.9888: Flags [P.], seq 352:440, ack 1, win 913, options [nop,nop,TS val 424909317 ecr 40268144], length 88
09:21:59.957861 IP Broadcom.Home.37869 > 192.168.1.3.9888: Flags [P.], seq 440:528, ack 1, win 913, options [nop,nop,TS val 424910321 ecr 40268394], length 88
09:22:00.959552 IP Broadcom.Home.37869 > 192.168.1.3.9888: Flags [P.], seq 528:616, ack 1, win 913, options [nop,nop,TS val 424911323 ecr 40268645], length 88
09:22:01.961403 IP Broadcom.Home.37869 > 192.168.1.3.9888: Flags [P.], seq 616:704, ack 1, win 913, options [nop,nop,TS val 424912325 ecr 40268896], length 88
09:22:02.963298 IP Broadcom.Home.37869 > 192.168.1.3.9888: Flags [P.], seq 704:792, ack 1, win 913, options [nop,nop,TS val 424913327 ecr 40269146], length 88
09:22:03.965112 IP Broadcom.Home.37869 > 192.168.1.3.9888: Flags [P.], seq 792:880, ack 1, win 913, options [nop,nop,TS val 424914329 ecr 40269397], length 88
09:22:04.966957 IP Broadcom.Home.37869 > 192.168.1.3.9888: Flags [P.], seq 880:968, ack 1, win 913, options [nop,nop,TS val 424915331 ecr 40269647], length 88
09:22:05.968715 IP Broadcom.Home.37869 > 192.168.1.3.9888: Flags [P.], seq 968:1056, ack 1, win 913, options [nop,nop,TS val 424916333 ecr 40269898], length 88
09:22:06.970451 IP Broadcom.Home.37869 > 192.168.1.3.9888: Flags [P.], seq 1056:1144, ack 1, win 913, options [nop,nop,TS val 424917335 ecr 40270148], length 88
09:22:07.972368 IP Broadcom.Home.37869 > 192.168.1.3.9888: Flags [P.], seq 1144:1232, ack 1, win 913, options [nop,nop,TS val 424918337 ecr 40270399], length 88
09:22:08.975177 IP Broadcom.Home.37869 > 192.168.1.3.9888: Flags [P.], seq 1232:1320, ack 1, win 913, options [nop,nop,TS val 424919340 ecr 40270649], length 88
09:22:09.976916 IP Broadcom.Home.37869 > 192.168.1.3.9888: Flags [P.], seq 1320:1408, ack 1, win 913, options [nop,nop,TS val 424920342 ecr 40270900], length 88
09:22:10.979705 IP Broadcom.Home.37869 > 192.168.1.3.9888: Flags [P.], seq 1408:1496, ack 1, win 913, options [nop,nop,TS val 424921345 ecr 40271150], length 88
09:22:11.981547 IP Broadcom.Home.37869 > 192.168.1.3.9888: Flags [P.], seq 1496:1584, ack 1, win 913, options [nop,nop,TS val 424922347 ecr 40271401], length 88
09:22:12.984344 IP Broadcom.Home.37869 > 192.168.1.3.9888: Flags [P.], seq 1584:1672, ack 1, win 913, options [nop,nop,TS val 424923350 ecr 40271651], length 88
09:22:13.987382 IP Broadcom.Home.37869 > 192.168.1.3.9888: Flags [P.], seq 1672:1760, ack 1, win 913, options [nop,nop,TS val 424924353 ecr 40271902], length 88
09:22:14.990985 IP Broadcom.Home.37869 > 192.168.1.3.9888: Flags [P.], seq 1760:1848, ack 1, win 913, options [nop,nop,TS val 424925357 ecr 40272153], length 88
09:22:15.992784 IP Broadcom.Home.37869 > 192.168.1.3.9888: Flags [P.], seq 1848:1936, ack 1, win 913, options [nop,nop,TS val 424926359 ecr 40272404], length 88
09:22:16.995639 IP Broadcom.Home.37869 > 192.168.1.3.9888: Flags [P.], seq 1936:2024, ack 1, win 913, options [nop,nop,TS val 424927362 ecr 40272654], length 88
09:22:17.997470 IP Broadcom.Home.37869 > 192.168.1.3.9888: Flags [P.], seq 2024:2112, ack 1, win 913, options [nop,nop,TS val 424928364 ecr 40272905], length 88
09:22:19.000511 IP Broadcom.Home.37869 > 192.168.1.3.9888: Flags [P.], seq 2112:2200, ack 1, win 913, options [nop,nop,TS val 424929367 ecr 40273155], length 88
09:22:20.003333 IP Broadcom.Home.37869 > 192.168.1.3.9888: Flags [P.], seq 2200:2288, ack 1, win 913, options [nop,nop,TS val 424930370 ecr 40273406], length 88
09:22:21.006916 IP Broadcom.Home.37869 > 192.168.1.3.9888: Flags [P.], seq 2288:2376, ack 1, win 913, options [nop,nop,TS val 424931374 ecr 40273657], length 88
09:22:22.008709 IP Broadcom.Home.37869 > 192.168.1.3.9888: Flags [P.], seq 2376:2464, ack 1, win 913, options [nop,nop,TS val 424932376 ecr 40273908], length 88
09:22:23.010562 IP Broadcom.Home.37869 > 192.168.1.3.9888: Flags [P.], seq 2464:2552, ack 1, win 913, options [nop,nop,TS val 424933378 ecr 40274158], length 88
09:22:24.012329 IP Broadcom.Home.37869 > 192.168.1.3.9888: Flags [P.], seq 2552:2640, ack 1, win 913, options [nop,nop,TS val 424934380 ecr 40274409], length 88
09:22:25.015209 IP Broadcom.Home.37869 > 192.168.1.3.9888: Flags [P.], seq 2640:2728, ack 1, win 913, options [nop,nop,TS val 424935383 ecr 40274659], length 88
09:22:26.016960 IP Broadcom.Home.37869 > 192.168.1.3.9888: Flags [P.], seq 2728:2816, ack 1, win 913, options [nop,nop,TS val 424936385 ecr 40274910], length 88
09:22:27.018941 IP Broadcom.Home.37869 > 192.168.1.3.9888: Flags [P.], seq 2816:2904, ack 1, win 913, options [nop,nop,TS val 424937387 ecr 40275160], length 88
09:22:28.020622 IP Broadcom.Home.37869 > 192.168.1.3.9888: Flags [P.], seq 2904:2992, ack 1, win 913, options [nop,nop,TS val 424938389 ecr 40275411], length 88
09:22:29.022383 IP Broadcom.Home.37869 > 192.168.1.3.9888: Flags [P.], seq 2992:3080, ack 1, win 913, options [nop,nop,TS val 424939391 ecr 40275661], length 88
09:22:30.024199 IP Broadcom.Home.37869 > 192.168.1.3.9888: Flags [P.], seq 3080:3168, ack 1, win 913, options [nop,nop,TS val 424940393 ecr 40275912], length 88
09:22:31.026235 IP Broadcom.Home.37869 > 192.168.1.3.9888: Flags [P.], seq 3168:3256, ack 1, win 913, options [nop,nop,TS val 424941395 ecr 40276162], length 88
09:22:32.028965 IP Broadcom.Home.37869 > 192.168.1.3.9888: Flags [P.], seq 3256:3344, ack 1, win 913, options [nop,nop,TS val 424942398 ecr 40276412], length 88
09:22:33.031764 IP Broadcom.Home.37869 > 192.168.1.3.9888: Flags [P.], seq 3344:3432, ack 1, win 913, options [nop,nop,TS val 424943401 ecr 40276663], length 88
09:22:34.036281 IP Broadcom.Home.37869 > 192.168.1.3.9888: Flags [P.], seq 3432:3520, ack 1, win 913, options [nop,nop,TS val 424944406 ecr 40276914], length 88
09:22:35.038360 IP Broadcom.Home.37869 > 192.168.1.3.9888: Flags [P.], seq 3520:3608, ack 1, win 913, options [nop,nop,TS val 424945408 ecr 40277165], length 88
09:22:36.040173 IP Broadcom.Home.37869 > 192.168.1.3.9888: Flags [P.], seq 3608:3696, ack 1, win 913, options [nop,nop,TS val 424946410 ecr 40277416], length 88
09:22:37.042024 IP Broadcom.Home.37869 > 192.168.1.3.9888: Flags [P.], seq 3696:3784, ack 1, win 913, options [nop,nop,TS val 424947412 ecr 40277666], length 88
09:22:38.043906 IP Broadcom.Home.37869 > 192.168.1.3.9888: Flags [P.], seq 3784:3872, ack 1, win 913, options [nop,nop,TS val 424948414 ecr 40277916], length 88
09:22:39.045688 IP Broadcom.Home.37869 > 192.168.1.3.9888: Flags [P.], seq 3872:3960, ack 1, win 913, options [nop,nop,TS val 424949416 ecr 40278167], length 88
09:22:40.047399 IP Broadcom.Home.37869 > 192.168.1.3.9888: Flags [P.], seq 3960:4048, ack 1, win 913, options [nop,nop,TS val 424950418 ecr 40278417], length 88
09:22:41.049393 IP Broadcom.Home.37869 > 192.168.1.3.9888: Flags [P.], seq 4048:4136, ack 1, win 913, options [nop,nop,TS val 424951420 ecr 40278668], length 88
09:22:42.051121 IP Broadcom.Home.37869 > 192.168.1.3.9888: Flags [P.], seq 4136:4224, ack 1, win 913, options [nop,nop,TS val 424952422 ecr 40278918], length 88
09:22:43.054063 IP Broadcom.Home.37869 > 192.168.1.3.9888: Flags [P.], seq 4224:4312, ack 1, win 913, options [nop,nop,TS val 424953425 ecr 40279169], length 88
09:22:44.056067 IP Broadcom.Home.37869 > 192.168.1.3.9888: Flags [P.], seq 4312:4400, ack 1, win 913, options [nop,nop,TS val 424954427 ecr 40279419], length 88
09:22:45.058580 IP Broadcom.Home.37869 > 192.168.1.3.9888: Flags [P.], seq 4400:4488, ack 1, win 913, options [nop,nop,TS val 424955430 ecr 40279670], length 88
09:22:46.060415 IP Broadcom.Home.37869 > 192.168.1.3.9888: Flags [P.], seq 4488:4576, ack 1, win 913, options [nop,nop,TS val 424956432 ecr 40279921], length 88
09:22:47.062204 IP Broadcom.Home.37869 > 192.168.1.3.9888: Flags [P.], seq 4576:4664, ack 1, win 913, options [nop,nop,TS val 424957434 ecr 40280171], length 88
09:22:48.064189 IP Broadcom.Home.37869 > 192.168.1.3.9888: Flags [P.], seq 4664:4752, ack 1, win 913, options [nop,nop,TS val 424958436 ecr 40280421], length 88
09:22:49.065834 IP Broadcom.Home.37869 > 192.168.1.3.9888: Flags [P.], seq 4752:4840, ack 1, win 913, options [nop,nop,TS val 424959438 ecr 40280672], length 88
09:22:50.067626 IP Broadcom.Home.37869 > 192.168.1.3.9888: Flags [P.], seq 4840:4928, ack 1, win 913, options [nop,nop,TS val 424960440 ecr 40280922], length 88
09:22:51.069424 IP Broadcom.Home.37869 > 192.168.1.3.9888: Flags [P.], seq 4928:5016, ack 1, win 913, options [nop,nop,TS val 424961442 ecr 40281173], length 88
09:22:52.072356 IP Broadcom.Home.37869 > 192.168.1.3.9888: Flags [P.], seq 5016:5104, ack 1, win 913, options [nop,nop,TS val 424962445 ecr 40281423], length 88
09:22:53.074233 IP Broadcom.Home.37869 > 192.168.1.3.9888: Flags [P.], seq 5104:5192, ack 1, win 913, options [nop,nop,TS val 424963447 ecr 40281674], length 88
09:22:54.075952 IP Broadcom.Home.37869 > 192.168.1.3.9888: Flags [P.], seq 5192:5280, ack 1, win 913, options [nop,nop,TS val 424964449 ecr 40281924], length 88
09:22:55.077753 IP Broadcom.Home.37869 > 192.168.1.3.9888: Flags [P.], seq 5280:5368, ack 1, win 913, options [nop,nop,TS val 424965451 ecr 40282175], length 88
09:22:56.079529 IP Broadcom.Home.37869 > 192.168.1.3.9888: Flags [P.], seq 5368:5456, ack 1, win 913, options [nop,nop,TS val 424966453 ecr 40282425], length 88
09:22:57.081333 IP Broadcom.Home.37869 > 192.168.1.3.9888: Flags [P.], seq 5456:5544, ack 1, win 913, options [nop,nop,TS val 424967455 ecr 40282676], length 88
09:22:58.083177 IP Broadcom.Home.37869 > 192.168.1.3.9888: Flags [P.], seq 5544:5632, ack 1, win 913, options [nop,nop,TS val 424968457 ecr 40282926], length 88
09:22:59.085013 IP Broadcom.Home.37869 > 192.168.1.3.9888: Flags [P.], seq 5632:5720, ack 1, win 913, options [nop,nop,TS val 424969459 ecr 40283177], length 88
09:23:00.086798 IP Broadcom.Home.37869 > 192.168.1.3.9888: Flags [P.], seq 5720:5808, ack 1, win 913, options [nop,nop,TS val 424970461 ecr 40283427], length 88
09:23:01.088768 IP Broadcom.Home.37869 > 192.168.1.3.9888: Flags [P.], seq 5808:5896, ack 1, win 913, options [nop,nop,TS val 424971463 ecr 40283678], length 88
09:23:02.091741 IP Broadcom.Home.37869 > 192.168.1.3.9888: Flags [P.], seq 5896:5984, ack 1, win 913, options [nop,nop,TS val 424972466 ecr 40283928], length 88
09:23:03.094364 IP Broadcom.Home.37869 > 192.168.1.3.9888: Flags [P.], seq 5984:6072, ack 1, win 913, options [nop,nop,TS val 424973469 ecr 40284179], length 88
09:23:04.096284 IP Broadcom.Home.37869 > 192.168.1.3.9888: Flags [P.], seq 6072:6160, ack 1, win 913, options [nop,nop,TS val 424974471 ecr 40284430], length 88
09:23:05.098043 IP Broadcom.Home.37869 > 192.168.1.3.9888: Flags [P.], seq 6160:6248, ack 1, win 913, options [nop,nop,TS val 424975473 ecr 40284680], length 88
09:23:06.099897 IP Broadcom.Home.37869 > 192.168.1.3.9888: Flags [P.], seq 6248:6336, ack 1, win 913, options [nop,nop,TS val 424976475 ecr 40284930], length 88
09:23:07.101535 IP Broadcom.Home.37869 > 192.168.1.3.9888: Flags [P.], seq 6336:6424, ack 1, win 913, options [nop,nop,TS val 424977477 ecr 40285181], length 88
09:23:08.103372 IP Broadcom.Home.37869 > 192.168.1.3.9888: Flags [P.], seq 6424:6512, ack 1, win 913, options [nop,nop,TS val 424978479 ecr 40285431], length 88
09:23:09.105222 IP Broadcom.Home.37869 > 192.168.1.3.9888: Flags [P.], seq 6512:6600, ack 1, win 913, options [nop,nop,TS val 424979481 ecr 40285682], length 88
09:23:10.107083 IP Broadcom.Home.37869 > 192.168.1.3.9888: Flags [P.], seq 6600:6688, ack 1, win 913, options [nop,nop,TS val 424980483 ecr 40285932], length 88
09:23:11.109918 IP Broadcom.Home.37869 > 192.168.1.3.9888: Flags [P.], seq 6688:6776, ack 1, win 913, options [nop,nop,TS val 424981486 ecr 40286183], length 88
09:23:12.111703 IP Broadcom.Home.37869 > 192.168.1.3.9888: Flags [P.], seq 6776:6864, ack 1, win 913, options [nop,nop,TS val 424982488 ecr 40286433], length 88
09:23:13.113417 IP Broadcom.Home.37869 > 192.168.1.3.9888: Flags [P.], seq 6864:6952, ack 1, win 913, options [nop,nop,TS val 424983490 ecr 40286684], length 88
09:23:14.115316 IP Broadcom.Home.37869 > 192.168.1.3.9888: Flags [P.], seq 6952:7040, ack 1, win 913, options [nop,nop,TS val 424984492 ecr 40286934], length 88
09:23:15.117139 IP Broadcom.Home.37869 > 192.168.1.3.9888: Flags [P.], seq 7040:7128, ack 1, win 913, options [nop,nop,TS val 424985494 ecr 40287185], length 88
09:23:16.118918 IP Broadcom.Home.37869 > 192.168.1.3.9888: Flags [P.], seq 7128:7216, ack 1, win 913, options [nop,nop,TS val 424986496 ecr 40287435], length 88
09:23:17.120735 IP Broadcom.Home.37869 > 192.168.1.3.9888: Flags [P.], seq 7216:7304, ack 1, win 913, options [nop,nop,TS val 424987498 ecr 40287686], length 88
09:23:18.122570 IP Broadcom.Home.37869 > 192.168.1.3.9888: Flags [P.], seq 7304:7392, ack 1, win 913, options [nop,nop,TS val 424988500 ecr 40287936], length 88
09:23:19.124417 IP Broadcom.Home.37869 > 192.168.1.3.9888: Flags [P.], seq 7392:7480, ack 1, win 913, options [nop,nop,TS val 424989502 ecr 40288187], length 88
09:23:20.126243 IP Broadcom.Home.37869 > 192.168.1.3.9888: Flags [P.], seq 7480:7568, ack 1, win 913, options [nop,nop,TS val 424990504 ecr 40288437], length 88
09:23:21.129195 IP Broadcom.Home.37869 > 192.168.1.3.9888: Flags [P.], seq 7568:7656, ack 1, win 913, options [nop,nop,TS val 424991507 ecr 40288687], length 88
09:23:22.130979 IP Broadcom.Home.37869 > 192.168.1.3.9888: Flags [P.], seq 7656:7744, ack 1, win 913, options [nop,nop,TS val 424992509 ecr 40288938], length 88
09:23:23.132720 IP Broadcom.Home.37869 > 192.168.1.3.9888: Flags [P.], seq 7744:7832, ack 1, win 913, options [nop,nop,TS val 424993511 ecr 40289189], length 88
09:23:24.134574 IP Broadcom.Home.37869 > 192.168.1.3.9888: Flags [P.], seq 7832:7920, ack 1, win 913, options [nop,nop,TS val 424994513 ecr 40289439], length 88
09:23:25.136393 IP Broadcom.Home.37869 > 192.168.1.3.9888: Flags [P.], seq 7920:8008, ack 1, win 913, options [nop,nop,TS val 424995515 ecr 40289690], length 88
09:23:26.138209 IP Broadcom.Home.37869 > 192.168.1.3.9888: Flags [P.], seq 8008:8096, ack 1, win 913, options [nop,nop,TS val 424996517 ecr 40289940], length 88
09:23:27.140054 IP Broadcom.Home.37869 > 192.168.1.3.9888: Flags [P.], seq 8096:8184, ack 1, win 913, options [nop,nop,TS val 424997519 ecr 40290190], length 88
09:23:28.141864 IP Broadcom.Home.37869 > 192.168.1.3.9888: Flags [P.], seq 8184:8272, ack 1, win 913, options [nop,nop,TS val 424998521 ecr 40290441], length 88
09:23:29.143731 IP Broadcom.Home.37869 > 192.168.1.3.9888: Flags [P.], seq 8272:8360, ack 1, win 913, options [nop,nop,TS val 424999523 ecr 40290691], length 88
09:23:30.145590 IP Broadcom.Home.37869 > 192.168.1.3.9888: Flags [P.], seq 8360:8448, ack 1, win 913, options [nop,nop,TS val 425000525 ecr 40290942], length 88
09:23:31.148528 IP Broadcom.Home.37869 > 192.168.1.3.9888: Flags [P.], seq 8448:8536, ack 1, win 913, options [nop,nop,TS val 425001528 ecr 40291192], length 88
09:23:32.150258 IP Broadcom.Home.37869 > 192.168.1.3.9888: Flags [P.], seq 8536:8624, ack 1, win 913, options [nop,nop,TS val 425002530 ecr 40291443], length 88
09:23:33.152284 IP Broadcom.Home.37869 > 192.168.1.3.9888: Flags [P.], seq 8624:8712, ack 1, win 913, options [nop,nop,TS val 425003532 ecr 40291693], length 88
09:23:34.154015 IP Broadcom.Home.37869 > 192.168.1.3.9888: Flags [P.], seq 8712:8800, ack 1, win 913, options [nop,nop,TS val 425004534 ecr 40291944], length 88
09:23:35.155827 IP Broadcom.Home.37869 > 192.168.1.3.9888: Flags [P.], seq 8800:8888, ack 1, win 913, options [nop,nop,TS val 425005536 ecr 40292194], length 88
09:23:36.158553 IP Broadcom.Home.37869 > 192.168.1.3.9888: Flags [P.], seq 8888:8976, ack 1, win 913, options [nop,nop,TS val 425006539 ecr 40292445], length 88
09:23:37.161348 IP Broadcom.Home.37869 > 192.168.1.3.9888: Flags [P.], seq 8976:9064, ack 1, win 913, options [nop,nop,TS val 425007542 ecr 40292696], length 88
09:23:38.163302 IP Broadcom.Home.37869 > 192.168.1.3.9888: Flags [P.], seq 9064:9152, ack 1, win 913, options [nop,nop,TS val 425008544 ecr 40292946], length 88
09:23:39.165074 IP Broadcom.Home.37869 > 192.168.1.3.9888: Flags [P.], seq 9152:9240, ack 1, win 913, options [nop,nop,TS val 425009546 ecr 40293197], length 88
09:23:40.167031 IP Broadcom.Home.37869 > 192.168.1.3.9888: Flags [P.], seq 9240:9328, ack 1, win 913, options [nop,nop,TS val 425010548 ecr 40293447], length 88
09:23:41.169722 IP Broadcom.Home.37869 > 192.168.1.3.9888: Flags [P.], seq 9328:9416, ack 1, win 913, options [nop,nop,TS val 425011551 ecr 40293698], length 88
09:23:42.172509 IP Broadcom.Home.37869 > 192.168.1.3.9888: Flags [P.], seq 9416:9504, ack 1, win 913, options [nop,nop,TS val 425012554 ecr 40293948], length 88
09:23:43.175288 IP Broadcom.Home.37869 > 192.168.1.3.9888: Flags [P.], seq 9504:9592, ack 1, win 913, options [nop,nop,TS val 425013557 ecr 40294199], length 88
09:23:44.177178 IP Broadcom.Home.37869 > 192.168.1.3.9888: Flags [P.], seq 9592:9680, ack 1, win 913, options [nop,nop,TS val 425014559 ecr 40294450], length 88
09:23:45.178999 IP Broadcom.Home.37869 > 192.168.1.3.9888: Flags [P.], seq 9680:9768, ack 1, win 913, options [nop,nop,TS val 425015561 ecr 40294700], length 88
09:23:46.181812 IP Broadcom.Home.37869 > 192.168.1.3.9888: Flags [P.], seq 9768:9856, ack 1, win 913, options [nop,nop,TS val 425016564 ecr 40294951], length 88
09:23:47.184661 IP Broadcom.Home.37869 > 192.168.1.3.9888: Flags [P.], seq 9856:9944, ack 1, win 913, options [nop,nop,TS val 425017567 ecr 40295201], length 88
09:23:48.186464 IP Broadcom.Home.37869 > 192.168.1.3.9888: Flags [P.], seq 9944:10032, ack 1, win 913, options [nop,nop,TS val 425018569 ecr 40295452], length 88
09:23:49.188298 IP Broadcom.Home.37869 > 192.168.1.3.9888: Flags [P.], seq 10032:10120, ack 1, win 913, options [nop,nop,TS val 425019571 ecr 40295703], length 88
09:23:50.191105 IP Broadcom.Home.37869 > 192.168.1.3.9888: Flags [P.], seq 10120:10208, ack 1, win 913, options [nop,nop,TS val 425020574 ecr 40295953], length 88
09:23:51.192940 IP Broadcom.Home.37869 > 192.168.1.3.9888: Flags [P.], seq 10208:10296, ack 1, win 913, options [nop,nop,TS val 425021576 ecr 40296204], length 88
09:23:52.195760 IP Broadcom.Home.37869 > 192.168.1.3.9888: Flags [P.], seq 10296:10384, ack 1, win 913, options [nop,nop,TS val 425022579 ecr 40296454], length 88
09:23:53.197548 IP Broadcom.Home.37869 > 192.168.1.3.9888: Flags [P.], seq 10384:10472, ack 1, win 913, options [nop,nop,TS val 425023581 ecr 40296705], length 88
09:23:54.199364 IP Broadcom.Home.37869 > 192.168.1.3.9888: Flags [P.], seq 10472:10560, ack 1, win 913, options [nop,nop,TS val 425024583 ecr 40296955], length 88
09:23:55.201249 IP Broadcom.Home.37869 > 192.168.1.3.9888: Flags [P.], seq 10560:10648, ack 1, win 913, options [nop,nop,TS val 425025585 ecr 40297206], length 88
09:23:56.204061 IP Broadcom.Home.37869 > 192.168.1.3.9888: Flags [P.], seq 10648:10736, ack 1, win 913, options [nop,nop,TS val 425026588 ecr 40297456], length 88
09:23:57.206858 IP Broadcom.Home.37869 > 192.168.1.3.9888: Flags [P.], seq 10736:10824, ack 1, win 913, options [nop,nop,TS val 425027591 ecr 40297707], length 88
09:23:58.208636 IP Broadcom.Home.37869 > 192.168.1.3.9888: Flags [P.], seq 10824:10912, ack 1, win 913, options [nop,nop,TS val 425028593 ecr 40297958], length 88
09:23:59.210518 IP Broadcom.Home.37869 > 192.168.1.3.9888: Flags [P.], seq 10912:11000, ack 1, win 913, options [nop,nop,TS val 425029595 ecr 40298208], length 88
09:24:00.213323 IP Broadcom.Home.37869 > 192.168.1.3.9888: Flags [P.], seq 11000:11088, ack 1, win 913, options [nop,nop,TS val 425030598 ecr 40298459], length 88
09:24:01.216145 IP Broadcom.Home.37869 > 192.168.1.3.9888: Flags [P.], seq 11088:11176, ack 1, win 913, options [nop,nop,TS val 425031601 ecr 40298709], length 88
09:24:02.217947 IP Broadcom.Home.37869 > 192.168.1.3.9888: Flags [P.], seq 11176:11264, ack 1, win 913, options [nop,nop,TS val 425032603 ecr 40298960], length 88
09:24:03.219761 IP Broadcom.Home.37869 > 192.168.1.3.9888: Flags [P.], seq 11264:11352, ack 1, win 913, options [nop,nop,TS val 425033605 ecr 40299210], length 88
09:24:04.221670 IP Broadcom.Home.37869 > 192.168.1.3.9888: Flags [P.], seq 11352:11440, ack 1, win 913, options [nop,nop,TS val 425034607 ecr 40299461], length 88
09:24:05.224698 IP Broadcom.Home.37869 > 192.168.1.3.9888: Flags [P.], seq 11440:11528, ack 1, win 913, options [nop,nop,TS val 425035610 ecr 40299711], length 88
09:24:06.227324 IP Broadcom.Home.37869 > 192.168.1.3.9888: Flags [P.], seq 11528:11616, ack 1, win 913, options [nop,nop,TS val 425036613 ecr 40299962], length 88
09:24:07.230119 IP Broadcom.Home.37869 > 192.168.1.3.9888: Flags [P.], seq 11616:11704, ack 1, win 913, options [nop,nop,TS val 425037616 ecr 40300213], length 88
09:24:08.232963 IP Broadcom.Home.37869 > 192.168.1.3.9888: Flags [P.], seq 11704:11792, ack 1, win 913, options [nop,nop,TS val 425038619 ecr 40300463], length 88
09:24:09.234925 IP Broadcom.Home.37869 > 192.168.1.3.9888: Flags [P.], seq 11792:11880, ack 1, win 913, options [nop,nop,TS val 425039621 ecr 40300714], length 88
09:24:10.237663 IP Broadcom.Home.37869 > 192.168.1.3.9888: Flags [P.], seq 11880:11968, ack 1, win 913, options [nop,nop,TS val 425040624 ecr 40300965], length 88
09:24:11.239824 IP Broadcom.Home.37869 > 192.168.1.3.9888: Flags [P.], seq 11968:12026, ack 1, win 913, options [nop,nop,TS val 425041626 ecr 40301215], length 58
09:24:11.241354 IP Broadcom.Home.37869 > 192.168.1.3.9888: Flags [P.], seq 12026:12114, ack 1, win 913, options [nop,nop,TS val 425041628 ecr 40301466], length 88
09:24:12.244375 IP Broadcom.Home.37869 > 192.168.1.3.9888: Flags [P.], seq 12114:12202, ack 1, win 913, options [nop,nop,TS val 425042631 ecr 40301466], length 88
09:24:13.247087 IP Broadcom.Home.37869 > 192.168.1.3.9888: Flags [P.], seq 12202:12290, ack 1, win 913, options [nop,nop,TS val 425043634 ecr 40301717], length 88
09:24:14.249025 IP Broadcom.Home.37869 > 192.168.1.3.9888: Flags [P.], seq 12290:12378, ack 1, win 913, options [nop,nop,TS val 425044636 ecr 40301968], length 88
09:24:15.250760 IP Broadcom.Home.37869 > 192.168.1.3.9888: Flags [P.], seq 12378:12466, ack 1, win 913, options [nop,nop,TS val 425045638 ecr 40302218], length 88
09:24:16.252571 IP Broadcom.Home.37869 > 192.168.1.3.9888: Flags [P.], seq 12466:12554, ack 1, win 913, options [nop,nop,TS val 425046640 ecr 40302469], length 88
09:24:17.255428 IP Broadcom.Home.37869 > 192.168.1.3.9888: Flags [P.], seq 12554:12642, ack 1, win 913, options [nop,nop,TS val 425047643 ecr 40302719], length 88
09:24:18.257204 IP Broadcom.Home.37869 > 192.168.1.3.9888: Flags [P.], seq 12642:12730, ack 1, win 913, options [nop,nop,TS val 425048645 ecr 40302970], length 88
09:24:19.259060 IP Broadcom.Home.37869 > 192.168.1.3.9888: Flags [P.], seq 12730:12818, ack 1, win 913, options [nop,nop,TS val 425049647 ecr 40303220], length 88
09:24:20.261009 IP Broadcom.Home.37869 > 192.168.1.3.9888: Flags [P.], seq 12818:12906, ack 1, win 913, options [nop,nop,TS val 425050649 ecr 40303471], length 88
09:24:21.263704 IP Broadcom.Home.37869 > 192.168.1.3.9888: Flags [P.], seq 12906:12994, ack 1, win 913, options [nop,nop,TS val 425051652 ecr 40303721], length 88
09:24:22.266514 IP Broadcom.Home.37869 > 192.168.1.3.9888: Flags [P.], seq 12994:13082, ack 1, win 913, options [nop,nop,TS val 425052655 ecr 40303972], length 88
09:24:23.268370 IP Broadcom.Home.37869 > 192.168.1.3.9888: Flags [P.], seq 13082:13170, ack 1, win 913, options [nop,nop,TS val 425053657 ecr 40304223], length 88
09:24:24.270227 IP Broadcom.Home.37869 > 192.168.1.3.9888: Flags [P.], seq 13170:13258, ack 1, win 913, options [nop,nop,TS val 425054659 ecr 40304473], length 88
09:24:25.272017 IP Broadcom.Home.37869 > 192.168.1.3.9888: Flags [P.], seq 13258:13346, ack 1, win 913, options [nop,nop,TS val 425055661 ecr 40304723], length 88
09:24:26.274856 IP Broadcom.Home.37869 > 192.168.1.3.9888: Flags [P.], seq 13346:13434, ack 1, win 913, options [nop,nop,TS val 425056664 ecr 40304974], length 88
09:24:27.277644 IP Broadcom.Home.37869 > 192.168.1.3.9888: Flags [P.], seq 13434:13522, ack 1, win 913, options [nop,nop,TS val 425057667 ecr 40305225], length 88
09:24:28.280454 IP Broadcom.Home.37869 > 192.168.1.3.9888: Flags [P.], seq 13522:13610, ack 1, win 913, options [nop,nop,TS val 425058670 ecr 40305475], length 88
09:24:29.283306 IP Broadcom.Home.37869 > 192.168.1.3.9888: Flags [P.], seq 13610:13698, ack 1, win 913, options [nop,nop,TS val 425059673 ecr 40305726], length 88
09:24:30.285129 IP Broadcom.Home.37869 > 192.168.1.3.9888: Flags [P.], seq 13698:13786, ack 1, win 913, options [nop,nop,TS val 425060675 ecr 40305977], length 88
09:24:31.286970 IP Broadcom.Home.37869 > 192.168.1.3.9888: Flags [P.], seq 13786:13874, ack 1, win 913, options [nop,nop,TS val 425061677 ecr 40306227], length 88
09:24:32.288830 IP Broadcom.Home.37869 > 192.168.1.3.9888: Flags [P.], seq 13874:13962, ack 1, win 913, options [nop,nop,TS val 425062679 ecr 40306478], length 88
09:24:33.290568 IP Broadcom.Home.37869 > 192.168.1.3.9888: Flags [P.], seq 13962:14050, ack 1, win 913, options [nop,nop,TS val 425063681 ecr 40306728], length 88
09:24:34.293412 IP Broadcom.Home.37869 > 192.168.1.3.9888: Flags [P.], seq 14050:14138, ack 1, win 913, options [nop,nop,TS val 425064684 ecr 40306979], length 88
09:24:35.295237 IP Broadcom.Home.37869 > 192.168.1.3.9888: Flags [P.], seq 14138:14226, ack 1, win 913, options [nop,nop,TS val 425065686 ecr 40307229], length 88
09:24:36.298319 IP Broadcom.Home.37869 > 192.168.1.3.9888: Flags [P.], seq 14226:14314, ack 1, win 913, options [nop,nop,TS val 425066689 ecr 40307480], length 88
09:24:37.302167 IP Broadcom.Home.37869 > 192.168.1.3.9888: Flags [P.], seq 14314:14402, ack 1, win 913, options [nop,nop,TS val 425067693 ecr 40307731], length 88
09:24:38.304712 IP Broadcom.Home.37869 > 192.168.1.3.9888: Flags [P.], seq 14402:14490, ack 1, win 913, options [nop,nop,TS val 425068696 ecr 40307981], length 88
09:24:39.307567 IP Broadcom.Home.37869 > 192.168.1.3.9888: Flags [P.], seq 14490:14578, ack 1, win 913, options [nop,nop,TS val 425069699 ecr 40308232], length 88
09:24:40.309534 IP Broadcom.Home.37869 > 192.168.1.3.9888: Flags [P.], seq 14578:14666, ack 1, win 913, options [nop,nop,TS val 425070701 ecr 40308483], length 88
09:24:41.311200 IP Broadcom.Home.37869 > 192.168.1.3.9888: Flags [P.], seq 14666:14754, ack 1, win 913, options [nop,nop,TS val 425071703 ecr 40308733], length 88
09:24:42.314078 IP Broadcom.Home.37869 > 192.168.1.3.9888: Flags [P.], seq 14754:14842, ack 1, win 913, options [nop,nop,TS val 425072706 ecr 40308984], length 88
09:24:43.315792 IP Broadcom.Home.37869 > 192.168.1.3.9888: Flags [P.], seq 14842:14930, ack 1, win 913, options [nop,nop,TS val 425073708 ecr 40309234], length 88
09:24:44.318694 IP Broadcom.Home.37869 > 192.168.1.3.9888: Flags [P.], seq 14930:15018, ack 1, win 913, options [nop,nop,TS val 425074711 ecr 40309485], length 88
09:24:45.320499 IP Broadcom.Home.37869 > 192.168.1.3.9888: Flags [P.], seq 15018:15106, ack 1, win 913, options [nop,nop,TS val 425075713 ecr 40309736], length 88
09:24:46.323325 IP Broadcom.Home.37869 > 192.168.1.3.9888: Flags [P.], seq 15106:15194, ack 1, win 913, options [nop,nop,TS val 425076716 ecr 40309986], length 88
09:24:47.325162 IP Broadcom.Home.37869 > 192.168.1.3.9888: Flags [P.], seq 15194:15282, ack 1, win 913, options [nop,nop,TS val 425077718 ecr 40310237], length 88
09:24:48.326852 IP Broadcom.Home.37869 > 192.168.1.3.9888: Flags [P.], seq 15282:15370, ack 1, win 913, options [nop,nop,TS val 425078720 ecr 40310487], length 88
09:24:49.328797 IP Broadcom.Home.37869 > 192.168.1.3.9888: Flags [P.], seq 15370:15458, ack 1, win 913, options [nop,nop,TS val 425079722 ecr 40310738], length 88
09:24:50.330547 IP Broadcom.Home.37869 > 192.168.1.3.9888: Flags [P.], seq 15458:15546, ack 1, win 913, options [nop,nop,TS val 425080724 ecr 40310988], length 88
09:24:51.332404 IP Broadcom.Home.37869 > 192.168.1.3.9888: Flags [P.], seq 15546:15634, ack 1, win 913, options [nop,nop,TS val 425081726 ecr 40311239], length 88
09:24:52.334152 IP Broadcom.Home.37869 > 192.168.1.3.9888: Flags [P.], seq 15634:15722, ack 1, win 913, options [nop,nop,TS val 425082728 ecr 40311489], length 88
09:24:53.335959 IP Broadcom.Home.37869 > 192.168.1.3.9888: Flags [P.], seq 15722:15810, ack 1, win 913, options [nop,nop,TS val 425083730 ecr 40311739], length 88
09:24:54.339040 IP Broadcom.Home.37869 > 192.168.1.3.9888: Flags [P.], seq 15810:15898, ack 1, win 913, options [nop,nop,TS val 425084733 ecr 40311990], length 88
09:24:55.342602 IP Broadcom.Home.37869 > 192.168.1.3.9888: Flags [P.], seq 15898:15986, ack 1, win 913, options [nop,nop,TS val 425085737 ecr 40312241], length 88
09:24:56.345441 IP Broadcom.Home.37869 > 192.168.1.3.9888: Flags [P.], seq 15986:16074, ack 1, win 913, options [nop,nop,TS val 425086740 ecr 40312492], length 88
09:24:57.347302 IP Broadcom.Home.37869 > 192.168.1.3.9888: Flags [P.], seq 16074:16162, ack 1, win 913, options [nop,nop,TS val 425087742 ecr 40312742], length 88
09:24:58.350094 IP Broadcom.Home.37869 > 192.168.1.3.9888: Flags [P.], seq 16162:16250, ack 1, win 913, options [nop,nop,TS val 425088745 ecr 40312993], length 88
09:24:59.352935 IP Broadcom.Home.37869 > 192.168.1.3.9888: Flags [P.], seq 16250:16338, ack 1, win 913, options [nop,nop,TS val 425089748 ecr 40313243], length 88
09:25:00.354758 IP Broadcom.Home.37869 > 192.168.1.3.9888: Flags [P.], seq 16338:16426, ack 1, win 913, options [nop,nop,TS val 425090750 ecr 40313494], length 88
09:25:01.356602 IP Broadcom.Home.37869 > 192.168.1.3.9888: Flags [P.], seq 16426:16514, ack 1, win 913, options [nop,nop,TS val 425091752 ecr 40313745], length 88
09:25:02.359503 IP Broadcom.Home.37869 > 192.168.1.3.9888: Flags [P.], seq 16514:16602, ack 1, win 913, options [nop,nop,TS val 425092755 ecr 40313995], length 88
09:25:03.362196 IP Broadcom.Home.37869 > 192.168.1.3.9888: Flags [P.], seq 16602:16690, ack 1, win 913, options [nop,nop,TS val 425093758 ecr 40314246], length 88
09:25:04.364039 IP Broadcom.Home.37869 > 192.168.1.3.9888: Flags [P.], seq 16690:16778, ack 1, win 913, options [nop,nop,TS val 425094760 ecr 40314496], length 88
09:25:05.366876 IP Broadcom.Home.37869 > 192.168.1.3.9888: Flags [P.], seq 16778:16866, ack 1, win 913, options [nop,nop,TS val 425095763 ecr 40314747], length 88
09:25:06.368785 IP Broadcom.Home.37869 > 192.168.1.3.9888: Flags [P.], seq 16866:16954, ack 1, win 913, options [nop,nop,TS val 425096765 ecr 40314998], length 88
09:25:07.371498 IP Broadcom.Home.37869 > 192.168.1.3.9888: Flags [P.], seq 16954:17042, ack 1, win 913, options [nop,nop,TS val 425097768 ecr 40315248], length 88
09:25:08.374620 IP Broadcom.Home.37869 > 192.168.1.3.9888: Flags [P.], seq 17042:17130, ack 1, win 913, options [nop,nop,TS val 425098771 ecr 40315499], length 88
09:25:09.377173 IP Broadcom.Home.37869 > 192.168.1.3.9888: Flags [P.], seq 17130:17218, ack 1, win 913, options [nop,nop,TS val 425099774 ecr 40315750], length 88
09:25:10.379048 IP Broadcom.Home.37869 > 192.168.1.3.9888: Flags [P.], seq 17218:17306, ack 1, win 913, options [nop,nop,TS val 425100776 ecr 40316000], length 88
09:25:11.381868 IP Broadcom.Home.37869 > 192.168.1.3.9888: Flags [P.], seq 17306:17394, ack 1, win 913, options [nop,nop,TS val 425101779 ecr 40316251], length 88
09:25:12.383774 IP Broadcom.Home.37869 > 192.168.1.3.9888: Flags [P.], seq 17394:17482, ack 1, win 913, options [nop,nop,TS val 425102781 ecr 40316501], length 88
09:25:13.385429 IP Broadcom.Home.37869 > 192.168.1.3.9888: Flags [P.], seq 17482:17570, ack 1, win 913, options [nop,nop,TS val 425103783 ecr 40316752], length 88
09:25:14.388265 IP Broadcom.Home.37869 > 192.168.1.3.9888: Flags [P.], seq 17570:17658, ack 1, win 913, options [nop,nop,TS val 425104786 ecr 40317002], length 88
09:25:15.391201 IP Broadcom.Home.37869 > 192.168.1.3.9888: Flags [P.], seq 17658:17746, ack 1, win 913, options [nop,nop,TS val 425105789 ecr 40317253], length 88
09:25:16.393033 IP Broadcom.Home.37869 > 192.168.1.3.9888: Flags [P.], seq 17746:17834, ack 1, win 913, options [nop,nop,TS val 425106791 ecr 40317504], length 88
09:25:17.395871 IP Broadcom.Home.37869 > 192.168.1.3.9888: Flags [P.], seq 17834:17922, ack 1, win 913, options [nop,nop,TS val 425107794 ecr 40317754], length 88
09:25:18.398564 IP Broadcom.Home.37869 > 192.168.1.3.9888: Flags [P.], seq 17922:18010, ack 1, win 913, options [nop,nop,TS val 425108797 ecr 40318005], length 88
09:25:19.400358 IP Broadcom.Home.37869 > 192.168.1.3.9888: Flags [P.], seq 18010:18098, ack 1, win 913, options [nop,nop,TS val 425109799 ecr 40318256], length 88
09:25:20.403222 IP Broadcom.Home.37869 > 192.168.1.3.9888: Flags [P.], seq 18098:18186, ack 1, win 913, options [nop,nop,TS val 425110802 ecr 40318506], length 88
09:25:21.405048 IP Broadcom.Home.37869 > 192.168.1.3.9888: Flags [P.], seq 18186:18274, ack 1, win 913, options [nop,nop,TS val 425111804 ecr 40318757], length 88
09:25:22.407855 IP Broadcom.Home.37869 > 192.168.1.3.9888: Flags [P.], seq 18274:18362, ack 1, win 913, options [nop,nop,TS val 425112807 ecr 40319007], length 88
09:25:23.410645 IP Broadcom.Home.37869 > 192.168.1.3.9888: Flags [P.], seq 18362:18450, ack 1, win 913, options [nop,nop,TS val 425113810 ecr 40319258], length 88
09:25:24.412456 IP Broadcom.Home.37869 > 192.168.1.3.9888: Flags [P.], seq 18450:18538, ack 1, win 913, options [nop,nop,TS val 425114812 ecr 40319509], length 88
09:25:25.414306 IP Broadcom.Home.37869 > 192.168.1.3.9888: Flags [P.], seq 18538:18626, ack 1, win 913, options [nop,nop,TS val 425115814 ecr 40319759], length 88
09:25:26.416167 IP Broadcom.Home.37869 > 192.168.1.3.9888: Flags [P.], seq 18626:18714, ack 1, win 913, options [nop,nop,TS val 425116816 ecr 40320009], length 88
09:25:27.418974 IP Broadcom.Home.37869 > 192.168.1.3.9888: Flags [P.], seq 18714:18802, ack 1, win 913, options [nop,nop,TS val 425117819 ecr 40320260], length 88
09:25:28.421023 IP Broadcom.Home.37869 > 192.168.1.3.9888: Flags [P.], seq 18802:18890, ack 1, win 913, options [nop,nop,TS val 425118821 ecr 40320511], length 88
09:25:29.424770 IP Broadcom.Home.37869 > 192.168.1.3.9888: Flags [P.], seq 18890:18978, ack 1, win 913, options [nop,nop,TS val 425119825 ecr 40320761], length 88
09:25:30.426413 IP Broadcom.Home.37869 > 192.168.1.3.9888: Flags [P.], seq 18978:19066, ack 1, win 913, options [nop,nop,TS val 425120827 ecr 40321012], length 88
09:25:31.429199 IP Broadcom.Home.37869 > 192.168.1.3.9888: Flags [P.], seq 19066:19154, ack 1, win 913, options [nop,nop,TS val 425121830 ecr 40321263], length 88
09:25:32.431161 IP Broadcom.Home.37869 > 192.168.1.3.9888: Flags [P.], seq 19154:19242, ack 1, win 913, options [nop,nop,TS val 425122832 ecr 40321513], length 88
09:25:33.432867 IP Broadcom.Home.37869 > 192.168.1.3.9888: Flags [P.], seq 19242:19330, ack 1, win 913, options [nop,nop,TS val 425123834 ecr 40321764], length 88
09:25:34.434670 IP Broadcom.Home.37869 > 192.168.1.3.9888: Flags [P.], seq 19330:19418, ack 1, win 913, options [nop,nop,TS val 425124836 ecr 40322014], length 88
09:25:35.436559 IP Broadcom.Home.37869 > 192.168.1.3.9888: Flags [P.], seq 19418:19506, ack 1, win 913, options [nop,nop,TS val 425125838 ecr 40322265], length 88
09:25:36.440522 IP Broadcom.Home.37869 > 192.168.1.3.9888: Flags [P.], seq 19506:19594, ack 1, win 913, options [nop,nop,TS val 425126842 ecr 40322515], length 88
09:25:37.443156 IP Broadcom.Home.37869 > 192.168.1.3.9888: Flags [P.], seq 19594:19682, ack 1, win 913, options [nop,nop,TS val 425127845 ecr 40322766], length 88
09:25:38.445980 IP Broadcom.Home.37869 > 192.168.1.3.9888: Flags [P.], seq 19682:19770, ack 1, win 913, options [nop,nop,TS val 425128848 ecr 40323017], length 88
09:25:39.448839 IP Broadcom.Home.37869 > 192.168.1.3.9888: Flags [P.], seq 19770:19858, ack 1, win 913, options [nop,nop,TS val 425129851 ecr 40323267], length 88
09:25:40.451989 IP Broadcom.Home.37869 > 192.168.1.3.9888: Flags [P.], seq 19858:19946, ack 1, win 913, options [nop,nop,TS val 425130854 ecr 40323518], length 88
09:25:41.454454 IP Broadcom.Home.37869 > 192.168.1.3.9888: Flags [P.], seq 19946:20034, ack 1, win 913, options [nop,nop,TS val 425131857 ecr 40323769], length 88
09:25:42.456343 IP Broadcom.Home.37869 > 192.168.1.3.9888: Flags [P.], seq 20034:20122, ack 1, win 913, options [nop,nop,TS val 425132859 ecr 40324020], length 88
09:25:43.459120 IP Broadcom.Home.37869 > 192.168.1.3.9888: Flags [P.], seq 20122:20210, ack 1, win 913, options [nop,nop,TS val 425133862 ecr 40324270], length 88
09:25:44.460894 IP Broadcom.Home.37869 > 192.168.1.3.9888: Flags [P.], seq 20210:20298, ack 1, win 913, options [nop,nop,TS val 425134864 ecr 40324521], length 88
09:25:45.462949 IP Broadcom.Home.37869 > 192.168.1.3.9888: Flags [P.], seq 20298:20386, ack 1, win 913, options [nop,nop,TS val 425135866 ecr 40324771], length 88
09:25:46.465537 IP Broadcom.Home.37869 > 192.168.1.3.9888: Flags [P.], seq 20386:20474, ack 1, win 913, options [nop,nop,TS val 425136869 ecr 40325022], length 88
09:25:47.467594 IP Broadcom.Home.37869 > 192.168.1.3.9888: Flags [P.], seq 20474:20562, ack 1, win 913, options [nop,nop,TS val 425137871 ecr 40325272], length 88
09:25:48.471283 IP Broadcom.Home.37869 > 192.168.1.3.9888: Flags [P.], seq 20562:20650, ack 1, win 913, options [nop,nop,TS val 425138875 ecr 40325523], length 88
09:25:49.473972 IP Broadcom.Home.37869 > 192.168.1.3.9888: Flags [P.], seq 20650:20738, ack 1, win 913, options [nop,nop,TS val 425139878 ecr 40325774], length 88
09:25:50.475774 IP Broadcom.Home.37869 > 192.168.1.3.9888: Flags [P.], seq 20738:20826, ack 1, win 913, options [nop,nop,TS val 425140880 ecr 40326024], length 88
09:25:51.477618 IP Broadcom.Home.37869 > 192.168.1.3.9888: Flags [P.], seq 20826:20914, ack 1, win 913, options [nop,nop,TS val 425141882 ecr 40326275], length 88
09:25:52.479351 IP Broadcom.Home.37869 > 192.168.1.3.9888: Flags [P.], seq 20914:21002, ack 1, win 913, options [nop,nop,TS val 425142884 ecr 40326525], length 88
09:25:53.482284 IP Broadcom.Home.37869 > 192.168.1.3.9888: Flags [P.], seq 21002:21090, ack 1, win 913, options [nop,nop,TS val 425143887 ecr 40326776], length 88
09:25:54.484014 IP Broadcom.Home.37869 > 192.168.1.3.9888: Flags [P.], seq 21090:21178, ack 1, win 913, options [nop,nop,TS val 425144889 ecr 40327026], length 88
09:25:55.485942 IP Broadcom.Home.37869 > 192.168.1.3.9888: Flags [P.], seq 21178:21266, ack 1, win 913, options [nop,nop,TS val 425145891 ecr 40327277], length 88
09:25:56.487827 IP Broadcom.Home.37869 > 192.168.1.3.9888: Flags [P.], seq 21266:21354, ack 1, win 913, options [nop,nop,TS val 425146893 ecr 40327527], length 88
09:25:57.489515 IP Broadcom.Home.37869 > 192.168.1.3.9888: Flags [P.], seq 21354:21442, ack 1, win 913, options [nop,nop,TS val 425147895 ecr 40327778], length 88
09:25:58.492256 IP Broadcom.Home.37869 > 192.168.1.3.9888: Flags [P.], seq 21442:21530, ack 1, win 913, options [nop,nop,TS val 425148898 ecr 40328028], length 88
09:25:59.495082 IP Broadcom.Home.37869 > 192.168.1.3.9888: Flags [P.], seq 21530:21618, ack 1, win 913, options [nop,nop,TS val 425149901 ecr 40328279], length 88
